Title,URL,Description,Publication Icon,Not Safe For Work,Categories,Member Count,Show Member Count,Monthly Recurring Revenue (MRR),Show MRR,Ghost Rank,Featured,Feature Image,Text Color,Background Color,Accent Color,Language,MRR Members Rank,MRR Members Diff Rank,Show Iframe,Object ID,Created At,Updated At
BLAG (Better Letters Magazine),https://bl.ag/,Online and print publication informing and inspiring the international sign painting community. Join our adventures in sign painting for free today.,https://supapjpiqdfzuaordcdx.supabase.co/storage/v1/render/image/public/images/1661941118058-BLAG_Social_Profile_Pic_03.jpg?width=75&height=75&resize=contain,False,['art'],6313,True,,False,2219011,True,https://supapjpiqdfzuaordcdx.supabase.co/storage/v1/object/public/images/betterletters.png?width=600&height=426&resize=cover,#15171A,#D6DAE3,#759557,en,6313,3,True,83361f5e-b658-4daf-879a-346d71d16681,1658238420,1749733205
AdLand,https://adland.tv/,The world's largest collection of advertising,https://supapjpiqdfzuaordcdx.supabase.co/storage/v1/render/image/public/images/1745586536104-ad-favicon.png?width=75&height=75&resize=contain,False,['art'],96409,True,,False,-60654,False,,,,#d48538,en,96409,9,False,fadc42d9-ad4e-4ba8-83c6-9b965f1a8e78,1745444688,1749580714
Possibilities,https://www.possibilities.news/,In your inbox every Thursday: an art-filled love letter from a climate-concerned friend.,https://supapjpiqdfzuaordcdx.supabase.co/storage/v1/render/image/public/images/1747771322784-swirl-1.png?width=75&height=75&resize=contain,False,['art'],0,False,577,True,8999205,False,,,,#433985,en,5771.799999999999,2220,True,99101fc9-d2c9-4fa2-8d19-eaf0958db35e,1686668554,1749729636
BACKSTAGE Magazine | Markus Zohner Arts Company,https://backstage.zohner.com/,"Magazine & Newsletter: Novità, progetti attuali, corsi e incontri",https://supapjpiqdfzuaordcdx.supabase.co/storage/v1/render/image/public/images/1720631011941-Untitled-1.png?width=75&height=75&resize=contain,False,['art'],4156,True,,False,4640999,False,,,,#E7131A,it,4156,0,False,03080a7d-abfd-4b9f-b0a4-0d271b1049ad,1673741180,1749381236
Arcade from Koffler Arts,https://arcade.kofflerarts.org/,An ongoing inquiry into the art and ideas of our time. Published by Koffler Arts.,https://supapjpiqdfzuaordcdx.supabase.co/storage/v1/render/image/public/images/1727370428816-apple-touch-icon.png?width=75&height=75&resize=contain,False,['art'],4085,True,,False,558874,False,,,,#DA322A,en,4085,16,False,34117491-9f80-4f6b-b27c-976b8939a0b5,1691701276,1746046829
Make and Do,https://makeanddo.art/,Art and Culture with Andrew Harper. Writing. Picks. Interviews. Podcast.,https://supapjpiqdfzuaordcdx.supabase.co/storage/v1/render/image/public/images/1692104598380-MakeAndDofavicon-wider.ico?width=75&height=75&resize=contain,False,['art'],0,False,338,True,8664262,False,,,,#0400ff,en,3382.218,0,True,8c541212-79ed-4e37-b63a-528d57ee9a2c,1688366922,1748049487
The Art Newsletter,https://www.theartnewsletter.com/,Profound commentary for the modern creator.,https://supapjpiqdfzuaordcdx.supabase.co/storage/v1/render/image/public/images/1743467831796-TAN-Instagram-Logo-No-Arrow--1--3.png?width=75&height=75&resize=contain,False,['art'],1713,True,47,True,313135224,False,,,,#e34234,en,2183,105,True,d99eb337-dd57-49bd-a694-a1b75dbac595,1740690095,1749808824
Mushroom Head,https://www.mushroom-head.net/,"A blog/newsletter featuring comics about life, literature, art, parenthood, and myriad other subjects, by Claire Barliant.",https://supapjpiqdfzuaordcdx.supabase.co/storage/v1/render/image/public/images/1741993901443-mushroom%20head%20M%20logo%20drawn.jpg?width=75&height=75&resize=contain,False,['art'],263,True,111,True,10499607,False,,,,#d1912b,en,1370.2,2,True,ff55d356-2a0f-4d9f-a2fe-681ac57c88bf,1707156049,1748019750
TOMAGO HOUSE,https://www.tomagohouse.com/,"A newsletter/blog about the storytelling and comics by writer/artist Tri Vuong, creator of ""The Strange Tales of Oscar Zahn"" and co-creator of ""Everyday Hero Machine Boy"".",https://supapjpiqdfzuaordcdx.supabase.co/storage/v1/render/image/public/images/1694614913087-Tomago-House-Logo-PNG.png?width=75&height=75&resize=contain,False,['art'],963,True,39,True,86378053,False,,,,#f77151,en,1354.6,11,True,8467a713-4728-47e9-8aab-eca62fe3e365,1673964362,1748974520
Artisan Joy,https://www.artisanjoy.com/,"Amplifying the positive impact of art, craft and creativity on the community and economy",https://supapjpiqdfzuaordcdx.supabase.co/storage/v1/render/image/public/images/1716383247311-Artisan-Joy-Favicon.png?width=75&height=75&resize=contain,False,['art'],1095,True,,False,10475023,False,,,,#000000,en,1095,2,True,50175011-a7a0-421d-94dd-08721a259f34,1716383248,1749498244
Raskol Hidden Art,https://www.raskolhiddenart.com/,"Creating Whimsy with hoodies, art & screen-printing",https://supapjpiqdfzuaordcdx.supabase.co/storage/v1/render/image/public/images/1686240239137-RaskolLogo_Ghost.jpg?width=75&height=75&resize=contain,False,['art'],1006,True,,False,72057054,False,,,,#ff9f1a,en,1006,1,True,2ee584aa-47b9-4a28-8cfe-be8834ea30c5,1674339432,1748644200
Nonstndrd Creative,https://www.nonstndrd.com/,Multidisciplinary Art Portfolio & Newsletter by Kwasi Boyd-Bouldin,https://supapjpiqdfzuaordcdx.supabase.co/storage/v1/render/image/public/images/1746837425561-web-NonsBubble-Icon.png?width=75&height=75&resize=contain,False,['art'],388,True,40,True,10197963,False,,,,#1d1a1a,en,787.6,576,True,5bbe0f4f-3c6f-4df4-8ba8-7d8d79aeecbb,1733716081,1749513563
Avant,https://www.avant.dev/,Curatorial studio based in Mexico City that explores multiverses in creative ways through art with interdisciplinary formats in thought and matter.,https://supapjpiqdfzuaordcdx.supabase.co/storage/v1/render/image/public/images/1660785563818-AvantDev_Icon2022.png?width=75&height=75&resize=contain,False,['art'],741,True,,False,1120963,False,,,,#660099,en,741,32,True,93bd2960-8f99-4f02-839f-96aa723381e7,1660785313,1740614535
Amanda's Brews,https://newsletter.bookishbrews.com/,"Calling for a systematic cultural shift through art (books, stories, culture, politics & everything in between)",https://supapjpiqdfzuaordcdx.supabase.co/storage/v1/render/image/public/images/1748536507651-amanda%20profile%20picture.jpg?width=75&height=75&resize=contain,False,['art'],697,True,0,True,71637767,False,,,,#C5B9B2,en,697,1,True,e1d0a598-32d1-419f-ac87-b42af50aa0dd,1748530581,1746584438
Art Nun of Central Washington,https://www.artnun.blog/,A Visual Artist’s Journal of Discovery,https://supapjpiqdfzuaordcdx.supabase.co/storage/v1/render/image/public/images/1710047172272-artnun-favicon.png?width=75&height=75&resize=contain,False,['art'],76,True,50,True,10499867,False,,,,#f7ce46,en,576,0,True,e21d1d0f-4ed9-4812-a69a-62a771f791e6,1710047173,1709366411
Artists Resisting Exploitation (ARE),https://www.artistsresist.org/,"ARE works to future-proof the arts and unite independent artists of all disciplines against corporate exploitation, with a focus on Big Tech and generative AI. Subscribe for free or pay what you can!",https://supapjpiqdfzuaordcdx.supabase.co/storage/v1/render/image/public/images/1711492834790-Small%20under%201%20MB%20ARE%20image.png?width=75&height=75&resize=contain,False,['art'],15,True,50,True,11654119,False,,,,#ff1a75,en,515,0,True,1a6441d7-f800-4b97-9248-a53d455bc1f2,1711492837,1710264900
MakerGo,https://www.makergo.co.uk/,"Turn your craft into a career. Subscribe to our newsletter for tips, strategies, and resources to launch, grow, and monetise your craft business.",https://supapjpiqdfzuaordcdx.supabase.co/storage/v1/render/image/public/images/1699030614506-Makergo.com-1.png?width=75&height=75&resize=contain,False,['art'],514,True,,False,9999486,False,,,,#287f5c,en,514,30,True,c595fc64-5641-4a5c-8aac-4551b098e698,1699030615,1731451783
White Duck Editions BLOG,https://blog.whiteduckeditions.net/,"✖ Hello, welcome to the White Duck Editions blog and newsletter.",https://supapjpiqdfzuaordcdx.supabase.co/storage/v1/render/image/public/images/1713358290538-Duck-favacon.png?width=75&height=75&resize=contain,False,['art'],366,True,,False,30116544,False,,,,#E41823,en,366,0,True,82255031-4cf0-4fd4-8f3e-6cf28b483b9a,1713358292,1645020169
Terrill Welch,https://terrill-welch.ghost.io/,"Direct, curated and personal insights into new art shows, links to private viewing rooms, new releases, notices about what has sold and a glimpse into work-in-progress.",https://supapjpiqdfzuaordcdx.supabase.co/storage/v1/render/image/public/images/1669443326701-1669155239441-1669154985624-0B7C9DB9-6428-46FE-8C23-8A9BC4318F51.jpeg?width=75&height=75&resize=contain,False,['art'],238,True,,False,339462084,False,,,,#831100,en,238,0,True,a8e68b3d-b1ac-4bd7-9331-2c8b5c214961,1669154988,1747400444
Life Noticed,https://www.lifenoticed.com/,"Inspiration and encouragement for living a more intentional life through mindset, art, and journaling.",https://supapjpiqdfzuaordcdx.supabase.co/storage/v1/render/image/public/images/1709830002621-IMG_9401.jpeg?width=75&height=75&resize=contain,False,['art'],236,True,,False,7857499,False,,,,#50adb9,en,236,6,True,e020b966-41ea-4568-b892-d6fdf93ed916,1669604097,1744606487
Beyond the Studio with Jocelyn Elizabeth,https://jocelynelizabeth.ghost.io/,"Join me in and beyond the studio for an intimate behind-the-scenes look at my creative practice and life as an artist, writer and mom",https://supapjpiqdfzuaordcdx.supabase.co/storage/v1/render/image/public/images/1743507354794-IMG_3050.jpeg?width=75&height=75&resize=contain,False,['art'],230,True,,False,185575854,False,,,,#f16d97,en,230,5,True,fcc4bf5d-45b0-4fba-a197-856cc140b00d,1738595580,1749571085
AnArt4Life,https://www.anart4life.com/,AnArt4Life - gaining an appreciation of art through life,https://supapjpiqdfzuaordcdx.supabase.co/storage/v1/render/image/public/images/1714098470837-anart4life-logo.png?width=75&height=75&resize=contain,False,['art'],214,True,,False,3054425,False,,,,#008080,en,214,13,True,44d5b212-78ac-4fe7-8428-b754761ab3ad,1714098473,1732914026
Cyberdrifter Studio,https://cyberdrifter.studio/,"Exploring the art of grimdark sci-fi and fantasy miniatures through in-depth projects, tutorials, and more.",https://supapjpiqdfzuaordcdx.supabase.co/storage/v1/render/image/public/images/1733183668659-CyberDrifter_Logo_2.png?width=75&height=75&resize=contain,False,['art'],209,True,,False,6539962,False,,,,#666666,en,209,2,True,6b9004c7-1400-4d78-a291-ec89b80ea597,1678183175,1737131590
Fantastical Tales by Victoria Raikel,https://www.victoria-raikel.com/,"Subscribe now for free children's books, fairy tales, and amazing deals on fairies and gnomes.",https://supapjpiqdfzuaordcdx.supabase.co/storage/v1/render/image/public/images/1696074433045-object1.png?width=75&height=75&resize=contain,False,['art'],197,True,,False,136506363,False,,,,#ff80ff,en,197,7,True,7048ec2a-3957-4e0e-8478-c8e8b354b1bd,1696074434,1748221849
LATENT STUDIES,https://www.latentstudies.net/,unfixing the image: a writing series,https://supapjpiqdfzuaordcdx.supabase.co/storage/v1/render/image/public/images/1721688515975-2023_Silva_Twink%20Time%20at%20Barbizon_In%20the%20Wrist.jpg?width=75&height=75&resize=contain,False,['art'],178,True,,False,10499813,False,,,,#f439c8,en,178,0,True,1834a52c-8ea3-4c7f-b39c-8e05bc69a8c8,1721688517,1720232111
Alexandra Lucas,https://www.alexandralucas.co.uk/,"Alexandra Lucas is an artist and weaver primarily making on a backstrap loom. Her work is a personal quest for escapism, nostalgia and a sense of innocence.",https://supapjpiqdfzuaordcdx.supabase.co/storage/v1/render/image/public/images/1723632117275-ALW_roundel_red.png?width=75&height=75&resize=contain,False,['art'],171,True,0,True,26016044,False,,,,#b30000,en,171,3,True,87ea2c11-0a8f-49be-8f86-2139ee2caa6a,1680431156,1745764668
"Flesh, Bone, and Story",https://www.fleshboneandstory.com/,"A new site featuring the creative work of Chip Warren. Essay, fiction, and poetry. Audio coming soon.",https://supapjpiqdfzuaordcdx.supabase.co/storage/v1/render/image/public/images/1669609628301-fbs-2.png?width=75&height=75&resize=contain,False,['art'],168,True,,False,182595577,False,,,,#696969,en,168,4,True,d0700b76-6614-4367-b86b-efaaae0d228f,1669609631,1749795233
PARADISO,https://www.paradiso.zone/,"Otherworldly original game design, books, videos, miniatures, sculpture, and other creations from beyond, by Quadra",https://supapjpiqdfzuaordcdx.supabase.co/storage/v1/render/image/public/images/1734102886097-paradiso_circle.png?width=75&height=75&resize=contain,False,['art'],138,True,,False,103823704,False,,,,#FF1A75,en,138,6,True,bb7f1f33-2e87-48cc-94ee-5ef48465573f,1715305720,1748895354
Marius Jopen,https://blog.mariusjopen.com/,Working & Teaching in the field of AI,https://supapjpiqdfzuaordcdx.supabase.co/storage/v1/render/image/public/images/1737294523469-marius-jopen-mirrored.png?width=75&height=75&resize=contain,False,['art'],138,True,0,True,332650152,False,,,,#ea82ff,en,138,7,True,7f248ced-a7cc-4dd7-a995-d5916c305e24,1726510098,1749466410
Body of Work,https://bodyofwork.georgeweld.com/,"Tributary of the image/text watershed of the Hudson River. No ideas, no opinions, no discourse.",https://supapjpiqdfzuaordcdx.supabase.co/storage/v1/render/image/public/images/1706638606143-logo.jpg?width=75&height=75&resize=contain,False,['art'],117,True,,False,10499877,False,,,,#7a84a3,en,117,0,True,81e673e0-bf02-47de-a12c-385622cd9d20,1706638618,1706636446
Braveen Kumar,https://www.braveenkumar.com/,"Writer. Humorist. Tinkerer. Oscillating between sarcasm and introspection while I explore the intersection between tech, careers, and creativity.",https://supapjpiqdfzuaordcdx.supabase.co/storage/v1/render/image/public/images/1660686549386-BK-Logo--1-.png?width=75&height=75&resize=contain,False,['art'],100,True,,False,1045532,False,,,,#ffd672,en,100,2,True,e4b53af8-406d-4d89-8a65-260fc5fa1ce9,1660686420,1723982435
Lyly Dhommar,https://www.lylydhommar.com/,"Lyly Dhommar is a visual artist working primarily with pastel and paint. Her work explore the beauty of loneliness and stillness, a personal quest of escapism and calm.",https://supapjpiqdfzuaordcdx.supabase.co/storage/v1/render/image/public/images/1746339503583-IMG_1351-3.png?width=75&height=75&resize=contain,False,['art'],99,True,,False,132725183,False,,,,#b3c47f,en,99,0,True,a8dd5928-1bfa-409c-8af2-25f6804c1213,1746339504,1746647482
Smoke Signals,https://smokesignals.sharonchin.com/,"Letters from an artist living next to mangroves and an oil refinery. Art, ecology and community organizing in Port Dickson, Malaysia.",https://supapjpiqdfzuaordcdx.supabase.co/storage/v1/render/image/public/images/1716727911968-smoke-signal-icon.png?width=75&height=75&resize=contain,False,['art'],87,True,,False,55956693,False,,,,#cf390f,en,87,4,True,ba2a89e1-3966-4847-afa6-5e1ac42a80b2,1714353867,1749202570
TeddyBear & GeekyGirl,https://www.teddybear-n-geekygirl.com/,Finding the Funny in Life - Art and Words from a Neurodivergent Artist and her Tribe of Inner Demons,https://supapjpiqdfzuaordcdx.supabase.co/storage/v1/render/image/public/images/1688165063985-TB-GG-square-Logo.png?width=75&height=75&resize=contain,False,['art'],72,True,,False,58425723,False,,,,#9e78b0,en,72,9,True,b14d60ef-b1f6-4244-b9e0-673c25512a71,1688165064,1746585213
Benbo,https://benbo.ninja/,music & art,https://supapjpiqdfzuaordcdx.supabase.co/storage/v1/render/image/public/images/1732532655830-benbo-b-only-square400.png?width=75&height=75&resize=contain,False,['art'],69,True,0,True,47950696,False,,,,#ff3300,en,69,0,True,d2bb49b6-261d-491d-b52d-d5fb4768a5f1,1732532657,1732478379
chillbilldill.com,https://www.chillbilldill.com/,Selling Photos Online via Stock Photography & Print-on-Demand,https://supapjpiqdfzuaordcdx.supabase.co/storage/v1/render/image/public/images/1731808365120-billdilllogo5-1.png?width=75&height=75&resize=contain,False,['art'],55,True,,False,69144636,False,,,,#f96900,en,55,7,True,5fd080a0-5a44-4dd9-8c35-e8610d4650ef,1675279416,1708488396
the space in between,https://www.the-space-in-between.com/,"A life in art & writing. I'm an artist, writer and educator. I write about life, artists, books, teaching, social justice, reviews and more. Online, as in life, I'm as WYSIWYG as they come.",https://supapjpiqdfzuaordcdx.supabase.co/storage/v1/render/image/public/images/1739751997894-rabbit_duck_illusion_poster-r998d1fadf3ed4ab5a70c35690c708e4b_wvk_8byvr_306.jpg?width=75&height=75&resize=contain,False,['art'],50,True,,False,13896488,False,,,,#ddb322,en,50,12,True,2b8b6581-76f1-44cf-a2c4-8827d3721971,1739384349,1748046394
The Run Around Room,https://www.runaroundroom.com/,"Art by Liz Awesome, the Internet’s Matzoh Ball Soup. Queer. Jewish. Weekly.",https://supapjpiqdfzuaordcdx.supabase.co/storage/v1/render/image/public/images/1716131855017-IMG_1748.jpeg?width=75&height=75&resize=contain,False,['art'],42,True,1,True,346277473,False,,,,#ff0a0a,en,48.4,0,True,de2d3685-66cb-46f7-96cf-90b9a19ed161,1716131856,1715872107
WW Studios Members,https://members.wwstudios.org/,"Join now, make a difference where it counts. Creating to Glorify the Creator: movies, music & more.",https://supapjpiqdfzuaordcdx.supabase.co/storage/v1/render/image/public/images/1742833324437-2025_WW_Studios_HR_Logo_BLACK_Circlebg_optimized-1.png?width=75&height=75&resize=contain,False,['art'],41,True,0,True,10499956,False,,,,#ff9100,en,41,0,True,03434cae-9d8f-4427-a1a4-91013267189a,1742833325,1742684606
Sketches from Granada,https://blog.emmabolton.com/,"Celebrating moments of connection with strangers, friends and ourselves.",https://supapjpiqdfzuaordcdx.supabase.co/storage/v1/render/image/public/images/1749414336414-Favicon-Emma-Bolton.png?width=75&height=75&resize=contain,False,['art'],30,True,,False,10499968,False,,,,#d64082,en,30,0,True,39f185a1-374d-4576-b98a-2e82cb81a765,1749414337,1748808755
Iain Finlay Macleod's Blog,https://www.iainfmacleod.com/,"Hi, I am a writer based in Scotland. This blog aims to help writers with the craft and business of writing. I am also interested in strategies for being a better learner.",https://supapjpiqdfzuaordcdx.supabase.co/storage/v1/render/image/public/images/1736612401630-IFM.jpg?width=75&height=75&resize=contain,False,['art'],25,True,0,True,3557957,False,,,,#000000,en,25,1,True,44099be9-a8e7-4fe5-b031-c54944c3fda5,1736612403,1741021212
Jonathan Gardner,https://jonathangardner.photography/,Transforming Natural Beauty Into Timeless Art,https://supapjpiqdfzuaordcdx.supabase.co/storage/v1/render/image/public/images/1743173794424-Artboard-1.png?width=75&height=75&resize=contain,False,['art'],24,True,,False,493757,False,,,,#afd3ed,en,24,0,True,3ef3ab95-03ad-4244-bbdb-516020cd54ef,1742533028,1748712486
The Edwards Edition,https://www.edwardsedition.com/,Review & Commentary from Derek Edwards,https://supapjpiqdfzuaordcdx.supabase.co/storage/v1/render/image/public/images/1727736664161-Icon.png?width=75&height=75&resize=contain,False,['art'],14,True,0,True,10805399,False,,,,#000000,en,14,3,True,d8911b02-bb1f-4a27-8e42-356081085b0c,1660146831,1749512158
Osama Madlom,https://www.osamamadlom.com/,Photographer and filmmaker. Let's make memories together.,https://supapjpiqdfzuaordcdx.supabase.co/storage/v1/render/image/public/images/1729542500449-7F8B8EC2-159C-4E64-B584-EB9990E48D78.PNG?width=75&height=75&resize=contain,False,['art'],5,True,,False,10499994,False,,,,#000000,en,5,4,True,09e02ca8-72e4-4ba5-a0a0-1bf4e7007297,1670190131,1748259099
britneyknight,https://britneyknight.com/,"romance, books, stories, steamy Tropes: Billionaire, age gap, enemies to lovers, second chance, single dad",https://supapjpiqdfzuaordcdx.supabase.co/storage/v1/render/image/public/images/1709913607149-profile-picture-2.jpg?width=75&height=75&resize=contain,False,['art'],3,True,,False,9999997,False,,,,#FF1A75,en,3,0,False,626eafd9-bc33-482f-8abf-c02f74ad9698,1709913609,1704397374
Stumble Into Strange,https://stumble-into-strange.ghost.io/,Writing and Drawing,https://supapjpiqdfzuaordcdx.supabase.co/storage/v1/render/image/public/images/1743442889625-IMG_1844.jpeg?width=75&height=75&resize=contain,False,['art'],3,True,0,True,11499996,False,,,,#1968ff,en,3,0,True,edfe1945-269b-472d-92cc-a0cebe472404,1743442890,1742405019
HerrMontag,https://herrmontag.de/,~ Verschlungene Muster; Schreibt lyrische Kleinzeiler; findet das mit dem Fröhlichsein quatsch ~,https://supapjpiqdfzuaordcdx.supabase.co/storage/v1/render/image/public/images/1722021094657-IMG_8150.ico?width=75&height=75&resize=contain,False,['art'],3,True,,False,82434022,False,,,,#FF1A75,de,3,0,False,63fa5df6-c1f8-48bf-b6e4-cee9bdabd78a,1722021096,1721819167
Mike O'Hara,https://www.stoptryingstudios.com/,"Mike creates art exploring time and cycles, using whatever materials he can get his hands on.",https://supapjpiqdfzuaordcdx.supabase.co/storage/v1/render/image/public/images/1730056999651-Blossom-Loop-2.png?width=75&height=75&resize=contain,False,['art'],2,True,0,True,9999998,False,,,,#000000,en,2,0,True,8e2c8bff-6532-4195-83e9-be0afbc382a2,1730057001,1725470357
Zaesenok Cartoons,https://zaesenok.ghost.io/,Turn Your Vision into Profitable Animation,https://supapjpiqdfzuaordcdx.supabase.co/storage/v1/render/image/public/images/1725388197658-2-2.png?width=75&height=75&resize=contain,False,['art'],2,True,,False,10499997,False,,,,#150313,en,2,0,True,393af0b4-593e-40c9-bc84-cf289ebd1be4,1725388199,1725382469
Gingerwax Collective,https://blog.gingerwax.ca/,Art and ideas from the minds behind Gingerwax.,https://supapjpiqdfzuaordcdx.supabase.co/storage/v1/render/image/public/images/1708553520943-luffy_pfp.jpg?width=75&height=75&resize=contain,False,['art'],2,True,0,True,11499997,False,,,,#000000,en,2,0,True,e11d2443-c601-4a5b-9b73-b3ab5e19c1d7,1708553523,1708552097
Modern Contemporary Art Trends in NFT metaverse brand logos,https://www.moderncontemporaryartworktrends.com/,"Contemporary Modern Artwork trends in NFT metaverse brand logos with utility value for you, in this 2nd wave where collectors have a real keen eye.",https://supapjpiqdfzuaordcdx.supabase.co/storage/v1/render/image/public/images/1679167338993-Ethereum%202.0%20fork%20merge%20and%20the%20crazy%20hype%20around%20the%20event.-Ethereum%20developers%20Shanghai%20upgrade%20with%20shadow%20fork..png?width=75&height=75&resize=contain,False,['art'],1,True,,False,2779783,False,,,,#464149,en,1,0,True,e5a30ce7-2f6c-44b6-990c-ef32a1f02db7,1679167339,1749816487
WendyBlog,https://wendyblog.duckdns.org/,Toronto 3 weeks,https://supapjpiqdfzuaordcdx.supabase.co/storage/v1/render/image/public/images/1736675123649-24-11-06-05-50-34-0434-1.jpg?width=75&height=75&resize=contain,False,['art'],1,True,,False,10499998,False,,,,#f7f2f4,en,1,0,True,97a1d75a-64fa-4b88-ab0e-417a92239df2,1736675125,1736672260
My Red Light Life,https://my-red-light-life.ghost.io/,"Poetry, Photography, stories and ideas.",https://supapjpiqdfzuaordcdx.supabase.co/storage/v1/render/image/public/images/1747287099126-IMG_0928.jpeg?width=75&height=75&resize=contain,False,['art'],1,True,,False,11499998,False,,,,#ac83c7,en,1,0,True,bb1ff106-e366-4a86-bedc-d17ff44322dc,1747287099,1747266023
Méri,https://www.mariancristian.com/,...,https://supapjpiqdfzuaordcdx.supabase.co/storage/v1/render/image/public/images/1709479983856-lotus-5.png?width=75&height=75&resize=contain,False,['art'],1,True,,False,11499998,False,,,,#000000,en,1,0,True,5665d553-3466-4de2-a025-89039c2048ed,1709479985,1709478029
Olólùfè Collective,https://ololufe-collective.ghost.io/,"A space for marginalised people to share their self-expression with close friends, chosen family and lovers.",https://supapjpiqdfzuaordcdx.supabase.co/storage/v1/render/image/public/images/1706813744520-cc%20mm.png?width=75&height=75&resize=contain,False,['art'],1,True,0,True,11499998,False,,,,#ff1a75,en,1,0,True,0fa9c634-3985-46e4-8cff-c6c8df059b57,1706813745,1706808820
Tim Talks Theatre,https://timtalkstheatre.co.uk/,"Margate Based Theatre website providing west end, off westend, Uk and broadway news, reviews and content",https://supapjpiqdfzuaordcdx.supabase.co/storage/v1/render/image/public/images/1717844459561-tttwhitelogo-1.png?width=75&height=75&resize=contain,False,['art'],1,True,0,True,58495495,False,,,,#ff1919,en,1,0,True,2e5b1afa-b8e8-40f3-a0ca-e275398b7b6c,1717844461,1717841800
on many things randomly and in no particular order,https://anton.belodedenko.me/,blog mainly featuring technical articles and other random stuff,https://supapjpiqdfzuaordcdx.supabase.co/storage/v1/render/image/public/images/1740594748875-favicon.ico?width=75&height=75&resize=contain,False,['art'],0,False,,False,313487,False,,,,#FF1A75,en,0,0,True,689836f7-7f6e-4fa9-a36d-bbc171a64469,1740594751,1667686696
Just Looking,https://wearejustlooking.org/,"Newsletter, books, cards and experiments. A community-led project celebrating the slow, mindful and creative observation of everday life.",https://supapjpiqdfzuaordcdx.supabase.co/storage/v1/render/image/public/images/1730916089630-4.png?width=75&height=75&resize=contain,False,['art'],0,False,,False,974271,False,,,,#000000,en,0,0,False,9d9b17ea-38aa-4318-903b-1f31ca82b23b,1730916092,1729920388
Kekness,https://www.kekness.nl/,Digital outlet for all things awesome.,https://supapjpiqdfzuaordcdx.supabase.co/storage/v1/render/image/public/images/1710275492876-IMG_1863.png?width=75&height=75&resize=contain,False,['art'],0,False,,False,2143651,False,,,,#000000,nl,0,0,True,445fc1a0-31f2-4ecb-a85a-55748994a33f,1710275494,1710274099
Obras del País,https://www.obrasdelpais.com/,Explora la artesanía borinqueña // Explore artisans from Puerto Rico.,https://supapjpiqdfzuaordcdx.supabase.co/storage/v1/render/image/public/images/1666967883862-ODP-Logo-vector---med---blk-2.png?width=75&height=75&resize=contain,False,['art'],0,False,,False,4158444,False,,,,#D5921C,es,0,0,True,e735384f-7213-486c-9668-cf36652ab999,1666967885,1747766952
