Title,URL,Description,Publication Icon,Not Safe For Work,Categories,Member Count,Show Member Count,Monthly Recurring Revenue (MRR),Show MRR,Ghost Rank,Featured,Feature Image,Text Color,Background Color,Accent Color,Language,MRR Members Rank,MRR Members Diff Rank,Show Iframe,Object ID,Created At,Updated At
BLAG (Better Letters Magazine),https://bl.ag/,Online and print publication informing and inspiring the international sign painting community. Join our adventures in sign painting for free today.,https://supapjpiqdfzuaordcdx.supabase.co/storage/v1/render/image/public/images/1661941118058-BLAG_Social_Profile_Pic_03.jpg?width=75&height=75&resize=contain,False,['art'],6085,True,,False,2255451,True,https://supapjpiqdfzuaordcdx.supabase.co/storage/v1/object/public/images/betterletters.png?width=600&height=426&resize=cover,#15171A,#D6DAE3,#759557,en,6085,6,True,83361f5e-b658-4daf-879a-346d71d16681,1658238420,1738072822
BACKSTAGE Magazine | Markus Zohner Arts Company,https://backstage.zohner.com/,"Magazine & Newsletter: Novità, progetti attuali, corsi e incontri",https://supapjpiqdfzuaordcdx.supabase.co/storage/v1/render/image/public/images/1720631011941-Untitled-1.png?width=75&height=75&resize=contain,False,['art'],4150,True,,False,5500001,False,,,,#E7131A,it,4150,1,False,03080a7d-abfd-4b9f-b0a4-0d271b1049ad,1673741180,1737842149
Arcade from Koffler Arts,https://arcade.kofflerarts.org/,An ongoing inquiry into the art and ideas of our time. Published by Koffler Arts.,https://supapjpiqdfzuaordcdx.supabase.co/storage/v1/render/image/public/images/1727370428816-apple-touch-icon.png?width=75&height=75&resize=contain,False,['art'],4071,True,,False,5266282,False,,,,#DA322A,en,4071,2,False,34117491-9f80-4f6b-b27c-976b8939a0b5,1691701276,1737727538
Make and Do,https://makeanddo.art/,Art and Culture with Andrew Harper. Writing. Picks. Interviews. Podcast.,https://supapjpiqdfzuaordcdx.supabase.co/storage/v1/render/image/public/images/1692104598380-MakeAndDofavicon-wider.ico?width=75&height=75&resize=contain,False,['art'],0,False,353,True,31292065,False,,,,#0400ff,en,3531.4335,0,True,8c541212-79ed-4e37-b63a-528d57ee9a2c,1688366922,1734852486
Possibilities,https://www.possibilities.news/,A creative climate newsletter looking at the week's news from the heart.,https://supapjpiqdfzuaordcdx.supabase.co/storage/v1/render/image/public/images/1732723826740-swirl-1.png?width=75&height=75&resize=contain,False,['art'],0,False,321,True,18113677,False,,,,#433985,en,3208.8,0,True,99101fc9-d2c9-4fa2-8d19-eaf0958db35e,1686668554,1737637233
TOMAGO HOUSE,https://www.tomagohouse.com/,"A newsletter/blog about the storytelling and comics by writer/artist Tri Vuong, creator of ""The Strange Tales of Oscar Zahn"" and co-creator of ""Everyday Hero Machine Boy"".",https://supapjpiqdfzuaordcdx.supabase.co/storage/v1/render/image/public/images/1694614913087-Tomago-House-Logo-PNG.png?width=75&height=75&resize=contain,False,['art'],948,True,36,True,4954816,False,,,,#f77151,en,1309.6,4,True,8467a713-4728-47e9-8aab-eca62fe3e365,1673964362,1738105247
Artisan Joy,https://www.artisanjoy.com/,"Amplifying the positive impact of art, craft and creativity on the community and economy",https://supapjpiqdfzuaordcdx.supabase.co/storage/v1/render/image/public/images/1716383247311-Artisan-Joy-Favicon.png?width=75&height=75&resize=contain,False,['art'],1089,True,,False,10387019,False,,,,#000000,en,1089,0,True,50175011-a7a0-421d-94dd-08721a259f34,1716383248,1736969834
Raskol Hidden Art,https://www.raskolhiddenart.com/,"Creating Whimsy with hoodies, art & screen-printing",https://supapjpiqdfzuaordcdx.supabase.co/storage/v1/render/image/public/images/1686240239137-RaskolLogo_Ghost.jpg?width=75&height=75&resize=contain,False,['art'],1004,True,,False,304249347,False,,,,#ff9f1a,en,1004,3,True,2ee584aa-47b9-4a28-8cfe-be8834ea30c5,1674339432,1737062961
Avant,https://www.avant.dev/,Curatorial studio based in Mexico City that explores multiverses in creative ways through art with interdisciplinary formats in thought and matter.,https://supapjpiqdfzuaordcdx.supabase.co/storage/v1/render/image/public/images/1660785563818-AvantDev_Icon2022.png?width=75&height=75&resize=contain,False,['art'],739,True,,False,4460207,False,,,,#660099,en,739,30,True,93bd2960-8f99-4f02-839f-96aa723381e7,1660785313,1714445426
Art Nun of Central Washington,https://www.artnun.blog/,A Visual Artist’s Journal of Discovery,https://supapjpiqdfzuaordcdx.supabase.co/storage/v1/render/image/public/images/1710047172272-artnun-favicon.png?width=75&height=75&resize=contain,False,['art'],76,True,50,True,10499867,False,,,,#f7ce46,en,576,0,True,e21d1d0f-4ed9-4812-a69a-62a771f791e6,1710047173,1709366411
一稿计划 ｜ LASTONE,https://lastone.art/,To love and to be loved is the greatest happiness of life.(Happiness),https://supapjpiqdfzuaordcdx.supabase.co/storage/v1/render/image/public/images/1734259671277-favicon.ICO.png?width=75&height=75&resize=contain,False,['art'],568,True,,False,27637985,False,,,,#edc299,zh,568,0,True,9c7c5515-6cc4-4030-abe3-a696f7563eb6,1661440223,1733325114
Artists Resisting Exploitation (ARE),https://www.artistsresist.org/,"ARE works to future-proof the arts and unite independent artists of all disciplines against corporate exploitation, with a focus on Big Tech and generative AI. Subscribe for free or pay what you can!",https://supapjpiqdfzuaordcdx.supabase.co/storage/v1/render/image/public/images/1711492834790-Small%20under%201%20MB%20ARE%20image.png?width=75&height=75&resize=contain,False,['art'],15,True,50,True,11654119,False,,,,#ff1a75,en,515,0,True,1a6441d7-f800-4b97-9248-a53d455bc1f2,1711492837,1710264900
MakerGo,https://www.makergo.co.uk/,"Turn your craft into a career. Subscribe to our newsletter for tips, strategies, and resources to launch, grow, and monetise your craft business.",https://supapjpiqdfzuaordcdx.supabase.co/storage/v1/render/image/public/images/1699030614506-Makergo.com-1.png?width=75&height=75&resize=contain,False,['art'],513,True,,False,9999487,False,,,,#287f5c,en,513,29,True,c595fc64-5641-4a5c-8aac-4551b098e698,1699030615,1731451783
White Duck Editions BLOG,https://blog.whiteduckeditions.net/,"✖ Hello, welcome to the White Duck Editions blog and newsletter.",https://supapjpiqdfzuaordcdx.supabase.co/storage/v1/render/image/public/images/1713358290538-Duck-favacon.png?width=75&height=75&resize=contain,False,['art'],366,True,,False,30116544,False,,,,#E41823,en,366,0,True,82255031-4cf0-4fd4-8f3e-6cf28b483b9a,1713358292,1645020169
S.D. Cason,https://sdcason.com/,"A place where Catholic paintings, stock photos, and coloring pages are stored and categorized. All images are public domain or Creative Commons and completely free to download.",https://supapjpiqdfzuaordcdx.supabase.co/storage/v1/render/image/public/images/1660076461186-Shalone-Brand-Logo-Circle--small.png?width=75&height=75&resize=contain,False,['art'],354,True,,False,1184625,False,,,,#d91212,en,354,3,True,5102fd0e-e121-49e5-abdc-22105b930fc1,1660076462,1736646922
Mushroom Head,https://www.mushroom-head.net/,"Comics about my life in Oak Park, a suburb on the west side of Chicago.",https://supapjpiqdfzuaordcdx.supabase.co/storage/v1/render/image/public/images/1707156048555-SBDD_IG.jpg?width=75&height=75&resize=contain,False,['art'],248,True,,False,10499739,False,,,,#c6bcc0,en,248,0,True,ff55d356-2a0f-4d9f-a2fe-681ac57c88bf,1707156049,1706885217
Terrill Welch,https://terrill-welch.ghost.io/,"Direct, curated and personal insights into new art shows, links to private viewing rooms, new releases, notices about what has sold and a glimpse into work-in-progress.",https://supapjpiqdfzuaordcdx.supabase.co/storage/v1/render/image/public/images/1669443326701-1669155239441-1669154985624-0B7C9DB9-6428-46FE-8C23-8A9BC4318F51.jpeg?width=75&height=75&resize=contain,False,['art'],240,True,,False,10499748,False,,,,#831100,en,240,0,True,a8e68b3d-b1ac-4bd7-9331-2c8b5c214961,1669154988,1737122428
Life Noticed,https://www.lifenoticed.com/,"Inspiration and encouragement for living a more intentional life through mindset, art, and journaling.",https://supapjpiqdfzuaordcdx.supabase.co/storage/v1/render/image/public/images/1709830002621-IMG_9401.jpeg?width=75&height=75&resize=contain,False,['art'],222,True,,False,130601491,False,,,,#50adb9,en,222,1,True,e020b966-41ea-4568-b892-d6fdf93ed916,1669604097,1735180443
AnArt4Life,https://www.anart4life.com/,AnArt4Life - gaining an appreciation of art through life,https://supapjpiqdfzuaordcdx.supabase.co/storage/v1/render/image/public/images/1714098470837-anart4life-logo.png?width=75&height=75&resize=contain,False,['art'],211,True,,False,407737,False,,,,#008080,en,211,10,False,44d5b212-78ac-4fe7-8428-b754761ab3ad,1714098473,1732914026
Fantastical Tales by Victoria Raikel,https://www.victoria-raikel.com/,"Subscribe now for free children's books, fairy tales, and amazing deals on fairies and gnomes.",https://supapjpiqdfzuaordcdx.supabase.co/storage/v1/render/image/public/images/1696074433045-object1.png?width=75&height=75&resize=contain,False,['art'],183,True,,False,136769336,False,,,,#ff80ff,en,183,1,True,7048ec2a-3957-4e0e-8478-c8e8b354b1bd,1696074434,1737164877
LATENT STUDIES,https://www.latentstudies.net/,unfixing the image: a writing series,https://supapjpiqdfzuaordcdx.supabase.co/storage/v1/render/image/public/images/1721688515975-2023_Silva_Twink%20Time%20at%20Barbizon_In%20the%20Wrist.jpg?width=75&height=75&resize=contain,False,['art'],178,True,,False,10499813,False,,,,#f439c8,en,178,0,True,1834a52c-8ea3-4c7f-b39c-8e05bc69a8c8,1721688517,1720232111
"Flesh, Bone, and Story",https://www.fleshboneandstory.com/,"A new site featuring the creative work of Chip Warren. Essay, fiction, and poetry. Audio coming soon.",https://supapjpiqdfzuaordcdx.supabase.co/storage/v1/render/image/public/images/1669609628301-fbs-2.png?width=75&height=75&resize=contain,False,['art'],167,True,,False,10499824,False,,,,#696969,en,167,3,True,d0700b76-6614-4367-b86b-efaaae0d228f,1669609631,1737804552
Alexandra Lucas,https://www.alexandralucas.co.uk/,"Alexandra Lucas is an artist and weaver primarily making on a backstrap loom. Her work is a personal quest for escapism, nostalgia and a sense of innocence.",https://supapjpiqdfzuaordcdx.supabase.co/storage/v1/render/image/public/images/1723632117275-ALW_roundel_red.png?width=75&height=75&resize=contain,False,['art'],161,True,0,True,3253290,False,,,,#b30000,en,161,11,True,87ea2c11-0a8f-49be-8f86-2139ee2caa6a,1680431156,1736679622
Cyberdrifter Studio,https://cyberdrifter.studio/,"Exploring the art of grimdark sci-fi and fantasy miniatures through in-depth projects, tutorials, and more.",https://supapjpiqdfzuaordcdx.supabase.co/storage/v1/render/image/public/images/1733183668659-CyberDrifter_Logo_2.png?width=75&height=75&resize=contain,False,['art'],151,True,,False,312337810,False,,,,#666666,en,151,20,True,6b9004c7-1400-4d78-a291-ec89b80ea597,1678183175,1737131590
Body of Work,https://bodyofwork.georgeweld.com/,"Tributary of the image/text watershed of the Hudson River. No ideas, no opinions, no discourse.",https://supapjpiqdfzuaordcdx.supabase.co/storage/v1/render/image/public/images/1706638606143-logo.jpg?width=75&height=75&resize=contain,False,['art'],117,True,,False,10499877,False,,,,#7a84a3,en,117,0,True,81e673e0-bf02-47de-a12c-385622cd9d20,1706638618,1706636446
Monochromatic Aberration,https://mnchrm.co/,"Documenting my path towards the examined life. Curiosity, creativity, and (hopefully!) insight, through the lens of photography, writing, study, art and beauty, and my life.",https://supapjpiqdfzuaordcdx.supabase.co/storage/v1/render/image/public/images/1735662042396-android-chrome-512x512-1.png?width=75&height=75&resize=contain,False,['art'],107,True,,False,12098917,False,,,,#FF98B6,en,107,3,False,d69eefb1-5dac-48f8-9e05-74dd0eb350fa,1680972807,1737724895
Marius Jopen,https://blog.mariusjopen.com/,Working & Teaching in the field of AI,https://supapjpiqdfzuaordcdx.supabase.co/storage/v1/render/image/public/images/1737294523469-marius-jopen-mirrored.png?width=75&height=75&resize=contain,False,['art'],106,True,0,True,101061645,False,,,,#ea82ff,en,106,1,True,7f248ced-a7cc-4dd7-a995-d5916c305e24,1726510098,1737906868
Braveen Kumar,https://www.braveenkumar.com/,"Writer. Humorist. Tinkerer. Oscillating between sarcasm and introspection while I explore the intersection between tech, careers, and creativity.",https://supapjpiqdfzuaordcdx.supabase.co/storage/v1/render/image/public/images/1660686549386-BK-Logo--1-.png?width=75&height=75&resize=contain,False,['art'],99,True,,False,962252,False,,,,#ffd672,en,99,1,True,e4b53af8-406d-4d89-8a65-260fc5fa1ce9,1660686420,1723982435
PARADISO,https://www.paradiso.zone/,"Otherworldly original game design, books, videos, miniatures, sculpture, and other creations from beyond, by Quadra",https://supapjpiqdfzuaordcdx.supabase.co/storage/v1/render/image/public/images/1734102886097-paradiso_circle.png?width=75&height=75&resize=contain,False,['art'],94,True,,False,80192542,False,,,,#FF1A75,en,94,11,True,bb7f1f33-2e87-48cc-94ee-5ef48465573f,1715305720,1737664139
Smoke Signals,https://smokesignals.sharonchin.com/,"Letters from an artist living next to mangroves and an oil refinery. Art, ecology and community organizing in Port Dickson, Malaysia.",https://supapjpiqdfzuaordcdx.supabase.co/storage/v1/render/image/public/images/1716727911968-smoke-signal-icon.png?width=75&height=75&resize=contain,False,['art'],78,True,,False,90560707,False,,,,#cf390f,en,78,9,True,ba2a89e1-3966-4847-afa6-5e1ac42a80b2,1714353867,1734187924
Benbo,https://benbo.ninja/,music & art,https://supapjpiqdfzuaordcdx.supabase.co/storage/v1/render/image/public/images/1732532655830-benbo-b-only-square400.png?width=75&height=75&resize=contain,False,['art'],69,True,0,True,47950696,False,,,,#ff3300,en,69,0,True,d2bb49b6-261d-491d-b52d-d5fb4768a5f1,1732532657,1732478379
TeddyBear & GeekyGirl,https://www.teddybear-n-geekygirl.com/,Finding the Funny in Life - Art and Words from a Neurodivergent Artist and her Tribe of Inner Demons,https://supapjpiqdfzuaordcdx.supabase.co/storage/v1/render/image/public/images/1688165063985-TB-GG-square-Logo.png?width=75&height=75&resize=contain,False,['art'],66,True,,False,119964005,False,,,,#9e78b0,en,66,3,True,b14d60ef-b1f6-4244-b9e0-673c25512a71,1688165064,1737589024
chillbilldill.com,https://www.chillbilldill.com/,Selling Photos Online via Stock Photography & Print-on-Demand,https://supapjpiqdfzuaordcdx.supabase.co/storage/v1/render/image/public/images/1731808365120-billdilllogo5-1.png?width=75&height=75&resize=contain,False,['art'],49,True,,False,70551301,False,,,,#f96900,en,49,1,True,5fd080a0-5a44-4dd9-8c35-e8610d4650ef,1675279416,1708488396
The Run Around Room,https://www.runaroundroom.com/,"Art by Liz Awesome, the Internet’s Matzoh Ball Soup. Queer. Jewish. Weekly.",https://supapjpiqdfzuaordcdx.supabase.co/storage/v1/render/image/public/images/1716131855017-IMG_1748.jpeg?width=75&height=75&resize=contain,False,['art'],42,True,1,True,346277473,False,,,,#ff0a0a,en,48.4,0,True,de2d3685-66cb-46f7-96cf-90b9a19ed161,1716131856,1715872107
Iain Finlay Macleod's Blog,https://www.iainfmacleod.com/,"Hi, I am a writer based in Scotland. This blog aims to help writers with the craft and business of writing. I am also interested in strategies for being a better learner.",https://supapjpiqdfzuaordcdx.supabase.co/storage/v1/render/image/public/images/1736612401630-IFM.jpg?width=75&height=75&resize=contain,False,['art'],24,True,0,True,24845320,False,,,,#000000,en,24,0,True,44099be9-a8e7-4fe5-b031-c54944c3fda5,1736612403,1737911903
Ryan Hamilton,https://www.ryanhamilton.work/,"Writing & reviews about theatre, performance, and dramaturgy in Narrm (Melbourne)",https://supapjpiqdfzuaordcdx.supabase.co/storage/v1/render/image/public/images/1702525210625-Artboard-2.png?width=75&height=75&resize=contain,False,['art'],22,True,,False,10499976,False,,,,#df2097,en,22,0,True,e9e0e3b6-04a0-4751-8eaf-712668befc90,1702525211,1702102001
The Edwards Edition,https://www.edwardsedition.com/,Review & Commentary from Derek Edwards,https://supapjpiqdfzuaordcdx.supabase.co/storage/v1/render/image/public/images/1727736664161-Icon.png?width=75&height=75&resize=contain,False,['art'],12,True,0,True,747402,False,,,,#000000,en,12,1,True,d8911b02-bb1f-4a27-8e42-356081085b0c,1660146831,1738027229
Claudia Vaduvescu,https://www.claudiavaduvescu.com/,"This site it's about eclectic self-improvement—documenting my insight into starting a business, learning new skills, and living more with intention.",https://supapjpiqdfzuaordcdx.supabase.co/storage/v1/render/image/public/images/1668537378601-Val-de-ocean-Hipnotizant-Vedere-Aeriana--Citat-Instagram.png?width=75&height=75&resize=contain,False,['art'],5,True,0,True,9999995,False,,,,#8700f5,en,5,1,True,fa4cb4ed-463d-43d3-8892-9888301cc727,1668537383,1725063906
Osama Madlom,https://www.osamamadlom.com/,Photographer and filmmaker. Let's make memories together.,https://supapjpiqdfzuaordcdx.supabase.co/storage/v1/render/image/public/images/1729542500449-7F8B8EC2-159C-4E64-B584-EB9990E48D78.PNG?width=75&height=75&resize=contain,False,['art'],5,True,,False,10499994,False,,,,#000000,en,5,4,True,09e02ca8-72e4-4ba5-a0a0-1bf4e7007297,1670190131,1737752517
britneyknight,https://britneyknight.com/,"romance, books, stories, steamy Tropes: Billionaire, age gap, enemies to lovers, second chance, single dad",https://supapjpiqdfzuaordcdx.supabase.co/storage/v1/render/image/public/images/1709913607149-profile-picture-2.jpg?width=75&height=75&resize=contain,False,['art'],3,True,,False,9999997,False,,,,#FF1A75,en,3,0,False,626eafd9-bc33-482f-8abf-c02f74ad9698,1709913609,1704397374
HerrMontag,https://herrmontag.de/,~ Verschlungene Muster; Schreibt lyrische Kleinzeiler; findet das mit dem Fröhlichsein quatsch ~,https://supapjpiqdfzuaordcdx.supabase.co/storage/v1/render/image/public/images/1722021094657-IMG_8150.ico?width=75&height=75&resize=contain,False,['art'],3,True,,False,82434022,False,,,,#FF1A75,de,3,0,False,63fa5df6-c1f8-48bf-b6e4-cee9bdabd78a,1722021096,1721819167
Mike O'Hara,https://www.stoptryingstudios.com/,"Mike creates art exploring time and cycles, using whatever materials he can get his hands on.",https://supapjpiqdfzuaordcdx.supabase.co/storage/v1/render/image/public/images/1730056999651-Blossom-Loop-2.png?width=75&height=75&resize=contain,False,['art'],2,True,0,True,9999998,False,,,,#000000,en,2,0,True,8e2c8bff-6532-4195-83e9-be0afbc382a2,1730057001,1725470357
Zaesenok Cartoons,https://zaesenok.ghost.io/,Turn Your Vision into Profitable Animation,https://supapjpiqdfzuaordcdx.supabase.co/storage/v1/render/image/public/images/1725388197658-2-2.png?width=75&height=75&resize=contain,False,['art'],2,True,,False,10499997,False,,,,#150313,en,2,0,True,393af0b4-593e-40c9-bc84-cf289ebd1be4,1725388199,1725382469
Gingerwax Collective,https://blog.gingerwax.ca/,Art and ideas from the minds behind Gingerwax.,https://supapjpiqdfzuaordcdx.supabase.co/storage/v1/render/image/public/images/1708553520943-luffy_pfp.jpg?width=75&height=75&resize=contain,False,['art'],2,True,0,True,11499997,False,,,,#000000,en,2,0,True,e11d2443-c601-4a5b-9b73-b3ab5e19c1d7,1708553523,1708552097
WendyBlog,https://wendyblog.duckdns.org/,Toronto 3 weeks,https://supapjpiqdfzuaordcdx.supabase.co/storage/v1/render/image/public/images/1736675123649-24-11-06-05-50-34-0434-1.jpg?width=75&height=75&resize=contain,False,['art'],1,True,,False,10499998,False,,,,#f7f2f4,en,1,0,True,97a1d75a-64fa-4b88-ab0e-417a92239df2,1736675125,1736672260
Eric Ravenwolf Art and Mental Health Blog,https://eric-ravenwolf-art-and-mental-health-blog.ghost.io/,This is a place I share my art and mental health journey.,https://supapjpiqdfzuaordcdx.supabase.co/storage/v1/render/image/public/images/1737468400292-Screenshot_20250121-053737.png?width=75&height=75&resize=contain,False,['art'],1,True,0,True,10499998,False,,,,#46383d,en,1,0,True,294ff5f0-c6ba-48c1-b790-94beab6c3234,1737468401,1737461589
Méri,https://www.mariancristian.com/,...,https://supapjpiqdfzuaordcdx.supabase.co/storage/v1/render/image/public/images/1709479983856-lotus-5.png?width=75&height=75&resize=contain,False,['art'],1,True,,False,11499998,False,,,,#000000,en,1,0,True,5665d553-3466-4de2-a025-89039c2048ed,1709479985,1709478029
Olólùfè Collective,https://ololufe-collective.ghost.io/,"A space for marginalised people to share their self-expression with close friends, chosen family and lovers.",https://supapjpiqdfzuaordcdx.supabase.co/storage/v1/render/image/public/images/1706813744520-cc%20mm.png?width=75&height=75&resize=contain,False,['art'],1,True,0,True,11499998,False,,,,#ff1a75,en,1,0,True,0fa9c634-3985-46e4-8cff-c6c8df059b57,1706813745,1706808820
Modern Contemporary Art Trends in NFT metaverse brand logos,https://www.moderncontemporaryartworktrends.com/,"Contemporary Modern Artwork trends in NFT metaverse brand logos with utility value for you, in this 2nd wave where collectors have a real keen eye.",https://supapjpiqdfzuaordcdx.supabase.co/storage/v1/render/image/public/images/1679167338993-Ethereum%202.0%20fork%20merge%20and%20the%20crazy%20hype%20around%20the%20event.-Ethereum%20developers%20Shanghai%20upgrade%20with%20shadow%20fork..png?width=75&height=75&resize=contain,False,['art'],1,True,,False,45818574,False,,,,#464149,en,1,0,True,e5a30ce7-2f6c-44b6-990c-ef32a1f02db7,1679167339,1738068044
Tim Talks Theatre,https://timtalkstheatre.co.uk/,"Margate Based Theatre website providing west end, off westend, Uk and broadway news, reviews and content",https://supapjpiqdfzuaordcdx.supabase.co/storage/v1/render/image/public/images/1717844459561-tttwhitelogo-1.png?width=75&height=75&resize=contain,False,['art'],1,True,0,True,58495495,False,,,,#ff1919,en,1,0,True,2e5b1afa-b8e8-40f3-a0ca-e275398b7b6c,1717844461,1717841800
Just Looking,https://wearejustlooking.org/,"Newsletter, books, cards and experiments. A community-led project celebrating the slow, mindful and creative observation of everday life.",https://supapjpiqdfzuaordcdx.supabase.co/storage/v1/render/image/public/images/1730916089630-4.png?width=75&height=75&resize=contain,False,['art'],0,False,,False,974271,False,,,,#000000,en,0,0,False,9d9b17ea-38aa-4318-903b-1f31ca82b23b,1730916092,1729920388
Iride Podcast,https://www.iride.art/,Il mondo attraverso gli occhi di artistə LGBTQ+,https://supapjpiqdfzuaordcdx.supabase.co/storage/v1/render/image/public/images/1719392303721-logo-youtube-5-2.png?width=75&height=75&resize=contain,False,['art'],0,False,,False,1201567,False,,,,#ff1a75,it,0,0,False,171b920d-4898-4b0e-865c-aa5bd83698d1,1712224702,1719390053
Kekness,https://www.kekness.nl/,Digital outlet for all things awesome.,https://supapjpiqdfzuaordcdx.supabase.co/storage/v1/render/image/public/images/1710275492876-IMG_1863.png?width=75&height=75&resize=contain,False,['art'],0,False,,False,2143651,False,,,,#000000,nl,0,0,True,445fc1a0-31f2-4ecb-a85a-55748994a33f,1710275494,1710274099
Immutable Collective,https://immutablecollective.art/,French generative artists collective,https://supapjpiqdfzuaordcdx.supabase.co/storage/v1/render/image/public/images/1692056508541-logo-pink---1000px.png?width=75&height=75&resize=contain,False,['art'],0,False,,False,3956378,False,,,,#000000,en,0,0,False,03cce9e5-393b-48b5-84d4-2e14088817e2,1692056509,1706692074
Spurenkreis,https://spurenkreis.net/,"Werkstatt, Kunstraum & Verlag...",https://supapjpiqdfzuaordcdx.supabase.co/storage/v1/render/image/public/images/1714647925084-Spurenkreis_Icon-2.png?width=75&height=75&resize=contain,False,['art'],0,False,,False,5105996,False,,,,#c3975f,de,0,0,True,ed31a5d8-5224-481d-8896-d6a819a4eee7,1714647927,1703419200
3D Snippets,https://www.3dsnippets.com/,A monthly dose of 3D art tips by Pablo Munoz Gomez.,https://supapjpiqdfzuaordcdx.supabase.co/storage/v1/render/image/public/images/3dsnippets.png?t=2022-07-19T12%3A37%3A29.996Z?width=75&height=75&resize=contain,False,['art'],0,False,,False,5172318,False,,,,,en,0,0,True,b4e08b5e-c55d-4d2b-a602-538f241760f6,1658238420,1649289600
Tforia,https://tforia.com/,"Making things at home: sewing, weaving, knitting, dyeing, baking and more.",https://supapjpiqdfzuaordcdx.supabase.co/storage/v1/render/image/public/images/1735581296398-IMG_3420.png?width=75&height=75&resize=contain,False,['art'],0,False,,False,6042842,False,,,,#6f3804,en,0,0,True,993ca640-fec7-4962-a453-219b039555f1,1735581297,1735362970
New Music for Old People,https://www.newmusic4oldpeople.com/,"If you liked alternative music in the 80-90s and want to be cool again, subscribe to hear the latest alt music from new bands. (NB: You will get an email to confirm your subscription.)",https://supapjpiqdfzuaordcdx.supabase.co/storage/v1/render/image/public/images/1707179082204-pexels-anton-h-145707_60x60.ico?width=75&height=75&resize=contain,False,['art'],0,False,,False,10000000,False,,,,#8a9b7d,en,0,0,True,e545157f-03de-4758-8455-905cde17de61,1707179083,1698263200
Followratty,https://followratty.digitalpress.blog/,FollowRatty is your place to find information on mandala art on your goods,https://supapjpiqdfzuaordcdx.supabase.co/storage/v1/render/image/public/images/1690522005797-maturity28-TQ.png?width=75&height=75&resize=contain,False,['art'],0,False,,False,10000000,False,,,,#4b726c,en,0,0,True,da2a3c20-b90b-4ef9-9394-aa08b60d7713,1690522007,1728070550
VERDEY,https://www.verdey.com/,Realizing mySelf through art and poetry,https://supapjpiqdfzuaordcdx.supabase.co/storage/v1/render/image/public/images/1684681076728-VERDEY---Official-Logo-V1_white.jpg?width=75&height=75&resize=contain,False,['art'],0,False,,False,10000000,False,,,,#2c4818,en,0,0,True,d2903f1d-0f49-4307-b21a-58aa7274717a,1684681077,1687180345
