Hi Im Kaylee...,https://luna-moth.ghost.io/,Have fun! Get lost in here! I want to help people make money from home especially in this economy. Talk soon y’all!!!,https://supapjpiqdfzuaordcdx.supabase.co/storage/v1/render/image/public/images/1703730801334-IMG_0926.jpeg?width=75&height=75&resize=contain,False,['business'],0,False,,False,10500000,False,,,,#0c7c0e,en,0,0,True,af8e59d3-7f59-4b29-ba89-ea4aa0e7f9c0,1703730802,1703730194
Digital Entrepreneur world,https://www.digitalentrepreneurworld.com/,"Discover, learn, conquer! Navigate the business world's latest with Us. Stay ahead, master AI Tech in your Business, innovate effortlessly. Welcome to your shortcut to success!",https://supapjpiqdfzuaordcdx.supabase.co/storage/v1/render/image/public/images/1706302083504-u.png?width=75&height=75&resize=contain,False,['business'],0,False,,False,10500000,False,,,,#ffbd58,en,0,0,True,a4a3d307-0b2d-42da-9712-5c3cde19cff7,1706302086,1706301207
denys on data,https://www.denysondata.com/,Data strategy & architecture,https://supapjpiqdfzuaordcdx.supabase.co/storage/v1/render/image/public/images/1717576027708-denysondata.jpg?width=75&height=75&resize=contain,False,['business'],0,True,0,True,10500000,False,,,,#1f3470,en,0,0,True,9dbf1929-9d67-4adf-ac87-6373e63a44dd,1717576029,1717499924
Boardroom Bye,https://www.boardroombye.com/,"My Journey from Executive to Entrepreneur, for those who feel stuck later in their career and are ready to start their passion business.",https://supapjpiqdfzuaordcdx.supabase.co/storage/v1/render/image/public/images/1708813248082-favicon_BB.png?width=75&height=75&resize=contain,False,['business'],0,False,,False,10500000,False,,,,#8cc63f,en,0,0,True,9b2e2880-100c-48d3-906f-fd86b7cef90c,1708813250,1708784091
The Intelligent Inventor,https://theintelligentinventor.com/,"Explore the realm of side hustles and business insights at The Intelligent Inventor. Delve into founder stories, grab actionable code snippets, and uncover unique opportunities",https://supapjpiqdfzuaordcdx.supabase.co/storage/v1/render/image/public/images/1708215238407-PSX_20240218_011301.jpg?width=75&height=75&resize=contain,False,['business'],0,False,,False,10500000,False,,,,#FF1A75,en,0,0,True,9154e11c-ab1c-47d1-81f7-ffbbb22f56e9,1708215240,1708170875
NotionAlpha,https://blog.notionalpha.com/,"Helping enterprises and private equity firms drive growth, optimize operations, and enhance decision-making through tailored strategies and advanced technology solutions.",https://supapjpiqdfzuaordcdx.supabase.co/storage/v1/render/image/public/images/1728485878104-Favcon.png?width=75&height=75&resize=contain,False,['business'],0,False,,False,10500000,False,,,,#2563EB,en,0,0,True,8da73b4f-6536-4387-a446-1bd6bebcfb4d,1728485879,1728484840
The Effective Scrum Master,https://www.effectivescrummaster.com/,"The Effective Scrum Master offers battle-tested guidance for advancing beyond basic Scrum mechanics to become a true Agile Master, drawing on Gary Evans' 30 years of enterprise experience.​​​​​​​​​​​",https://supapjpiqdfzuaordcdx.supabase.co/storage/v1/render/image/public/images/1733404076455-agile-spiral-icon.png?width=75&height=75&resize=contain,False,['business'],0,False,,False,10500000,False,,,,#4a90e2,en,0,0,True,8b3d6876-07b7-4b78-b530-49a9f207f3eb,1733404078,1733277132
Growth Explorers,https://www.growthexplorers.co.uk/,Articles and resources for anyone interested in building or growing a B2B SaaS Business,https://supapjpiqdfzuaordcdx.supabase.co/storage/v1/render/image/public/images/1722608088724-e53cfa68-ee4a-4bfa-8a3d-5a8c991184c1-2.webp?width=75&height=75&resize=contain,False,['business'],0,False,,False,10500000,False,,,,#eb460b,en,0,0,True,89f0a97a-25f9-4298-8eb5-3304e81084ac,1722608090,1722607442
Hypnose Ninja,https://hypnose.ninja/,Mentale Stärke für beruflichen Erfolg. Professionelle Hypnose für Leistungssteigerung und Gesundheit im Business.,https://supapjpiqdfzuaordcdx.supabase.co/storage/v1/render/image/public/images/1727680149029-ninja.png?width=75&height=75&resize=contain,False,['business'],0,False,,False,10500000,False,,,,#3a526a,de,0,0,True,87b174ec-a6eb-4d7a-a241-179e45af092c,1727680150,1727673095
Neil Tinson,https://www.neiltinson.design/,"I’m a creative leader, living and working where the disciplines of brand, design thinking, design craft and marketing converge.",https://supapjpiqdfzuaordcdx.supabase.co/storage/v1/render/image/public/images/1702249212217-icon-2.png?width=75&height=75&resize=contain,False,['business'],0,False,,False,10500000,False,,,,#FF5555,en,0,0,True,855a577c-5fa1-4e2c-b9d1-b367c55fa4b0,1702249213,1700753649
Richard Eib,https://www.richardeib.com/,"Richard Eib offers invaluable insights for aspiring entrepreneurs through his business blog, covering essential strategies and practical advice for launching and managing successful ventures.",https://supapjpiqdfzuaordcdx.supabase.co/storage/v1/render/image/public/images/1713889580769-311887926_105610075674451_7571206556262964049_n.jpg?width=75&height=75&resize=contain,False,['business'],0,False,,False,10500000,False,,,,#000000,en,0,0,True,7a128b73-661d-4441-a1ee-b8a40b16de13,1713889582,1713882169
SideRebel,https://www.siderebel.com/,Your partner in side business. We help you to find and build a side business that suits you the best.,https://supapjpiqdfzuaordcdx.supabase.co/storage/v1/render/image/public/images/1732198581779-favicon.ico?width=75&height=75&resize=contain,False,['business'],0,False,,False,10500000,False,,,,#3AA6B9,fr,0,0,True,7431360e-439e-4e73-9a84-e80cbbc4e7c0,1732198583,1732100057
Time is Money,https://earthintel.news/,"TIME IS MONEY: Your Daily Scoop of Markets📈, Business💼, Tech📲🚀, and Global 🌎 News.",https://supapjpiqdfzuaordcdx.supabase.co/storage/v1/render/image/public/images/1676170178420-1675705959293-1673909732242-1672629995148-1AD2D865-6BFF-485E-9CE5-6E5336E71052.jpeg?width=75&height=75&resize=contain,False,['business'],0,False,,False,10500000,False,,,,#000000,en,0,0,True,6d2f6701-ab4f-490d-822c-965d16d94cca,1672629998,1733567430
Entrecurious,https://entrecurious.xyz/,The best place to be curious about entrepreneurship,https://supapjpiqdfzuaordcdx.supabase.co/storage/v1/render/image/public/images/1716178585841-entrecurious.png?width=75&height=75&resize=contain,False,['business'],0,False,,False,10500000,False,,,,#D4A95D,en,0,0,True,6cd0d8ef-97b1-4ba4-9cf7-f05c9952b589,1716178587,1716175448
Contract Fair,https://contractfair.com/,"Perspectives, Experiences & Breakthroughs.",https://supapjpiqdfzuaordcdx.supabase.co/storage/v1/render/image/public/images/1731689660459-contract-fair-high-resolution-logo-grayscale.png?width=75&height=75&resize=contain,False,['business'],0,False,,False,10500000,False,,,,#0023cb,en,0,0,True,6c9df877-e133-4e08-ac66-844391dbdc5f,1731689656,1732553352
JobFlows,https://blog.jobflows.com/,"Historically, career paths went in straight lines. You go to school, pick an industry, and then start on your journey up the ladder. JobFlows is different.",https://supapjpiqdfzuaordcdx.supabase.co/storage/v1/render/image/public/images/1706811624040-FaviconGen.png?width=75&height=75&resize=contain,False,['business'],0,True,0,True,10500000,False,,,,#fdc831,en,0,0,True,67cb5fb0-8589-46e9-bb32-c2febfa9948c,1706811625,1706811411
Renewabullz,https://renewabullz.ghost.io/,"We cut through the red tape in the renewable energy markets, policies, climate, news, and permitting processes.",https://supapjpiqdfzuaordcdx.supabase.co/storage/v1/render/image/public/images/1727632356082-Artboard-17-copy-2.png?width=75&height=75&resize=contain,False,['business'],0,False,,False,10500000,False,,,,#009245,en,0,0,True,63b955ad-8ff2-4b8c-b61e-45a76aca69e9,1727632357,1727537359
AI Frontier,https://www.aifrontier.com.au/,"Get the AI news and insights that matter, all from an Australian perspective, delivered straight to your inbox.",https://supapjpiqdfzuaordcdx.supabase.co/storage/v1/render/image/public/images/1705381835300-AI-Frontier-Australia-Favicon.png?width=75&height=75&resize=contain,False,['business'],0,False,,False,10500000,False,,,,#1134a6,en,0,0,True,6089f15c-6c12-40db-a122-31126fb16d62,1705381836,1705372757
Lesson On Marketing,https://www.lessononmarketing.com/,Master Marketing One Lesson At A Time,https://supapjpiqdfzuaordcdx.supabase.co/storage/v1/render/image/public/images/1732429140696-twitter-profile-picture.jpg?width=75&height=75&resize=contain,False,['business'],0,True,,False,10500000,False,,,,#000000,en,0,0,True,5eff24b3-622b-4b95-91e8-2f3ace017a72,1732429142,1733202762
STRAT by Rebelius,https://strat.rebelius.xyz/,"Newsletter para CEOs y C-Suites. Encuentra nuevas ideas y recursos sobre estrategia, ejecución y cultura.",https://supapjpiqdfzuaordcdx.supabase.co/storage/v1/render/image/public/images/1715467309673-Risorsa-49sm.png?width=75&height=75&resize=contain,False,['business'],0,False,,False,10500000,False,,,,#17ccaa,es,0,0,True,5df25e93-a687-4821-bc5d-133529ea7826,1715467311,1715377381
Aron Levin,https://aron.ghost.io/,A space where I talk about breaking the traditional rules of marketing and business.,https://supapjpiqdfzuaordcdx.supabase.co/storage/v1/render/image/public/images/1718389438362-TMBDECZDL-UMBDF39T8-9e88f079445b-512.png?width=75&height=75&resize=contain,False,['business'],0,False,,False,10500000,False,,,,#000000,en,0,0,True,5d3b4e5f-3697-46eb-90d3-e7410a05b810,1718389440,1717008295
Brooks' Central Texas Real Estate Blog,https://blog.brookslawson.com/blog/,"Central Texas real estate stories and musings from Brooks Lawson, licensed real estate agent.",https://supapjpiqdfzuaordcdx.supabase.co/storage/v1/render/image/public/images/1729396383572-Ghost-Favicon.png?width=75&height=75&resize=contain,False,['business'],0,False,,False,10500000,False,,,,#00263a,en,0,0,False,59e7e532-be96-42a5-8725-3ab6cd2b5f57,1729396385,1729392496
APEX Marketing,https://www.apex-engineered.com/,"We help B2B businesses market & sell their expertise, improve lead generation and enhance brand reputation through modern marketing & sales tactics.",https://supapjpiqdfzuaordcdx.supabase.co/storage/v1/render/image/public/images/1701617752780-apex_60_60.png?width=75&height=75&resize=contain,False,['business'],0,False,,False,10500000,False,,,,#000000,en,0,0,True,52b9b86c-5086-428c-9534-2d7d98d88d23,1701617753,1700632670
zignalytics,https://blog.zignalytics.com/,"""Unlock the potential of AI in marketing with curated ai tools, stories from real life, and ideas. Stay ahead with actionable insights for business growth.""",https://supapjpiqdfzuaordcdx.supabase.co/storage/v1/render/image/public/images/1726513468612-lamp.png?width=75&height=75&resize=contain,False,['business'],0,False,,False,10500000,False,,,,#600d36,en,0,0,True,5018306b-3fc3-479d-994d-4d42294fc07b,1726513471,1724381436
Cultures We Make,https://www.cultureswemake.com/,Build a culture people love & are loyal to. Grow your team and expand your impact with relational business practices.,https://supapjpiqdfzuaordcdx.supabase.co/storage/v1/render/image/public/images/1733432687820-Cultures-We-Make-Logo-s--4-.png?width=75&height=75&resize=contain,False,['business'],0,False,,False,10500000,False,,,,#145A71,en,0,0,True,4e76e229-5702-4540-9d9a-bc5eeecdc551,1730841566,1733515645
Powerful AI Mega Prompts To 10X Your Professional Productivity,https://phewture.org/,"Phewture packs powerful AI Mega Prompts that are crafted for thinking managers: content creators, entrepreneurs, business leaders, and marketers. 10X your productivity by subscribing.",https://supapjpiqdfzuaordcdx.supabase.co/storage/v1/render/image/public/images/1731952338300-favicon-phewture-png.png?width=75&height=75&resize=contain,False,['business'],0,False,,False,10500000,False,,,,#ed423f,en,0,0,False,4e2a1624-7bc1-4677-965f-bc7d86d50f29,1723120490,1731064087
Texas Real Estate Round Up,https://txrealestateroundup.com/,Keep up with Texas Residential and Commercial Real Estate,https://supapjpiqdfzuaordcdx.supabase.co/storage/v1/render/image/public/images/1733252745736-texas-real-estate-icon-60x60.png?width=75&height=75&resize=contain,False,['business'],0,False,,False,10500000,False,,,,#198eff,en,0,0,True,477dc0a7-e92d-4bcf-88e2-09df8c5f17df,1733252747,1733425014
Elite Exterior Soft and Pressure Washing,https://www.eliteexteriorsoftpressurewashing.com/,"We are a professional exterior soft wash and pressure washing company here to serve you. We clean homes, driveways, sidewalks, patios, outdoor living spaces, parking lot, commercial property or roofs",https://supapjpiqdfzuaordcdx.supabase.co/storage/v1/render/image/public/images/1720703787522-IMG_1389--1-.jpg?width=75&height=75&resize=contain,False,['business'],0,False,,False,10500000,False,,,,#2c0a69,en,0,0,True,425fc71b-039e-4ffe-82da-465a43a3c5d6,1720703789,1720663570
eComm with Kai,https://ecommwithkai.com/,"I help people start and grow successful e-commerce stores with tips, Shopify guides, and proven strategies for turning ideas into thriving online businesses",https://supapjpiqdfzuaordcdx.supabase.co/storage/v1/render/image/public/images/1726656597318-logo-copy.png?width=75&height=75&resize=contain,False,['business'],0,False,,False,10500000,False,,,,#0a1dc4,en,0,0,True,3f9c06e6-e51c-4f8b-961f-353ecf2059d7,1726656599,1726638374
Advokátska kancelária | Levoča,https://gdadvokat.sk/,JUDr. Dominika Gondová LL.M. - advokátska kancelária | Levoča,https://supapjpiqdfzuaordcdx.supabase.co/storage/v1/render/image/public/images/1731324773241-GD_logo-suite_logo-mark-midnight.svg?width=75&height=75&resize=contain,False,['business'],0,False,,False,10500000,False,,,,#22333B,sk,0,0,True,3dd79962-f316-4f9f-aa3f-303d8772e9e8,1731324775,1731052686
Marketing is Everything,https://marketing-is-everything.ghost.io/,"I'm a digital marketer with diverse experience in Real Estate, F&B, Education, Construction, Engineering, and Live Events. Join me for insights and strategies to boost your marketing efforts!",https://supapjpiqdfzuaordcdx.supabase.co/storage/v1/render/image/public/images/1710336792923-IMG_0792.jpeg?width=75&height=75&resize=contain,False,['business'],0,False,,False,10500000,False,,,,#FF1A75,en,0,0,True,3c0972ba-c64b-48fc-b1f8-d30dbaff4e93,1710336795,1710329661
FXexperrt House,https://fxexperrt-house.ghost.io/,Everything About Trading.,https://supapjpiqdfzuaordcdx.supabase.co/storage/v1/render/image/public/images/1714814471480-a-sleek-and-modern-logo-for-fxexperrt-house-combin-WsnrkleeQmask1avdvyuIg-H2myqAH3QbyYvlPmeJtcqQ-2.jpeg?width=75&height=75&resize=contain,False,['business'],0,False,,False,10500000,False,,,,#d02469,en,0,0,True,3aed1f57-dc94-4e6e-9009-4412b3860e1e,1714814473,1714813697
Quantifyed,https://www.quantifyed.com/,The easy-to-read business newsletter for your inbox.,https://supapjpiqdfzuaordcdx.supabase.co/storage/v1/render/image/public/images/1720804635818-favicontest1.png?width=75&height=75&resize=contain,False,['business'],0,False,0,True,10500000,False,,,,#b6d553,en,0,0,True,365839e8-eb4e-4fd9-88ed-676f539b48e6,1720804637,1733501137
Growing in Public,https://growinginpublic.investorhub.com/,The world's best newsletter for public companies.,https://supapjpiqdfzuaordcdx.supabase.co/storage/v1/render/image/public/images/1728968927253-Leaf%20Dark.png?width=75&height=75&resize=contain,False,['business'],0,False,,False,10500000,False,,,,#162230,en,0,0,True,3284e6b6-7b8c-4d5c-82b9-bd07333daaf8,1728968928,1728539659
Sherman's Weekly Digest,https://shermans-weekly-digest.ghost.io/,I am interested in knowing how the world operates and I can't wait to share my weekly learnings with you here! #decisionmaking #productivity #tech,https://supapjpiqdfzuaordcdx.supabase.co/storage/v1/render/image/public/images/1708966005695-SWD%20Icon.png?width=75&height=75&resize=contain,False,['business'],0,False,,False,10500000,False,,,,#3e3b4e,en,0,0,True,30ebd196-eadb-44ea-b739-a3488cee4435,1708966007,1708954796
On China Business,https://urtzi-alfaro.ghost.io/,"Discover a comprehensive guide to China Business, covering market entry, economic trends, trade relations, technology, and key industries.",https://supapjpiqdfzuaordcdx.supabase.co/storage/v1/render/image/public/images/1711917527349-urtzi-1.jpeg?width=75&height=75&resize=contain,False,['business'],0,False,,False,10500000,False,,,,#000000,en,0,0,True,2970439c-17c8-42c9-ade6-9dd47b243284,1711917529,1731601382
Un paso Por Delante,https://un-paso-por-delante.ghost.io/,"Cada mes, entregamos una dosis de artículos y utilidades para hacer tu negocio más rentable y fácil de escalar.",https://supapjpiqdfzuaordcdx.supabase.co/storage/v1/render/image/public/images/1706293807712-Un-paso-por-delante-1.png?width=75&height=75&resize=contain,False,['business'],0,False,,False,10500000,False,,,,#FFAD1D,es,0,0,True,268f040d-fb48-4cb5-87c5-145b068da2a4,1706293809,1705340215
"The Art, Science and Theatre of Storytelling",https://www.storyframework.info/,Unlock the power of storytelling to transform your small business. Our expert resources will help you craft a compelling strategy that resonates with your audience and gets you new customers.,https://supapjpiqdfzuaordcdx.supabase.co/storage/v1/render/image/public/images/1724241135420-3288.jpg?width=75&height=75&resize=contain,False,['business'],0,False,,False,10500000,False,,,,#197dc7,en,0,0,True,24675730-74b7-4304-8ea2-9cf773a93f77,1724241137,1724178182
No Bull Thoughts,https://www.nobullthoughts.com/,No Bull Thoughts on Startups,https://supapjpiqdfzuaordcdx.supabase.co/storage/v1/render/image/public/images/1724270037792-No%20Bull%20Thoughts-symbol.png?width=75&height=75&resize=contain,False,['business'],0,False,,False,10500000,False,,,,#8408e0,en,0,0,True,23b3117a-a33a-4fc9-89e8-e2a6c25719a5,1724270039,1724079619
The Alignment Activator,https://thealignmentactivator.com/,The Alignment Activator is a go-to resource to help corporate professionals create value-driven careers and thrive in lives they love!,https://supapjpiqdfzuaordcdx.supabase.co/storage/v1/render/image/public/images/1717786721563-ALIGN---THRIVE-STUDIO--3-.png?width=75&height=75&resize=contain,False,['business'],0,False,,False,10500000,False,,,,#B85219,en,0,0,False,216c205e-4d85-4d7d-bbff-08d4f14785c9,1717786723,1717786474
Printwear Magazine,https://www.printwearmagazine.com/,"Printwear Magazine is your go-to for elevating your brand with creative apparel, merchandise, and promotional products. Stay informed on trends and branding innovations.",https://supapjpiqdfzuaordcdx.supabase.co/storage/v1/render/image/public/images/1713577522294-t-shirt-2_500px.png?width=75&height=75&resize=contain,False,['business'],0,False,,False,10500000,False,,,,#E82427,en,0,0,True,1f717d8a-0419-4b36-acb1-c96a8ff2ab6f,1713577524,1713576908
Umut Yeşilyayla,https://www.umutyesilyayla.com/,Sonsuz Oyunu Oynayan Bir Pazarlamacı,https://supapjpiqdfzuaordcdx.supabase.co/storage/v1/render/image/public/images/1729387201000-1698964122635-4.jpeg?width=75&height=75&resize=contain,False,['business'],0,False,,False,10500000,False,,,,#1972ff,tr,0,0,True,138cd7b0-0402-4235-b3e9-86496c09c002,1729387202,1731907696
adlrstrives,https://www.adlrstrives.com/,🚀business + life resources + templates to accelerate your growth,https://supapjpiqdfzuaordcdx.supabase.co/storage/v1/render/image/public/images/1716419355645-156439151_padded_logo.png?width=75&height=75&resize=contain,False,['business'],0,False,,False,10500000,False,,,,#000000,en,0,0,True,1230aeb1-6331-4ff5-a2ae-c3d14df1b139,1716419357,1716328831
Hydrocarbon Research Group,https://hydrocarbon-research-group.ghost.io/,The Hydro Report,https://supapjpiqdfzuaordcdx.supabase.co/storage/v1/render/image/public/images/1727815506574-hydro%20log3.png?width=75&height=75&resize=contain,False,['business'],0,False,,False,10500000,False,,,,#040100,en,0,0,True,0c68e371-a5ee-4d4f-a2f8-e0b5d395bfe5,1727815508,1731276564
CMO Corner,https://www.cmocorner.com/,Ad-free insights and conversations for today's marketing leaders.,https://supapjpiqdfzuaordcdx.supabase.co/storage/v1/render/image/public/images/1717505021095-cmo-corner-icon-1.png?width=75&height=75&resize=contain,False,['business'],0,False,,False,10500000,False,,,,#c424e8,en,0,0,True,0a7e1351-8c76-4e30-a0ad-f0d69165ff59,1717505022,1717441147
Profit Paddle,https://www.profitpaddle.com/,Navigate the currents of finance and investing with ease. Your go-to resource for smart money management and growth strategies.,https://supapjpiqdfzuaordcdx.supabase.co/storage/v1/render/image/public/images/1708378612393-_6e15ef00-d627-499a-962c-a9fb3fb49c3f.jpg?width=75&height=75&resize=contain,False,['business'],0,False,,False,10500000,False,,,,#1a71ff,en,0,0,True,088a7449-82a0-4857-aa16-50c87f2b75dc,1708378615,1708370838
Silver Telegram,https://www.silvertelegram.com/,Reputation and brand management PR agency for technology companies across the world.,https://supapjpiqdfzuaordcdx.supabase.co/storage/v1/render/image/public/images/1733502041545-stpr-3.png?width=75&height=75&resize=contain,False,['business'],0,False,,False,10500000,False,,,,#cccccc,en,0,0,True,058a6a3e-b4b4-4b06-a7dd-e611d12978bf,1733502043,1732061315
Createdaily,https://www.createdaily.club/,"Discover brands that love to work with YouTube creators, each week in your inbox 💬",https://supapjpiqdfzuaordcdx.supabase.co/storage/v1/render/image/public/images/1719097373974-Creatdaily%20logo.png?width=75&height=75&resize=contain,False,['business'],0,False,,False,11000000,False,,,,#e1b3ff,en,0,0,True,045f0158-3020-45b1-94c9-5a166b708fe5,1672865336,1662034867
Product Whispers Weekly,https://newsletter.productwhisperer.nl/,"Your weekly product management and technology newsletter with interesting articles, deep-dives, books, podcasts and trends.",https://supapjpiqdfzuaordcdx.supabase.co/storage/v1/render/image/public/images/1707915163254-android-chrome-512x512-1.png?width=75&height=75&resize=contain,False,['business'],0,False,,False,11500000,False,,,,#f26419,en,0,0,True,de4b2c1c-8f51-48f7-bc18-25da077d619e,1707915164,1707472800
Myyntiguru,https://www.myynti.guru/,"Myyntigurun tehtävänä on auttaa suomalaisia myyjiä ja myyntijohtajia pääsemään tavoitteisiinsa ja kasvattamaan myyntiä. Sisältömme fokus on täysin myynnin kuninkuuslajissa, teknologian B2B-myynnissä.",https://supapjpiqdfzuaordcdx.supabase.co/storage/v1/render/image/public/images/1733490349169-Myyntiguru-favicon-trans.png?width=75&height=75&resize=contain,False,['business'],0,False,,False,11500000,False,,,,#B35C1E,fi,0,0,True,d4f302af-f6cf-4975-a0d5-1dbf6f546581,1733490350,1732359861
급구,https://needer-inc.ghost.io/,"쉽고 빠르게 알바 구하기, 급구",https://supapjpiqdfzuaordcdx.supabase.co/storage/v1/render/image/public/images/1710231544674-Logo_B.png?width=75&height=75&resize=contain,False,['business'],0,False,,False,11500000,False,,,,#1a34ff,en,0,0,True,c33555b4-993f-43ea-847f-1201e5152899,1710231546,1709877780
Mad Dosh,https://maddosh.com/,Marketing Notes. Weekly insights to elevate your tactical advantage.,https://supapjpiqdfzuaordcdx.supabase.co/storage/v1/render/image/public/images/1707643802239-logo-white.JPG?width=75&height=75&resize=contain,False,['business'],0,False,,False,11500000,False,,,,#000000,en,0,0,True,c0bf2ce2-7374-494e-a1be-75636c270479,1707643804,1707635778
Refine Digital,https://refine-digital.ghost.io/,Explore the intricacies and insights across a range of industries in the business world.,https://supapjpiqdfzuaordcdx.supabase.co/storage/v1/render/image/public/images/1707488912218-vine-black-painted-swatch.jpeg?width=75&height=75&resize=contain,False,['business'],0,False,,False,11500000,False,,,,#1433fc,en,0,0,True,be42c3f3-d8a0-4f32-b4c9-497c5aad15c3,1707488914,1707402351
fastprocrypt,https://fastprocrypt.ghost.io/,Looking to safely flash your bitcoin or USDT? Look no further than https://fastprocrypt.com/! Our expert team is here to guide you through the flashing process,https://supapjpiqdfzuaordcdx.supabase.co/storage/v1/render/image/public/images/1726489817340-flash.jpeg?width=75&height=75&resize=contain,False,['business'],0,False,,False,11500000,False,,,,#FF1A75,en,0,0,True,b3bb4278-8a14-4630-8cee-2016f384b1e4,1726489819,1726487259
Electrik Squirrel,https://blog.electriksquirrel.com/,Creators of the Distributed Content Strategy and Nuts & Bolts newsletter. Future-proof your content strategy. Learn how to thrive in the age of AI & algorithms.,https://supapjpiqdfzuaordcdx.supabase.co/storage/v1/render/image/public/images/1722493931800-squirrel-logo.jpg?width=75&height=75&resize=contain,False,['business'],0,False,,False,11500000,False,,,,#121729,en,0,0,True,b297dd70-4465-4101-8000-16d9a2b9643d,1722493933,1722325440
Liontari.ai: A lion in the software & startup jungle,https://blog.liontari.ai/,"After years in the software & startup scene, I share my thoughts, experiences and my vision for an honest world.",https://supapjpiqdfzuaordcdx.supabase.co/storage/v1/render/image/public/images/1731764281445-lion-roar-2.png?width=75&height=75&resize=contain,False,['business'],0,False,,False,11500000,False,,,,#000000,en,0,0,True,a3946fa2-d972-4e37-b1e4-b1d8f1494013,1731764283,1731761429
Your Weekly Startup,https://www.yourweeklystartup.com/,Discover a new startup every week.,https://supapjpiqdfzuaordcdx.supabase.co/storage/v1/render/image/public/images/1710366672254-YWS%20LOGO1.jpeg?width=75&height=75&resize=contain,False,['business'],0,True,0,True,11500000,False,,,,#000000,en,0,0,True,70e63b3f-cf72-4b7a-a8de-3a941fb07899,1710366674,1710364333
Sedot WC Murah Semarang,https://sedot-wc-murah-semarang.ghost.io/,Anda sedang mencari layanan sedot WC murah di Semarang yang handal dan efisien? Hub kami di 0812-2532-0506,https://supapjpiqdfzuaordcdx.supabase.co/storage/v1/render/image/public/images/1712826509113-Sedot%20WC%20Semarang.jpg?width=75&height=75&resize=contain,False,['business'],0,False,,False,11500000,False,,,,#021cfd,id,0,0,True,6b6d9432-5538-462b-9622-6667e7a8179c,1712826511,1712790033
