Making That Website,https://www.makingthatwebsite.com/,Beginner-Friendly Resources to Build Personal & Small Business Websites,https://supapjpiqdfzuaordcdx.supabase.co/storage/v1/render/image/public/images/1660096904760-build online store for free.png?width=75&height=75&resize=contain,False,['business'],0,False,,False,3544470,False,,,,#ff1a75,en,0,0,True,1a4182e0-4a81-4f74-af46-fb6f616527e9,1660096907,1733409259
Competitive Intelligence Alliance,https://www.competitiveintelligencealliance.io/,"Providing those responsible for competitive intelligence with the insights, resources, and foresight needed to thrive in their role.",https://supapjpiqdfzuaordcdx.supabase.co/storage/v1/render/image/public/images/1704383285047-CIA-favicon.png?width=75&height=75&resize=contain,False,['business'],0,False,,False,3572433,False,,,,#4377f6,en,0,0,True,3bcb005e-882b-4657-8b9c-aadc9b94e7ba,1679667912,1733408532
Great Things Studios Resources,https://514gt.com/blog/,"Helping the world achieve more, one video at a time!",https://supapjpiqdfzuaordcdx.supabase.co/storage/v1/render/image/public/images/1674423161927-1674423099940-Great-Things-Studios-pastille-2019-orange-min.png?width=75&height=75&resize=contain,False,['business'],0,False,,False,3778547,False,,,,#15171A,en,0,0,False,400f6232-595d-4f09-8c85-af0dbd156795,1674423100,1719504120
Inside,https://features.inside.com/,"Features by Inside.com is the home of interviews, deep dives, and long-form content designed for entrepreneurs and business leaders.",https://supapjpiqdfzuaordcdx.supabase.co/storage/v1/render/image/public/images/inside.png?t=2022-07-19T12%3A53%3A01.008Z?width=75&height=75&resize=contain,False,['business'],0,False,,False,3915900,False,,,,,en,0,0,True,1fda1aa9-14b5-44a5-9ec3-9f8bbbfdc07c,1658238539,1637280000
MBI Deep Dives,https://www.mbi-deepdives.com/,Investment Research,https://supapjpiqdfzuaordcdx.supabase.co/storage/v1/render/image/public/images/1728098367334-Screenshot-2022-07-23-225436.png?width=75&height=75&resize=contain,False,['business'],0,False,,False,4062518,False,,,,#070707,en,0,0,True,9ffcd02e-c917-4a1a-8e63-059a837bf9d0,1663543130,1733450886
Blossom at Work,https://www.blossomat.work/,The product leaders' guide to thriving at work.,https://supapjpiqdfzuaordcdx.supabase.co/storage/v1/render/image/public/images/1689058987526-Logo-1.png?width=75&height=75&resize=contain,False,['business'],0,False,,False,4377406,False,,,,#923E7F,en,0,0,True,312b379d-f235-4179-bc72-089407a0d753,1689058988,1688890654
Flat / Tutteo Blog,https://blog.flat.io/,"We build delightful products that transform how music enthusiasts learn, write, share, and consume music.",https://supapjpiqdfzuaordcdx.supabase.co/storage/v1/render/image/public/images/1694104880129-icon-256x256.png?width=75&height=75&resize=contain,False,['business'],0,False,,False,4453147,False,,,,#2f3447,en,0,0,False,7a17e142-06af-41ea-8872-8d8ab11bf3ec,1694104881,1733512666
Deepu Asok,https://www.deepuasok.com/,"Writings on strategic portfolio management, innovation and decision making.",https://supapjpiqdfzuaordcdx.supabase.co/storage/v1/render/image/public/images/1681484799613-Profile%20Pic-Cropped.jpg?width=75&height=75&resize=contain,False,['business'],0,False,,False,4951760,False,,,,#4b0df8,en,0,0,True,2f80c32d-53be-4b6e-afb3-f8ad1bb1522c,1673983278,1679595975
Amanj Hamid,https://www.amanjhamid.com/,Transformation & Leadership,https://supapjpiqdfzuaordcdx.supabase.co/storage/v1/render/image/public/images/1692559545044-fav.png?width=75&height=75&resize=contain,False,['business'],0,False,,False,4998603,False,,,,#ffb400,en,0,0,True,36b50a16-3fe3-4b8a-820d-3e1b113545f8,1692559546,1725001632
CHEESYLAZY 치지레이지,https://jagunbae.com/,제주 비건 샌드위치샵 치지레이지입니다. 작지만 오래가는 가게를 만드는 과정을 투명하게 공유합니다.,https://supapjpiqdfzuaordcdx.supabase.co/storage/v1/render/image/public/images/1684161441936---------.png?width=75&height=75&resize=contain,False,['business'],0,False,,False,5053259,False,,,,#f7ca18,ko,0,0,False,0327a587-bb06-4ea1-b7a7-7ecb3f613a37,1668422856,1733263255
Merci Larry,https://www.merci-larry.com/,Sharing what I'm learning about Growth Marketing.,https://supapjpiqdfzuaordcdx.supabase.co/storage/v1/render/image/public/images/1681483216706-cropped-merci-larry-1.jpg?width=75&height=75&resize=contain,False,['business'],0,False,,False,5110043,False,,,,#000000,en,0,0,True,223c579b-e9bf-4892-a874-130db21a8d32,1660398617,1729767436
Janne K. Jääskeläinen,https://www.jannejaaskelainen.fi/,Vapautan yrittäjiä kultaisista vankiloista.,https://supapjpiqdfzuaordcdx.supabase.co/storage/v1/render/image/public/images/1665505889452-JKJ-logo.png?width=75&height=75&resize=contain,False,['business'],0,False,,False,5165945,False,,,,#cc2031,fi,0,0,True,454a4e69-2e25-4044-ad3f-58a64a4749a4,1665505890,1733403270
Listen Up IH,https://www.listenupih.com/,"Learn how self-made founders succeed. No BS, actionable insights to help you build and grow a business. Read by 2000+ spirited indie hackers every week. Join for Free!",https://supapjpiqdfzuaordcdx.supabase.co/storage/v1/render/image/public/images/1664365181764-Listen-Up-IH-Logo-Options--1-.png?width=75&height=75&resize=contain,False,['business'],0,False,,False,5384880,False,,,,#C42217,en,0,0,True,c8b1e967-55df-4209-bb88-4ae72dbb6031,1664365183,1669446338
Climate Tech Japan,https://www.climatetech.jp/,気候変動×テックの「今」をお届けします！,https://supapjpiqdfzuaordcdx.supabase.co/storage/v1/render/image/public/images/1691151125759-CLIMATE-2-1.png?width=75&height=75&resize=contain,False,['business'],0,False,,False,5650756,False,,,,#3bc290,ja,0,0,True,fd9ecf3e-b0ea-43ad-9127-92bc05e64a15,1691151127,1733099666
Marco Santonocito,https://www.marcosantonocito.com/,"Designing, building, and growing digital products.",https://supapjpiqdfzuaordcdx.supabase.co/storage/v1/render/image/public/images/1719584024970-favicon.png?width=75&height=75&resize=contain,False,['business'],0,False,,False,5979106,False,,,,#FF7433,it,0,0,True,11932a34-cb09-4c74-8fcb-5ad49c10aa7a,1719584026,1711526425
Q*,https://qstar.ai/,Practical advice on unlocking sustainable growth through digital transformation.,https://supapjpiqdfzuaordcdx.supabase.co/storage/v1/render/image/public/images/1669778721726-icon_new.png?width=75&height=75&resize=contain,False,['business'],0,False,,False,7540281,False,,,,#EC695F,en,0,0,True,c72e2b58-186f-42d8-9024-e2c6903f749d,1669778725,1732791576
The Product Bistro,https://www.prodbistro.com/,Tales and tips from a lifetime of Product Management,https://supapjpiqdfzuaordcdx.supabase.co/storage/v1/render/image/public/images/1713632555447-pb_logo_mc.png?width=75&height=75&resize=contain,False,['business'],0,False,,False,7899708,False,,,,#cd6af1,en,0,0,True,2f85df57-bb28-44c0-bc97-ba75ddc0bc8f,1710029434,1711827818
Jason Gilbertson,https://www.jasongilbertson.com/,"Join me as I discuss data, leadership, and other topics. I’m grateful to have led DS/ML organizations across Fortune 50 companies and Series A start-ups.",https://supapjpiqdfzuaordcdx.supabase.co/storage/v1/render/image/public/images/1660583738741-maxime-valcarce-mAj8xn5zXsk-unsplash-small.jpg?width=75&height=75&resize=contain,False,['business'],0,False,,False,8491607,False,,,,#046BF1,en,0,0,True,8b90a45c-8ab9-4a94-879a-4134f889682f,1660583740,1720374777
Andrew Askins,https://www.andrewaskins.com/,"Transparent, thoughtful advice on building bootstrapped companies and living a fulfilling life.",https://supapjpiqdfzuaordcdx.supabase.co/storage/v1/render/image/public/images/1714501288685-pub-icon-1.png?width=75&height=75&resize=contain,False,['business'],0,False,,False,8782236,False,,,,#E14659,en,0,0,True,2ac0f965-3dbd-495b-8775-60fe9c166687,1714501290,1714500521
memoryKPR Blog,https://memorykpr.com/blog/,"Explore our blog for insights on user generated content, brand storytelling, customer engagement, and more!",https://supapjpiqdfzuaordcdx.supabase.co/storage/v1/render/image/public/images/1704751376183-icon-96x96-2.png?width=75&height=75&resize=contain,False,['business'],0,False,,False,9203850,False,,,,#43978d,en,0,0,True,1ae572b8-7b47-428d-bd10-117f8fb9cec2,1704751377,1703216160
Visioun Blog - We forge Premium Ghost Themes,https://visioun.com/blog/,"Start a blog, newsletter, or a paid membership publication easily with our ready to go premium ghost themes",https://supapjpiqdfzuaordcdx.supabase.co/storage/v1/render/image/public/images/1674150017503-1674149356643-1660083533177-favicon.png?width=75&height=75&resize=contain,False,['business'],0,False,,False,9624046,False,,,,#291647,en,0,0,True,2d3174af-08b1-4379-aafd-12cfdb1d2fbf,1660083535,1704228489
Blog - Chytrý bazár,https://blog.chytrybazar.sk/,"Návody, postrehy, tipy",https://supapjpiqdfzuaordcdx.supabase.co/storage/v1/render/image/public/images/1680266360308-Wordpress%20Transparent.png?width=75&height=75&resize=contain,False,['business'],0,False,,False,10000000,False,,,,#3049d1,sk,0,0,True,f2631281-5644-4b0f-92a5-23ae22a0f2d8,1680266314,1728310499
The Mozart Group,https://the-mozart-group-2.ghost.io/,Our mission is to build sustainable capacity in the Ukrainian military and territorial defense units so that Ukraine can defend itself from Russia’s invasion.,https://supapjpiqdfzuaordcdx.supabase.co/storage/v1/render/image/public/images/1668033526219-Mozart-Transparent.png?width=75&height=75&resize=contain,False,['business'],0,False,,False,10000000,False,,,,#050002,en,0,0,True,ef263eca-3899-40f6-8ba1-c9f7dd86a09e,1668033529,1670877546
ByDeity,https://www.bydeity.com/,"Our journey to becoming a leading-edge independent source of truth, has been one of transformation. Today, we share business and confidence insights to inspire financial freedom and personal growth.",https://supapjpiqdfzuaordcdx.supabase.co/storage/v1/render/image/public/images/1676826489038-Wordpress.png?width=75&height=75&resize=contain,False,['business'],0,False,,False,10000000,False,,,,#282753,en,0,0,True,d7aaebc8-c438-4f78-9c28-c47bb1564983,1676638074,1714557759
Daniele Righi,https://daniele-righi.ghost.io/,Daniele Righi - Innovation Manager e Marketing di Prossimità,https://supapjpiqdfzuaordcdx.supabase.co/storage/v1/render/image/public/images/1664749389142-tortellino-1.svg?width=75&height=75&resize=contain,False,['business'],0,False,0,True,10000000,False,,,,#ff9f1a,(it),0,0,True,b6703c7e-f5cc-4798-99ad-e2819f0924f4,1664749384,1677591099
Nuwave Lending,https://nuwave-lending.ghost.io/,"Mortgage lender for residential real estate in Nashville, TN.",https://supapjpiqdfzuaordcdx.supabase.co/storage/v1/render/image/public/images/1670527637182-1670527610558-1670270179521-NuWave-Icon.jpg?width=75&height=75&resize=contain,False,['business'],0,False,,False,10000000,False,,,,#4B3985,en,0,0,True,b1ae29f4-8da8-491f-93ac-350e1754fefb,1670270182,1677606864
CXRefinery - Become the Best in CX. Together.,https://cxrefinery.co/,Become the best in CX. Join a community of experienced CX professionals learning and breaking through obstacles. AI is changing the game - are you ready?,https://supapjpiqdfzuaordcdx.supabase.co/storage/v1/render/image/public/images/1714748082310-favicon-01-2.svg?width=75&height=75&resize=contain,False,['business'],0,False,,False,10000000,False,,,,#0066FF,en,0,0,False,ab5a8e28-335a-48b9-ba99-82a85bd1dc72,1714747799,1714747574
Countrymar,https://countrymar.com.mx/,Asesoría Inmobiliaria,https://supapjpiqdfzuaordcdx.supabase.co/storage/v1/render/image/public/images/1665934345620-countrymar-icon.png?width=75&height=75&resize=contain,False,['business'],0,False,,False,10000000,False,,,,#0C1432,es,0,0,True,ab309a80-b601-483d-acc7-5c7a23573a7b,1665934347,1708362360
money tlks!,https://moneytlks.com/,"Through the clutter of media advertising, we spotlight one topic that makes a difference every week.",https://supapjpiqdfzuaordcdx.supabase.co/storage/v1/render/image/public/images/1718496862744-money_tlks_logo-1.png?width=75&height=75&resize=contain,False,['business'],0,False,,False,10000000,False,,,,#003624,en,0,0,True,9620c309-2d66-4ac8-a949-1138f2a065d6,1718496864,1714910400
mimarigazete.com.tr,https://mimarigazete.ghost.io/,Bağımsız dijital mimarlık gazetesi.,https://supapjpiqdfzuaordcdx.supabase.co/storage/v1/render/image/public/images/1720123301048-logo.png?width=75&height=75&resize=contain,False,['business'],0,True,0,True,10000000,False,,,,#30b7ff,tr,0,0,True,92d5ea7e-279f-4856-ab15-6ca781f88f80,1720123302,1720192184
Blog de César Reyes,https://reyes.pro/,"Comparto posts sobre economía digital, legaltech, negocios, finanzas, el mundo cripto y más.",https://supapjpiqdfzuaordcdx.supabase.co/storage/v1/render/image/public/images/1717976851143-icon.png?width=75&height=75&resize=contain,False,['business'],0,False,,False,10000000,False,,,,#000000,es,0,0,True,7c9d5e93-3b68-49e6-90b7-6ee3e688dc7b,1717976852,1663698557
iTRUST Optical & Optometry EHR Practice Management Software,https://qa.itrust.io/blog/,iTRUST is all about efficiency and ways to improve office productivity to ensure the best patient care experience.,https://supapjpiqdfzuaordcdx.supabase.co/storage/v1/render/image/public/images/1714712374312-itrust%20logo.png?width=75&height=75&resize=contain,False,['business'],0,False,,False,10000000,False,,,,#012eea,en,0,0,True,5e7d2327-bb60-4858-b8da-91bd0fa0ebe9,1714712376,1711441569
Creatorville,https://creatorville.ghost.io/,Helping creators optimise their outcomes through strategic advice and support,https://supapjpiqdfzuaordcdx.supabase.co/storage/v1/render/image/public/images/1671398661842-Creatorville-square-logo-1.png?width=75&height=75&resize=contain,False,['business'],0,False,,False,10000000,False,,,,#069d84,en,0,0,True,572b7e12-3add-4840-a9ad-9ea2e30c2dd8,1671398665,1681455609
This Week I Learned,https://newsletter.toontimbermont.be/,"Join 'This Week I Learned', my journey as a tech founder towards my next stage. About personal growth, entrepreneurship, and software development.",https://supapjpiqdfzuaordcdx.supabase.co/storage/v1/render/image/public/images/1705781316179-logo.png?width=75&height=75&resize=contain,False,['business'],0,False,,False,10000000,False,,,,#429ded,en,0,0,True,54a5ba9f-aea8-4dc9-bef7-10e559cd903a,1705781099,1730549184
Convivio,https://v1.convivio.com/,Fall in love with leading your agency again.,https://supapjpiqdfzuaordcdx.supabase.co/storage/v1/render/image/public/images/1660834216797-favicon-152.png?width=75&height=75&resize=contain,False,['business'],0,False,,False,10000000,False,,,,#EC604B,en,0,0,True,4c7fe896-dcec-4a4a-b08b-764ac2dfafaf,1660834218,1721027892
stonecoldtakes,https://stonecoldtakes.ghost.io/,Existentialist rants on surviving business school,https://supapjpiqdfzuaordcdx.supabase.co/storage/v1/render/image/public/images/1715793270959-Stonetakes.png?width=75&height=75&resize=contain,False,['business'],0,False,,False,10000000,False,,,,#246473,en,0,0,True,271bf82e-e848-4815-ab54-d34b77600890,1714863808,1720402223
Growth Content Lab,https://growthcontentlab.com/,"GrowthContentLab.com is a website run by Ayoub Ouarain, a Content Marketing expert. On this platform, Ayoub shares innovative strategies, insights, and best practices.",https://supapjpiqdfzuaordcdx.supabase.co/storage/v1/render/image/public/images/1716979973482-growth-content-lab-logo-2.jpg?width=75&height=75&resize=contain,False,['business'],0,False,,False,10000000,False,,,,#1f369d,en,0,0,True,23b98c58-1d21-445a-8d23-840cf7831cb8,1716979975,1720721305
Polyák Csaba E.V. - Elektronikai szerviz,https://promnetszerviz.hu/,Informatikai-elektronikai szerviz Kállósemjénben!,https://supapjpiqdfzuaordcdx.supabase.co/storage/v1/render/image/public/images/1686572997582-344556375_670747894814475_57675405040716571_n.jpg?width=75&height=75&resize=contain,False,['business'],0,False,,False,10000000,False,,,,#1ad9ff,hu,0,0,True,1ecc3e6c-77b1-4eaa-84a6-19a17899cab5,1686572998,1686570784
Revenue.,https://revenue.ghost.io/,"Concise and digestible insight from one of the world's leading sales & marketing thinkers. Subscribe to receive weekly Revenue deep-dive analysis for B2B SaaS CEOs, Founders & revenue leaders",https://supapjpiqdfzuaordcdx.supabase.co/storage/v1/render/image/public/images/1684953527212-Pete%20Crosby%20Mixer-124-smlr.jpg?width=75&height=75&resize=contain,False,['business'],0,False,,False,10000000,False,,,,#9d1d1f,en,0,0,True,13226054-d1c3-4ce7-9960-cb090417ec61,1684952977,1725775209
Venture Design and Innovation,https://venture-with-design.nyuct.com/,Beautiful new ventures and futures with design and innovation.,https://supapjpiqdfzuaordcdx.supabase.co/storage/v1/render/image/public/images/1727627524615-NYUCT-Design-Labs--Venture-Design-firm--Favicon-10.png?width=75&height=75&resize=contain,False,['business'],0,False,,False,10000000,False,,,,#92cdda,en,0,0,True,116b0ff4-87c2-4c49-b73c-39456da754ca,1723614043,1727625077
Simatron Solutions FYI,https://www.simatron.fyi/,"Master Simulation and Lean Thinking with expert insights, innovative problem-solving, and practical tutorials. Elevate your simulation skills and streamline operations with us!",https://supapjpiqdfzuaordcdx.supabase.co/storage/v1/render/image/public/images/1721561297805-SimatronFYI_v001.png?width=75&height=75&resize=contain,False,['business'],0,False,,False,10000000,False,,,,#55AC4C,en,0,0,True,0da264af-67b1-4649-81a1-674bcac5c68b,1721560328,1726586415
Brad J Hall,https://www.bradjhall.com/,Actionable insights to kick-start and grow your freelance business.,https://supapjpiqdfzuaordcdx.supabase.co/storage/v1/render/image/public/images/1707098738856-Brad%20J%20Hall.png?width=75&height=75&resize=contain,False,['business'],0,False,,False,10000000,False,,,,#6597f7,en,0,0,True,07ee4f93-ab38-4828-ac53-40b2865c094a,1707098740,1723939610
CXRefinery - Become the Best in CX. Together.,https://www.cxrefinery.co/,Become the best in CX. Join a community of experienced CX professionals learning and breaking through obstacles. AI is changing the game - are you ready?,https://supapjpiqdfzuaordcdx.supabase.co/storage/v1/render/image/public/images/1708536807602-favicon-01-2.svg?width=75&height=75&resize=contain,False,['business'],0,False,,False,10000000,False,,,,#0066FF,en,0,0,True,06a136ce-ed65-4dcc-a0de-fb5529330247,1708536809,1704284897
ImpactPost,https://impactpost.net/,"News, analysis and insights on impact investing.",https://supapjpiqdfzuaordcdx.supabase.co/storage/v1/render/image/public/images/1680890043627-70230532---Copy.png?width=75&height=75&resize=contain,False,['business'],0,False,,False,10000000,False,,,,#000000,en,0,0,True,0592dfdf-328a-426f-9f61-bb61538a15e3,1680889966,1640740931
Lifecycle Strategist,https://www.lifecyclestrategist.com/,Increase Growth through Lifecycle Communication,https://supapjpiqdfzuaordcdx.supabase.co/storage/v1/render/image/public/images/1660547244274-New-Favicon.png?width=75&height=75&resize=contain,False,['business'],0,False,,False,10000000,False,,,,#FF5B00,en,0,0,True,018bfe33-5520-44d7-914c-69b21e6fdde6,1660547246,1703581227
Dailyala,https://dailyala.app/blog/,The content you need to unleash your full potential,https://supapjpiqdfzuaordcdx.supabase.co/storage/v1/render/image/public/images/1724782608462-Screenshot%202024-08-27%20at%2015.16.31.png?width=75&height=75&resize=contain,False,['business'],0,False,,False,10500000,False,,,,#000000,en,0,0,True,f9d0a315-392e-4a77-860c-15439da22e92,1724782610,1724764674
Sell Your Smarts with John Meese,https://www.sellyoursmarts.co/,Sell Your Smarts without losing your soul by learning from bestselling author John Meese,https://supapjpiqdfzuaordcdx.supabase.co/storage/v1/render/image/public/images/1723649457488-Sell-Your-Smarts-icon-2.jpg?width=75&height=75&resize=contain,False,['business'],0,False,,False,10500000,False,,,,#2da2cc,en,0,0,True,f500be6b-da1f-4368-8699-61d62f202d08,1723649459,1722892754
Kode,https://kodesentralen.funkyfresh.no/,"Programmering og cybersec, ferdig levert.",https://supapjpiqdfzuaordcdx.supabase.co/storage/v1/render/image/public/images/1688938517334-kisspng-dragon-granblue-fantasy-wyvern-winged-crown-5b42a35158e2b3.8914188515310938413641-1.png?width=75&height=75&resize=contain,False,['business'],0,False,,False,10500000,False,,,,#7a7a7a,en,0,0,True,f21c6710-0b33-4c8a-af21-292c9f0f2de0,1688938518,1732754009
chinyere offor,https://www.chinyereoffor.com/,"Weekly publication about personal development. Helping you to hone the best version of yourself alongside aiding you curate your skills, knowledge and expertise to create multiple streams of income.",https://supapjpiqdfzuaordcdx.supabase.co/storage/v1/render/image/public/images/1683001461413-Profile%20picture.jpg?width=75&height=75&resize=contain,False,['business'],0,False,,False,10500000,False,,,,#a6178c,en,0,0,True,f11cf8e6-d50c-4f3b-8a23-75f4bfde0003,1682398285,1733187349
Le Blog du Captain - Captain.legal,https://blog.captain.legal/,"L'actualité Juridique expliquée par Captain Legal. Particulier ou professionnel, notre blog vous offre des conseils, des actualités, et des ressources pour vous guider dans vos démarches juridiques.",https://supapjpiqdfzuaordcdx.supabase.co/storage/v1/render/image/public/images/1731402487953-WhatsApp-Image-2024-10-04-at-14.25.03.jpeg?width=75&height=75&resize=contain,False,['business'],0,False,,False,10500000,False,,,,#000000,fr,0,0,True,f0687c46-e983-4098-ac9e-eb1597a332ce,1731402490,1731401773
"Order From Chaos, Today!",https://orderfromchaos.today/,Newsletter about how to get things done in large teams.,https://supapjpiqdfzuaordcdx.supabase.co/storage/v1/render/image/public/images/1709341581288-tetris-soft-lines-color-2.svg?width=75&height=75&resize=contain,False,['business'],0,False,,False,10500000,False,,,,#119800,en,0,0,True,ef0c74a1-b916-45a2-a28b-630364a77fa3,1709340790,1731971533
Nils Bjørnsen,https://nilsbjornsen.com/,"Explore the essence of hospitality through a focus on sustainable, innovative restaurant management. Gain expert insights and tips to elevate service quality and efficiency.",https://supapjpiqdfzuaordcdx.supabase.co/storage/v1/render/image/public/images/1707074055504-nils-avatar.png?width=75&height=75&resize=contain,False,['business'],0,False,,False,10500000,False,,,,#005577,en,0,0,True,e6444915-7aad-47c8-8a9b-d953b3874ba6,1707074057,1707069282
L3V3L,https://www.l3v3l.ai/,"Simplified, fast-track access to the best-fit candidates and jobs.",https://supapjpiqdfzuaordcdx.supabase.co/storage/v1/render/image/public/images/1706713593839-L3V3L-v3-app-logo-2-1024.png?width=75&height=75&resize=contain,False,['business'],0,False,,False,10500000,False,,,,#2b95ff,en,0,0,True,e5118db2-5ca6-4899-8d29-d6eb213669e1,1706713595,1706213728
Albi Zhulali,https://www.albizhulali.com/,Sharing things I'm learning through my ventures and other interests.,https://supapjpiqdfzuaordcdx.supabase.co/storage/v1/render/image/public/images/1732106923263-Albi-Zhulali.jpg?width=75&height=75&resize=contain,False,['business'],0,False,,False,10500000,False,,,,#0000EE,en,0,0,True,de260d9c-8f88-4299-83ef-8788e00eca49,1732106871,1733234171
Vendiendo Valor,https://www.vendiendovalor.com/,"No vendas tu tiempo, vende tu talento.",https://supapjpiqdfzuaordcdx.supabase.co/storage/v1/render/image/public/images/1701894088815-android-chrome-192x192.png?width=75&height=75&resize=contain,False,['business'],0,False,,False,10500000,False,,,,#03c988,es,0,0,True,d9fc6342-da53-477f-81b1-ea8bce74863a,1701894089,1701848142
Dr. Haupt,https://blog.tobias-haupt.de/,Blog von Managementberater und -Coach Dr. Tobias C. Haupt über Führung. Management-Psychologie. Coaching. Werte.,https://supapjpiqdfzuaordcdx.supabase.co/storage/v1/render/image/public/images/1707770590542-Dr.-Haupt-Favicon.png?width=75&height=75&resize=contain,False,['business'],0,True,0,True,10500000,False,,,,#ee855f,de,0,0,True,d2a0c099-6fc3-4d3a-86da-6b1f7db9009c,1707770592,1707767267
Passionately Curious,https://blog.passionatelycurious.in/,"Daily insights on creativity, entrepreneurship & marketing for solopreneurs & freelancers.",https://supapjpiqdfzuaordcdx.supabase.co/storage/v1/render/image/public/images/1675573161892-Logo_400_x400.jpg?width=75&height=75&resize=contain,False,['business'],0,False,,False,10500000,False,,,,#ffb43f,en,0,0,True,c62c2873-e531-4744-b69b-8e239c8bf9bb,1675573163,1733494973
Talent Operator,https://www.talentoperator.com/,The #1 career resource for growth-minded recruiters and talent acquisition practitioners.,https://supapjpiqdfzuaordcdx.supabase.co/storage/v1/render/image/public/images/1720739538934-IMG_1290.jpg?width=75&height=75&resize=contain,False,['business'],0,False,,False,10500000,False,,,,#30c0e4,en,0,0,True,c57b7b61-c78a-4570-9b51-4171bd6ae738,1720739540,1732712465
Wiser with Akshay,https://www.wiserwithakshay.com/,Hi I am Akshay 👋🏼 I help SMART people BUILD a PROFITABLE BUSINESS around their PERSONAL BRAND,https://supapjpiqdfzuaordcdx.supabase.co/storage/v1/render/image/public/images/1712925380145-Wiser-With-Akshay-Logo--2-.png?width=75&height=75&resize=contain,False,['business'],0,False,,False,10500000,False,,,,#016684,en,0,0,True,bb2822d1-b8b7-4ac9-808b-94b3f1154b61,1712925381,1711896065
Watch18.de 💕,https://www.watch18.de/,"Marketing-Ratgeber und Services für Models auf OnlyFans und anderen Netzwerken. Exklusive Informationen, basierend auf Erfahrungen seit 2003 im Online-Marketing. ✨",https://supapjpiqdfzuaordcdx.supabase.co/storage/v1/render/image/public/images/1722930384035-watch18-2.png?width=75&height=75&resize=contain,False,['business'],0,True,0,True,10500000,False,,,,#E81C3E,de,0,0,True,ba124658-24cb-437c-93d0-fd0026469a2f,1722930385,1722928765
