Title,URL,Description,Publication Icon,Not Safe For Work,Categories,Member Count,Show Member Count,Monthly Recurring Revenue (MRR),Show MRR,Ghost Rank,Featured,Feature Image,Text Color,Background Color,Accent Color,Language,MRR Members Rank,MRR Members Diff Rank,Show Iframe,Object ID,Created At,Updated At
Creator Science,https://creatorscience.com/,"Become a smarter creator in 10 minutes per week. Join 55,000+ creators learning from firsthand experiments, expert interviews, and actionable advice every week.",https://supapjpiqdfzuaordcdx.supabase.co/storage/v1/render/image/public/images/1717172107265-PROFILE-creatorscience_256px.png?width=75&height=75&resize=contain,False,['business'],0,False,37K,True,962675,True,https://supapjpiqdfzuaordcdx.supabase.co/storage/v1/object/public/images/creatorscience_feature.jpeg?width=600&height=426&resize=cover,#15171A,#D6DAE3,#0061ff,en,366640.1,18530,False,97242874-5f77-40e2-8461-2383aa6b8e5f,1663169908,1733615519
Buffer,https://buffer.com/resources/,"Buffer’s social media marketing blog covers the latest social media tools, analytics, and strategies for Twitter, Facebook, and more.",https://supapjpiqdfzuaordcdx.supabase.co/storage/v1/render/image/public/images/buffer.png?t=2022-07-19T12%3A41%3A57.306Z?width=75&height=75&resize=contain,False,['business'],0,False,,False,1000111,True,https://supapjpiqdfzuaordcdx.supabase.co/storage/v1/object/public/images/buffer (1).png?width=600&height=426&resize=cover,#15171A,#EAB8C1,,en,0,0,True,53ee4718-54d5-46c6-bcaa-1d787d49cddc,1658238539,1656460800
Kickstarter,https://updates.kickstarter.com,"Kickstarter exists to help bring creative projects to life. A home for film, music, art, theater, games, comics, design, photography, and more.",https://supapjpiqdfzuaordcdx.supabase.co/storage/v1/render/image/public/images/ksicon.png?width=75&height=75&resize=contain,False,['business'],0,False,,False,1809179,True,https://supapjpiqdfzuaordcdx.supabase.co/storage/v1/render/image/public/images/ks.jpg?width=600&height=4268&resize=cover,#15171A,#09CE78,,en,0,0,True,8f280a38-9395-4610-badd-28a10e21caa1,1677004211,1677004211
Product Marketing Alliance,https://www.productmarketingalliance.com/,"Product Marketing Alliance is a collective of passionate product marketing managers committed to driving demand, adoption and the overall success of their products.",https://supapjpiqdfzuaordcdx.supabase.co/storage/v1/render/image/public/images/1666695177931-favicon_pma_1000.png?width=75&height=75&resize=contain,False,['business'],46321,True,162K,True,272441,False,,,,#fe5d4c,en,1668295.498664,40643,True,1a0a503e-93a6-4c8f-8e1e-309d88c089be,1664276730,1733504720
Strategic Insights Report,https://news.strategicinsightsreport.com/,We bring one to two ground breaking Reports Every Week - Only When It Matters,https://supapjpiqdfzuaordcdx.supabase.co/storage/v1/render/image/public/images/1726323378885-a7d5bc06-3cc8-4303-8810-d8091cdb5ee9_640x640--1-.jpg?width=75&height=75&resize=contain,False,['business'],547130,True,,False,45177098,False,,,,#FF1A75,en,547130,6,True,f82fc3ac-25c3-4db0-90e9-cb748f9400ba,1726250276,1730903649
Brands Vietnam,https://we.brandsvietnam.com/,The Vietnam's Brands & Marketing Ecosystem.,https://supapjpiqdfzuaordcdx.supabase.co/storage/v1/render/image/public/images/1692675039401-apple-touch-icon-1024-gra.png?width=75&height=75&resize=contain,False,['business'],38564,True,,False,5804499,False,,,,#CC0000,vi,38564,250,False,4e146c22-375f-4ca7-9e37-2dae2b0c107b,1682307971,1733557650
goodBUYreport,https://www.goodbuyreport.com/,Welcome to Jeff Yastine's goodBUYreport,https://supapjpiqdfzuaordcdx.supabase.co/storage/v1/render/image/public/images/1668806500528-GBR-1.png?width=75&height=75&resize=contain,False,['business'],21600,True,,False,41789433,False,,,,#801e1e,en,21600,0,True,0efb7bc8-f0f5-425c-8830-8c9020f7efa3,1668806503,1715963323
LSWW by Christian Häfner,https://lsww.de/,"Blog, Community & weekly Newsletter über Automation, KI und NoCode Tools für Solopreneure und Online Unternehmer.",https://supapjpiqdfzuaordcdx.supabase.co/storage/v1/render/image/public/images/1707495094945-LSWW--16-.png?width=75&height=75&resize=contain,False,['business'],5075,True,1K,True,2606932,False,,,,#6ec1e4,de,18274.15883,60,True,4e762ba1-90e0-470f-bebc-ed32b1119c8c,1684169660,1733489271
Inoryum | Certified Ghost Experts | AI Tools | Custom Web Development,https://inoryum.com/,"Inoryum offers certified Ghost expertise, innovative AI-powered SaaS tools (like Bazeus), and custom web development solutions to help businesses thrive online.",https://supapjpiqdfzuaordcdx.supabase.co/storage/v1/render/image/public/images/1713979362996-inoryum_icon.png?width=75&height=75&resize=contain,False,['business'],18211,True,,False,25554045,False,,,,#132740,en,18211,0,True,f9b09896-d0c3-46dd-b782-e108eca6071c,1713979365,1717134176
Sales Enablement Collective,https://www.salesenablementcollective.com/,"The Sales Enablement Collective is a global gathering of revenue leaders, all striving towards one, shared goal: consistent and predictable revenue growth.",https://supapjpiqdfzuaordcdx.supabase.co/storage/v1/render/image/public/images/1679666014515-android-chrome-512x512.png?width=75&height=75&resize=contain,False,['business'],16339,True,,False,1908578,False,,,,#FF8A36,en,16339,123,True,f0dc927f-03ad-42a0-b30e-8c56086264e7,1679666015,1733495543
"Agence de communication web française, basée à Londres",https://fr.abstract27.com/,"Agence web basée au Royaume-uni, réalise et / ou héberge votre site internet avec Ghost CMS. Fiable et optimisé pour le SEO, parfait pour les blogueurs, entrepreneurs, indépendants et PMEs",https://supapjpiqdfzuaordcdx.supabase.co/storage/v1/render/image/public/images/1729579072264-400x400-logo.png?width=75&height=75&resize=contain,False,['business'],302,True,2K,True,23736067,False,,,,#FFB828,fr,15695.692052,766,True,25e01925-de09-4d22-8f75-ead8f0a52f6f,1663437403,1733498120
London Web Agency,https://abstract27.com/,"We run a French web agency based in London, UK. We set up and host, Ghost CMS websites for bloggers, startups, small businesses and entrepreneurs. Easy to use, SEO optimised, hassle-free.",https://supapjpiqdfzuaordcdx.supabase.co/storage/v1/render/image/public/images/1729602967837-400x400-logo.png?width=75&height=75&resize=contain,False,['business'],30,True,2K,True,4620004,False,,,,#FFB828,en,15423.692052,996,True,5f603333-cfb6-475b-920e-c26e8a7e0c09,1663437341,1730057259
Product-Led Alliance | Product-Led Growth,https://www.productledalliance.com/,"Product-Led Alliance is a collective of passionate Product-Led leaders committed to sharing Product-Led growth success stories, experiences & challenges.",https://supapjpiqdfzuaordcdx.supabase.co/storage/v1/render/image/public/images/1679666109401-logomark_pla_color_square_2.png?width=75&height=75&resize=contain,False,['business'],14872,True,,False,629179,False,,,,#15171A,en,14872,94,True,298f4065-0a4b-4d43-8a5a-89588c0f934d,1679666110,1733493604
Super Send,https://blog.supersend.io/,Helpful Tips And Tricks For High Performance Outbound Campaigns,https://supapjpiqdfzuaordcdx.supabase.co/storage/v1/render/image/public/images/1669148765849-favicon.ico?width=75&height=75&resize=contain,False,['business'],14528,True,,False,13541864,False,,,,#303030,en,14528,2577,True,9bcd7f3a-40f1-44a2-b863-f87d8b8d05f1,1669148769,1732634378
How the F*ck,https://seo.thefxck.com/,SEO Case Studies & Content to Help You Scale Traffic,https://supapjpiqdfzuaordcdx.supabase.co/storage/v1/render/image/public/images/1684918105822-How-the-fxck-logo.png?width=75&height=75&resize=contain,False,['business'],0,False,1K,True,1989494,False,,,,#F1A86C,en,13895.540072,0,True,dcdfdd17-b8b9-4d49-96bd-a13b46643847,1664995872,1732698003
StartupTalky,https://startuptalky.com/,"StartupTalky is top startup media platform for latest startup news, ideas, industry research and reports, inspiring startup stories.",https://supapjpiqdfzuaordcdx.supabase.co/storage/v1/render/image/public/images/1722335210059-logo_V03--2-.png?width=75&height=75&resize=contain,False,['business'],11804,True,,False,22697,False,,,,#f95913,en,11804,0,True,dde8b640-0f71-4d4f-9bda-ecf8df65e4a3,1688554951,1733545811
Lexchart: AI Powered Org Charts.,https://lexchart.com/,"Lexchart draws your organization chart in seconds with powerful artificial intelligence to handle any company structure, even large and complex companies.",https://supapjpiqdfzuaordcdx.supabase.co/storage/v1/render/image/public/images/1677049470294-logo_200x200.png?width=75&height=75&resize=contain,False,['business'],11505,True,,False,5416136,False,,,,#F97316,en,11505,6,False,046ac2f5-1950-408a-9c5e-5be0382de6ec,1677049471,1722339959
Founder Club,https://www.founderclub.com/,"Learn how to grow your business with our directory of growth hacks, case studies and founder interviews.",https://supapjpiqdfzuaordcdx.supabase.co/storage/v1/render/image/public/images/1715876952275-author-copy.png?width=75&height=75&resize=contain,False,['business'],11024,True,,False,1573319,False,,,,#121141,en,11024,0,False,11f48b47-f075-48a1-b927-ece27d50ac1c,1715876954,1715875168
Customer Success Collective,https://www.customersuccesscollective.com/,Driving excellence in customer success.,https://supapjpiqdfzuaordcdx.supabase.co/storage/v1/render/image/public/images/1704377505889-Customer_Success_Collective-Icon.png?width=75&height=75&resize=contain,False,['business'],11000,True,,False,1277872,False,,,,#5036d5,en,11000,86,True,c7101704-3b06-4b44-ba8c-d9a2e484343b,1679666368,1733500806
Club Escribe PRO,https://club.escribe.pro/,"Avanza como profesional de la escritura en el mundo digital. Tutoriales, herramientas, técnicas y rutinas para escribir más y mejor, atraer lectores y monetizar tus contenidos.",https://supapjpiqdfzuaordcdx.supabase.co/storage/v1/render/image/public/images/1699547219616-android-chrome-192x192.png?width=75&height=75&resize=contain,False,['business'],214,True,1K,True,63466707,False,,,,#866F3C,es,10504.442195,3,True,4e49dde2-c65c-4d7b-a2bf-79422e8bf2bc,1699546574,1733380202
The Open Projects,https://www.theopenprojects.io/,Recibe cada viernes 3 ideas de negocio. Seleccionamos manualmente proyectos de éxito en Internet y te desvelamos todo sobre ellos para crear tu propio negocio online.,https://supapjpiqdfzuaordcdx.supabase.co/storage/v1/render/image/public/images/1669326284250-Logo_2_horizontal%20(1).png?width=75&height=75&resize=contain,False,['business'],10182,True,,False,2723096,False,,,,#ffab1a,es,10182,1,True,e759f050-51db-490d-8c90-5be9dc924b80,1669326287,1733486455
Econ Dev Show,https://econdevshow.com/,"The Econ Dev Show is a podcast and newsletter of actionable strategies, fresh news, insights, and ideas from Dane Carlson and the economic development community.",https://supapjpiqdfzuaordcdx.supabase.co/storage/v1/render/image/public/images/1725397207595-logo-small-3.png?width=75&height=75&resize=contain,False,['business'],9255,True,,False,3573110,False,,,,#15171A,en,9255,10,True,cc35ebd8-9a89-44a1-8c42-6bb686b9fdde,1658238539,1733493917
AI Accelerator Institute,https://www.aiacceleratorinstitute.com/,The future of machine intelligence,https://supapjpiqdfzuaordcdx.supabase.co/storage/v1/render/image/public/images/1704379744513-AIAI_Favicon_60x60px_.jpg?width=75&height=75&resize=contain,False,['business'],8869,True,,False,2042735,False,,,,#15171A,en,8869,269,True,eaebceae-605f-4fa5-9997-851bb364bf3c,1679669339,1733499748
Digitaal Vermogen door Denis Doeland,https://mail.denisdoeland.com/,"Alle inzichten voor een digitale strategie en transformatie die niet alleen de reputatie, maar ook de omzet en bedrijfswaarde van een organisatie laat groeien.",https://supapjpiqdfzuaordcdx.supabase.co/storage/v1/render/image/public/images/1673301326164-1673301300241-Denis-Doeland-Favicon.png?width=75&height=75&resize=contain,False,['business'],7988,True,,False,82768337,False,,,,#283981,nl,7988,8,True,03261e3a-0bf5-4903-8370-252e57d0cf4a,1673301301,1732662000
Hello Partner,https://hellopartner.com/,"With our news, insights and events - Hello Partner helps brands, creators, publishers and tech drive growth together through successful partnerships.",https://supapjpiqdfzuaordcdx.supabase.co/storage/v1/render/image/public/images/1669934126568-hp-icon.svg?width=75&height=75&resize=contain,False,['business'],7402,True,,False,832649,False,,,,#f6b706,en,7402,25,True,64d4917d-fbe4-4529-ac4a-1dee48ce7eac,1669934129,1733495704
Overwrite Media,https://www.overwritemedia.com/,The latest insights into the evolution of digital media.,https://supapjpiqdfzuaordcdx.supabase.co/storage/v1/render/image/public/images/1688591254513-Overwrite-Media-logo---500px-x-500px.png?width=75&height=75&resize=contain,False,['business'],6645,True,,False,4404611,False,,,,#000000,en,6645,0,True,b958e891-8a1b-4b8a-a563-9e17e1229988,1660753533,1722615058
零售的科學 By Happy Lee,https://happylee.blog/,零售業本質、科技、與未來， 91APP 產品長 李昆謀（Happy Lee）的個人網誌,https://supapjpiqdfzuaordcdx.supabase.co/storage/v1/render/image/public/images/1669128445004-logo_rs.001-2.png?width=75&height=75&resize=contain,False,['business'],5993,True,,False,2850215,False,,,,#ff2600,zh-hant,5993,14,True,ee384a45-daee-47c9-8a9a-b784edc1417d,1669128448,1733531413
Academy Resources,https://blog.academyux.com/,"We provide tools, resources, and industry expertise on all things Product Design to help industry leaders, teams, and talent thrive.",https://supapjpiqdfzuaordcdx.supabase.co/storage/v1/render/image/public/images/1679950033500-academy-logo-black-favicon-300x300.jpg?width=75&height=75&resize=contain,False,['business'],5974,True,,False,39438035,False,,,,#000000,en,5974,8,True,86a9dcfb-024e-4bd3-a299-8e1ff2583513,1674750552,1731938411
StrategyPunk,https://www.strategypunk.com/,"Everything strategy & beyond. All the content, templates, and worksheets to develop and execute your strategy.",https://supapjpiqdfzuaordcdx.supabase.co/storage/v1/render/image/public/images/1663503878524-brandmark-design--7-_60px.png?width=75&height=75&resize=contain,False,['business'],5319,True,,False,7270076,False,,,,#396d7a,en,5319,28,True,048b7d7b-9711-4b7f-9ae0-745dd6539ab9,1663503879,1733431311
PrivateEquityList,https://blog.privateequitylist.com/,Easy-to-use database to identify PE/VC investors and financing for any project with numerous filters optimizing the investor search,https://supapjpiqdfzuaordcdx.supabase.co/storage/v1/render/image/public/images/1663498734411-apple-touch-icon.png?width=75&height=75&resize=contain,False,['business'],4932,True,,False,963554,False,,,,#000000,en,4932,20,True,9d5350e4-a511-431c-9587-a328c4e9d17a,1663498735,1733590833
Affiliate Zest,https://www.affiliatezest.com/,Unleash affiliate marketing success with curated SaaS offers and expert education. Join now!,https://supapjpiqdfzuaordcdx.supabase.co/storage/v1/render/image/public/images/1693575396138-image_2023-07-25_140230207.png?width=75&height=75&resize=contain,False,['business'],4015,True,,False,28883310,False,,,,#fffb00,en,4015,6,True,b7d4f33c-5ded-449f-907f-08839a6dc433,1692782735,1725799415
"Sécurité Privée, CNAPS et agent de sécurité : Votre guide complet par des experts !",https://www.83-629.fr/,"Le site de la sécurité privée et des ssiap 1, est la première plateforme en ligne entièrement dédiée à l'intelligence opérationnelle dans le secteur de la sécurité privée ! Veille et analyse juridique",https://supapjpiqdfzuaordcdx.supabase.co/storage/v1/render/image/public/images/1698854609553-Design-sans-titre--2--1.png?width=75&height=75&resize=contain,False,['business'],3812,True,,False,1389220,False,,,,#ff0000,fr,3812,198,True,67e279c7-c308-44ae-a661-602ae954dfec,1698854610,1733475619
Dan's Dispatch,https://www.danmarzullo.com/,Get actionable frameworks and practical advice to help you reach your potential and build a business you're proud of.,https://supapjpiqdfzuaordcdx.supabase.co/storage/v1/render/image/public/images/1680641600114-D-removebg-preview.png?width=75&height=75&resize=contain,False,['business'],3613,True,0,True,8671107,False,,,,#f43434,en,3613,0,True,8dddbc3c-b530-46ee-a37a-e01901ba5c1a,1680641601,1732129576
Craft + Alchemy,https://www.canda.blog/,"좋은 전략, 좋은 제품, 좋은 마케팅, 좋은 비즈니스를 만드는 일에 대하여.",https://supapjpiqdfzuaordcdx.supabase.co/storage/v1/render/image/public/images/1661138302841-C--1-.png?width=75&height=75&resize=contain,False,['business'],3429,True,,False,13277594,False,,,,#121212,ko,3429,8,True,ec7b7a14-8467-4e8d-ad6c-9b51cf9fb34a,1661138303,1729320963
Future of SaaS,https://www.saasalliance.io/,A global alliance of leaders inspiring growth and inclusivity in SaaS.,https://supapjpiqdfzuaordcdx.supabase.co/storage/v1/render/image/public/images/1704381545493-saasfav-1.png?width=75&height=75&resize=contain,False,['business'],3404,True,,False,5251221,False,,,,#15171A,en,3404,12,True,efe4ac41-35f9-47b5-9c74-050705c2a4f2,1704380984,1733502655
PanoraVeille,https://www.panoraveille.com/,Service de veille de la Fédération des offices de tourisme de Bretagne,https://supapjpiqdfzuaordcdx.supabase.co/storage/v1/render/image/public/images/1688835284377-PanoraVeille---icon.png?width=75&height=75&resize=contain,False,['business'],3362,True,,False,21938298,False,,,,#bc3349,fr,3362,11,True,051eee12-c904-4c7c-a9fc-c088091c38b7,1685078552,1733470423
Freelance Writers Online,https://www.freelancewritersonline.com/,"Write well, live well.",https://supapjpiqdfzuaordcdx.supabase.co/storage/v1/render/image/public/images/1676286270554-Favicon---colour.png?width=75&height=75&resize=contain,False,['business'],2894,True,19,True,2031341,False,,,,#21adbb,en,3084,1,True,43fa74f7-a839-49c4-9fd6-bab751e16664,1676286271,1733455680
Upmynt Marketing 🇫🇷,https://www.upmynt.com/,"Chaque lundi et mercredi, recevez les insights, les astuces et les conseils pour faire passer le marketing de votre marque à la vitesse supérieure.",https://supapjpiqdfzuaordcdx.supabase.co/storage/v1/render/image/public/images/1675690911882-android-chrome-192x192.png?width=75&height=75&resize=contain,False,['business'],3078,True,,False,27863816,False,,,,#08a0db,fr,3078,209,True,d48bfd1c-a6df-4528-9c4c-71e099c9e5c7,1675106574,1733502038
Anh Thu Do,https://www.anhthudo.com/,"Personal development, career growth and building a business in the weekends by Anh Thu Do. Follow @dowithanhthu on LinkedIn.",https://supapjpiqdfzuaordcdx.supabase.co/storage/v1/render/image/public/images/1706270802602-ATD_logosai-02.png?width=75&height=75&resize=contain,False,['business'],2938,True,,False,10496915,False,,,,#F15C22,en,2938,5,True,613828da-4a5c-4aa7-8c90-c0a9f210e44e,1705209984,1733499253
Nico's blog,https://www.nicooud.com/,"Sluit je aan bij meer dan 10.000 anderen die brain food ontvangen dat je nergens anders vindt, om sneller te groeien.",https://supapjpiqdfzuaordcdx.supabase.co/storage/v1/render/image/public/images/1711006661444-Growth-Minds--1-.jpg?width=75&height=75&resize=contain,False,['business'],2672,True,,False,37552341,False,,,,#5E17FB,en,2672,0,True,1c290197-3e16-4ddf-8a93-866f1c9ea874,1711006663,1710949899
re-sources,https://re-sources.co/,News & insights for actionable sustainability in beauty,https://supapjpiqdfzuaordcdx.supabase.co/storage/v1/render/image/public/images/1702577947353-Re.-Sources---Logo-abr.-blanc.png?width=75&height=75&resize=contain,False,['business'],2490,True,,False,15267091,False,,,,#1E4553,en,2490,1,True,846c8255-9f54-42e9-9aea-20d2a4ed7bc7,1675179508,1733474715
The Spark from Matchbook,https://www.mtchbk.com/,"A strategic agency, serving up marketing campaigns, brands and insight each week.",https://supapjpiqdfzuaordcdx.supabase.co/storage/v1/render/image/public/images/1689947922420-mbk-2.png?width=75&height=75&resize=contain,False,['business'],2330,True,,False,4397788,False,,,,#F2684E,en,2330,4,True,12d83633-c6cb-4dd5-a882-fc576ebf6524,1689947923,1730306028
The Content Technologist,https://www.content-technologist.com/,A resource for content professionals working in the age of algorithms,https://supapjpiqdfzuaordcdx.supabase.co/storage/v1/render/image/public/images/1693511564130-content-technologist-icon--1--1.png?width=75&height=75&resize=contain,False,['business'],2210,True,,False,3015233,False,,,,#42D97F,en-us,2210,11,True,42ea133a-fa0c-4f97-9335-f64b0ed71e07,1663176948,1733494740
Craftsman Creative Blog,https://www.craftsmancreative.co/,We help artists and creators build resilient six-figure businesses,https://supapjpiqdfzuaordcdx.supabase.co/storage/v1/render/image/public/images/1667938534222-Craftsman-Creative-Logo-Only.png?width=75&height=75&resize=contain,False,['business'],336,True,186,True,2738717,False,,,,#1497D1,en,2200.9,418,True,bf5f2c1a-0e58-4a45-9dcb-8ad95fc02127,1667938537,1720476931
Herizon,https://blog.herizon.io/,We make the tech world more diverse by linking international talent with jobs in the Nordics.,https://supapjpiqdfzuaordcdx.supabase.co/storage/v1/render/image/public/images/1725019737120-logo256.png?width=75&height=75&resize=contain,False,['business'],2008,True,,False,74868780,False,,,,#f952ff,en,2008,24,True,04c16849-2cb8-48c3-ba6c-0872bffafcbd,1711138414,1730797610
The Sustainable Investor,https://www.thesustainableinvestor.org.uk/,"Bridging the gap between sustainability & finance - because if we don't, our sustainability transitions will fail.",https://supapjpiqdfzuaordcdx.supabase.co/storage/v1/render/image/public/images/1669205537984-The-Sustainable-Investor.png?width=75&height=75&resize=contain,False,['business'],649,True,132,True,11710457,False,,,,#287642,en,1971.37172,0,True,2ee5331a-0c44-4a3a-88ce-da84b51c5f31,1669205539,1733052957
Antropomedia Express: Consumer Tribes,https://www.consumertribes.com/,The Encyclopedia of Consumer Tribes,https://supapjpiqdfzuaordcdx.supabase.co/storage/v1/render/image/public/images/1687216418425-Favicon-Antropomedia-Express_Gray_Mesa-de-trabajo-1.png?width=75&height=75&resize=contain,False,['business'],1909,True,,False,60498992,False,,,,#00AFAA,en,1909,70,True,dad8d428-af65-41bd-bdbd-ccd07569becd,1687216419,1733446462
Matt Rutherford 👓,https://www.mattrutherford.co.uk/,Weekly insights to help you and your career.,https://supapjpiqdfzuaordcdx.supabase.co/storage/v1/render/image/public/images/1724081666189-favicon.png?width=75&height=75&resize=contain,False,['business'],1854,True,,False,4641265,False,,,,#4e1494,en,1854,8,True,f7fb9c9c-3dd4-4d4a-9075-cf65cac6a507,1660560947,1733499880
Media Minds by Adriana Lacy Consulting,https://blog.adrianalacyconsulting.com/,We offer innovative strategies and expert insights for media and publishing professionals.,https://supapjpiqdfzuaordcdx.supabase.co/storage/v1/render/image/public/images/1682898211288-ALC---square-icon.png?width=75&height=75&resize=contain,False,['business'],1624,True,,False,2921715,False,,,,#fc221c,en,1624,1,True,595e121d-d44e-41dd-a70f-044a672a7f72,1681579081,1733490034
Twotone Consulting | Est. 2014,https://www.twotoneams.nl/,"Twotone offers sales, marketing, PR & creative services for cycling brands. Please subscribe to our weekly newsletter:",https://supapjpiqdfzuaordcdx.supabase.co/storage/v1/render/image/public/images/1724948183471-new-twotone-logo-1.png?width=75&height=75&resize=contain,False,['business'],1486,True,,False,5158868,False,,,,#f25a20,en,1486,6,True,0863cd21-b4c0-4b33-a992-d0c76e022e62,1673224640,1732514442
Sensible Futures,https://www.sensiblefutures.co/,Better futures through design ✨ A framework of methods and activities to enable change-makers to drive positive change. Free if you need it to be.,https://supapjpiqdfzuaordcdx.supabase.co/storage/v1/render/image/public/images/1678976670889-Green_5cm.png?width=75&height=75&resize=contain,False,['business'],1478,True,,False,19277989,False,,,,#2bbc49,en,1478,2,True,d678fa42-1b06-45a7-8588-9d139f8d83a3,1678976672,1679384244
Strategic Design Monthly,https://www.strategicdesign.com/,"Where business leaders find insights, solutions, and strategies for driving sustained growth and differentiation through design.",https://supapjpiqdfzuaordcdx.supabase.co/storage/v1/render/image/public/images/1723126425364-bubble.png?width=75&height=75&resize=contain,False,"['design', 'business']",1433,True,0,True,281976949,False,,,,#ff0000,en,1433,1,True,b36e0859-f357-4e3c-887a-0132efa89976,1722673781,1731596442
Content Class by David Ramos,https://www.contentclass.org/,"Here to offer creators deep, original, actionable insights into their industry.",https://supapjpiqdfzuaordcdx.supabase.co/storage/v1/render/image/public/images/1693255079562-icon%20307.svg?width=75&height=75&resize=contain,False,['business'],1252,True,,False,52711864,False,,,,#0072ef,en,1252,0,True,975926bd-9313-42dd-9cae-82701b5c6265,1660077430,1732877161
Marketing Junto | News & Commentary About Digital Marketing,https://marketingjunto.com/,"Marketing Junto is a weekly newsletter about the ever-changing landscape of digital marketing. From web design trends to SEO & paid search to social media, it’s all covered.",https://supapjpiqdfzuaordcdx.supabase.co/storage/v1/render/image/public/images/1711638050678-fav.png?width=75&height=75&resize=contain,False,['business'],1229,True,,False,4897732,False,,,,#003366,en,1229,1,True,f8c978b3-3ba1-4a3c-a1c0-31c4ba8c83f8,1676824655,1733319606
Mari Luukkainen,https://www.mariluukkainen.com/,"Pre-seed VC investor, growth operator, startup growth advisor, and keynote speaker. On this site, I share learnings about startup growth.",https://supapjpiqdfzuaordcdx.supabase.co/storage/v1/render/image/public/images/1689697606252-icon1.jpg?width=75&height=75&resize=contain,False,['business'],1212,True,,False,13972613,False,,,,#ff5cf1,en,1212,1,True,f4a1fd82-54bc-4166-889a-71e1a3daa2e4,1683569671,1733121132
