LadyBeauvoir,https://ladybeauvoir.ghost.io/,Feminist OH GAWD The F Word. She said it. All things ladies and men. But dont forget we dont have a cock and we cant understand what it is to be a man. Fact. Why we will never be one.,https://supapjpiqdfzuaordcdx.supabase.co/storage/v1/render/image/public/images/1737453553587-LziKv84mSLKKeaA-kpMAjg.webp?width=75&height=75&resize=contain,False,['culture'],0,False,,False,10500000,False,,,,#FF1A75,en,0,0,True,b275ff61-3dce-4f47-ba0a-197c3d69a9fc,1737453554,1737424230
Dan Smock,https://www.dansmock.com/,"mutterings, musings, minutiae",https://supapjpiqdfzuaordcdx.supabase.co/storage/v1/render/image/public/images/1728080057589-Headshot-230810-1.png?width=75&height=75&resize=contain,False,['culture'],0,False,,False,10500000,False,,,,#203e5d,en,0,0,True,b172a207-1385-481f-a290-134774a6022d,1728080059,1728033605
Loose Land,https://loose-land.ghost.io/,Loose Land is a monthly newsletter that offers a rundown of upcoming cultural activities throughout Los Angeles,https://supapjpiqdfzuaordcdx.supabase.co/storage/v1/render/image/public/images/1739383163939-Square-Icon-Blue.png?width=75&height=75&resize=contain,False,['culture'],0,False,,False,10500000,False,,,,#0368B4,en,0,0,True,b0c819e4-66d0-4591-b80f-bb57f549c72a,1739383164,1738422001
The Lost Cartridge,https://thelostcartridge.com/,"A sanctuary for analogue & digital nostalgia. Celebrating 🕹️ retro gaming, 👾 arcade culture, 🪩 synthwave music and 🎬 80s films",https://supapjpiqdfzuaordcdx.supabase.co/storage/v1/render/image/public/images/1735298072337-favicon-1.ico?width=75&height=75&resize=contain,False,['culture'],0,False,,False,10500000,False,,,,#FF1A75,en,0,0,True,afc165f6-8250-457f-a8b6-0fa77a91cbbb,1735298073,1735278576
SuperRad,https://www.superrad.pub/,"Your favorite 80s and 90s pop culture, reimagined for today—with extra snark. We're not throwing shade, we're just keeping it rad. (Subscribe for hot takes.)",https://supapjpiqdfzuaordcdx.supabase.co/storage/v1/render/image/public/images/1738866361175-SuperRad-S.png?width=75&height=75&resize=contain,False,['culture'],0,False,,False,10500000,False,,,,#EF3EF6,en,0,0,True,a8d79beb-b4b9-4a75-9605-04c4a3f3443b,1738866362,1738866157
DIGITAL RENEGADE,https://digital-renegade.ghost.io/,"Essays, Short Stories & Novels",https://supapjpiqdfzuaordcdx.supabase.co/storage/v1/render/image/public/images/1708602493333-DIGITAL-RENEGADE-2.png?width=75&height=75&resize=contain,False,['culture'],0,False,,False,10500000,False,,,,#002e7a,en,0,0,True,9f0b406f-697d-40df-b735-6cb20a4e51d3,1682975502,1744297236
@kyleisun.cool,https://kyleisun.cool/,"the journal of kyle joseph | 🦄 writer, photographer, designer, & film maker",https://supapjpiqdfzuaordcdx.supabase.co/storage/v1/render/image/public/images/1704152857102-site-favi.png?width=75&height=75&resize=contain,False,['culture'],0,False,,False,10500000,False,,,,#382553,en,0,0,True,9d04130c-57e0-4aa0-b3dc-d41dd7dc3101,1704152858,1704068610
Blog o komiksach,https://blogokomiksach.pl/,"Blog poświęcony tematyce komiksu. Recenzje komiksów, zapowiedzi komiksowe, zapowiedzi Egmontu, zapowiedzi Scream Comics, publicystyka",https://supapjpiqdfzuaordcdx.supabase.co/storage/v1/render/image/public/images/1737104078595-1736632061028.png?width=75&height=75&resize=contain,False,['culture'],0,False,,False,10500000,False,,,,#b19a4f,pl,0,0,False,94575e29-5016-4cf4-aa74-92891a83f086,1737104079,1737103125
Popculturology,https://www.theomnicosm.com/,A week of pop culture in one newsletter.,https://supapjpiqdfzuaordcdx.supabase.co/storage/v1/render/image/public/images/1726400030363-square-rebrand-green-1.png?width=75&height=75&resize=contain,False,['culture'],0,False,,False,10500000,False,,,,#89C764,en,0,0,True,8c972450-7ef4-45df-b19e-edad281a4560,1705077502,1744408842
Goblin Market,https://goblin-market.ghost.io/,Imagining Alternative Arts Marketplace,https://supapjpiqdfzuaordcdx.supabase.co/storage/v1/render/image/public/images/1744386903679-goblingoblin-market_1-1.png?width=75&height=75&resize=contain,False,['culture'],0,False,,False,10500000,False,,,,#9e0202,en,0,0,True,7672d61e-977e-4d5f-b1a8-032bdba76995,1744386905,1744302760
The Wingback Workshop,https://wingbackworkshop.com/,"Dispatches from a little literary life - book reviews, reading guides, essays, and more.",https://supapjpiqdfzuaordcdx.supabase.co/storage/v1/render/image/public/images/1739459696810-Wingback-square.jpg?width=75&height=75&resize=contain,False,['culture'],0,False,,False,10500000,False,,,,#0468bf,en,0,0,True,75d7c51c-43c8-40cd-9a1f-938408507351,1739459698,1739196727
How To Get Things Less Wrong,https://how-to-get-things-less-wrong.ghost.io/,Tools for Navigating Reality's Terrain and Rivers,https://supapjpiqdfzuaordcdx.supabase.co/storage/v1/render/image/public/images/1743769825877-ANWR%20Wetland%20-%20Lisa%20Hupp%20USFWS.jpg?width=75&height=75&resize=contain,False,['culture'],0,False,,False,10500000,False,,,,#068e72,en,0,0,True,7421a3bd-b268-4ab3-873f-6b4fcd0c2638,1743769714,1744328580
Louche Leaves,https://loucheleaves.com/,"An Irregular Journal of Thoughts, Stories, Ideas and Recollections",https://supapjpiqdfzuaordcdx.supabase.co/storage/v1/render/image/public/images/1714261503136-Luminoth-rapie_-_Monch-1.jpg?width=75&height=75&resize=contain,False,['culture'],0,False,,False,10500000,False,,,,#f1aa37,en,0,0,False,70c259e3-7d08-449f-9548-8924f65294da,1714261505,1714176257
Der Spekter,https://www.derspekter.org/,A journal of Bundist perspectives and original work,https://supapjpiqdfzuaordcdx.supabase.co/storage/v1/render/image/public/images/1720823767398-webpage-english-round-3.png?width=75&height=75&resize=contain,False,['culture'],0,False,,False,10500000,False,,,,#b81919,en,0,0,True,6d4b32b5-6592-4c30-850b-018bd758ab7c,1720823768,1743895905
Big Sun Press,https://bigsunpress.com/,"One-man publishing house in the Antipodes. Sharing new releases, and multi-format posting on written and lived culture.",https://supapjpiqdfzuaordcdx.supabase.co/storage/v1/render/image/public/images/1705700430583-Untitled-1-02-1.png?width=75&height=75&resize=contain,False,['culture'],0,False,,False,10500000,False,,,,#DC3456,en,0,0,True,69d7143e-4338-4e0f-ae59-dcc966dba502,1705700433,1705310993
Gezgin Durağı,https://gezginduragi.com/,"Bir gezginin uğradığı yerler, tarihi eserler, müzeler yemekler ve çok daha fazlası",https://supapjpiqdfzuaordcdx.supabase.co/storage/v1/render/image/public/images/1739040639732-cup-soda.png?width=75&height=75&resize=contain,False,['culture'],0,False,,False,10500000,False,,,,#FF1A75,tr,0,0,True,678afd79-7e3a-4e0e-bf6e-a423f614893d,1739040641,1739040270
Brandon Page's TV Reviews and Song Breakdowns,https://www.pagesofbrandon.com/,"Reviews, Critiques and Episode Guides on Buffy, Matrix-type Movies, Twin Peaks, Taylor Swift, Gilmore Girls, Music and More. Stay Updated Daily by Subscribing.",https://supapjpiqdfzuaordcdx.supabase.co/storage/v1/render/image/public/images/1687188448057-tghe.jpg?width=75&height=75&resize=contain,False,['culture'],0,False,,False,10500000,False,,,,#650500,en,0,0,True,632373c8-b422-4245-a605-874b24283b27,1687188449,1743667411
anything / everything,https://anything-everything.ghost.io/,"Hi I'm Graham: grumpy Montrealer, lover of music, hater of capitalism. I send out a mixtape of (mostly) new music about once a month, along with a bit of writing about culture and politics.",https://supapjpiqdfzuaordcdx.supabase.co/storage/v1/render/image/public/images/1743508049472-the-ice-2.jpg?width=75&height=75&resize=contain,False,['culture'],0,False,,False,10500000,False,,,,#a1c3f2,en,0,0,True,583990e5-7721-4fc7-b729-d2bc84e87501,1743508050,1743506174
"Blog Chico Rei: um bocado de conteúdo sobre brasilidade, cultura pop, arte e muito mais",http://44.203.69.106/,"Reunimos um pouquinho de tudo: conteúdos geeks, filmes, séries, literatura, música, cultura popular e muito mais. Confira aqui no Blog da Chico Rei!",https://supapjpiqdfzuaordcdx.supabase.co/storage/v1/render/image/public/images/1707540987864-favicon-amarelo.png?width=75&height=75&resize=contain,False,['culture'],0,False,,False,10500000,False,,,,#FF1A75,pt-br,0,0,True,56fa63ab-a9b9-4af1-924d-db2b41bda885,1707540990,1707503654
The MAD Report,https://www.themadreport.io/,"tech, manufacturing, aerospace, defense. for the optimists.",https://supapjpiqdfzuaordcdx.supabase.co/storage/v1/render/image/public/images/1740270061452-MAD.png?width=75&height=75&resize=contain,False,['culture'],0,False,,False,10500000,False,,,,#ff004b,en,0,0,True,51706859-c963-4b5f-9783-5220b47eb512,1740270062,1744006520
Midbrow,https://midbrow.org/,Delightful reviews of your city's best arts and culture.,https://supapjpiqdfzuaordcdx.supabase.co/storage/v1/render/image/public/images/1731160085884-Screenshot%202024-11-09%20at%2008.47.44.png?width=75&height=75&resize=contain,False,['culture'],0,False,,False,10500000,False,,,,#2a2240,en,0,0,True,4e09ebdf-0fe0-4613-8915-fd96a59fe2a9,1730383796,1744396357
Nothing Earth Shattering,https://tumshie.ghost.io/,"Technology, culture, angst, pop: sometimes with a Scottish angle. The personal news and views of Hugh Wallace.",https://supapjpiqdfzuaordcdx.supabase.co/storage/v1/render/image/public/images/1737645398786-tumsh.png?width=75&height=75&resize=contain,False,['culture'],0,False,,False,10500000,False,,,,#29c100,en,0,0,True,4a9345fa-0a3e-4a5c-9568-af919d67358f,1737645399,1743442696
ESC KEY .CO by JD Shadel,https://www.esckey.co/,The only lifestyle newsletter on the internet. *Wink.* Join terminally online pros who read JD Shadel's weekly reporting on the forces reshaping how we live and work.,https://supapjpiqdfzuaordcdx.supabase.co/storage/v1/render/image/public/images/1741271767202-ESC-KEY-.CO-red-icon.png?width=75&height=75&resize=contain,False,['culture'],0,False,,False,10500000,False,,,,#FF0000,en,0,0,True,49e8921c-eaea-4356-b553-2fb94a148ad0,1741271768,1743964234
Crossword Craze,https://crosswordcraze.today/,"Ephemeral gems from the crossword archives, republished after exactly 100 years",https://supapjpiqdfzuaordcdx.supabase.co/storage/v1/render/image/public/images/1713379381219-crossword-craze-1.png?width=75&height=75&resize=contain,False,['culture'],0,False,,False,10500000,False,,,,#9a9996,en,0,0,True,457b442f-c508-4518-b1d6-555bc9f05d70,1713379383,1713364851
Der Flaneur,https://derflaneur.de/,Spaziergänge und Abschweifungen in Hamburg. Ambulantes Feuilleton von Stephan Maus.,https://supapjpiqdfzuaordcdx.supabase.co/storage/v1/render/image/public/images/1737732952472-elphi.jpeg?width=75&height=75&resize=contain,False,['culture'],0,False,,False,10500000,False,,,,#FF1A75,en,0,0,True,41adcf01-ffb5-4944-b1a0-b746f58eb7a6,1737732954,1737201765
Finite Scroll,https://www.finitescroll.org/,"Finite Scroll is a weekly drop of stories about tech, social, culture, and all things extremely online. ✨",https://supapjpiqdfzuaordcdx.supabase.co/storage/v1/render/image/public/images/1714164139392-301726303_373128625008681_4415477406579589576_n.jpg?width=75&height=75&resize=contain,False,['culture'],0,False,,False,10500000,False,,,,#0742f2,en,0,0,True,3f37f29b-03eb-4510-9e81-7577e98ff5b4,1714164141,1714140314
Ash Mann,https://www.ashmann.co/,Thinking about digital stuff for the cultural sector.,https://supapjpiqdfzuaordcdx.supabase.co/storage/v1/render/image/public/images/1744107093794-Ash-Mann_foto_Ellika-H_web_003.jpg?width=75&height=75&resize=contain,False,['culture'],0,False,,False,10500000,False,,,,#ff1a75,en,0,0,True,3e067a2d-353b-4184-ac59-619d35557b93,1705312925,1744354873
Gay Times Magazine,https://magazine.gaytimes.com/,"The home of LGBTQIA+ investigations, award-winning features and in-depth journalism for over 40 years",https://supapjpiqdfzuaordcdx.supabase.co/storage/v1/render/image/public/images/1737732864302-Screenshot%202025-01-24%20153409.png?width=75&height=75&resize=contain,False,['culture'],0,False,,False,10500000,False,,,,#beb99e,en,0,0,True,3c6a88a0-c918-498a-b6b5-7b08ef8336f4,1737732865,1737673500
A Load of Orgness 🫠,https://a-load-of-orgness.ghost.io/,People + Organisations + Tech = A lot of DEI,https://supapjpiqdfzuaordcdx.supabase.co/storage/v1/render/image/public/images/1734628883768-Jai_Clarke-Binns_jaicb@_005.jpg?width=75&height=75&resize=contain,False,['culture'],0,False,,False,10500000,False,,,,#ff9219,en,0,0,True,27c9b989-271a-4088-8530-67c683cea05c,1734628885,1734585024
SWIF,https://swif.ghost.io/,"Meet ups, screenings, film funds and more for the south west independent film community, UK.",https://supapjpiqdfzuaordcdx.supabase.co/storage/v1/render/image/public/images/1742920211742-SWIF-logo.png?width=75&height=75&resize=contain,False,['culture'],0,False,,False,10500000,False,,,,#5271ff,en,0,0,True,21c895b0-d47b-42d4-a71f-5e0a1c03738d,1740075547,1744103503
Thinker's Corner,https://thinkers-corner.ghost.io/,"Exploring ideas, society, and culture with deep questions and thoughtful insights. A space for curious minds to think beyond the obvious and uncover the ideas that shape our world. 💡🔍",https://supapjpiqdfzuaordcdx.supabase.co/storage/v1/render/image/public/images/1738779714554-04.02.2025_22.05.34_REC.png?width=75&height=75&resize=contain,False,['culture'],0,False,,False,10500000,False,,,,#FF1A75,en,0,0,True,21b0d137-34e8-4ba5-867e-b6e2ac15fdea,1738779716,1738699219
(required field) Transmissions,https://news.requiredfieldproductions.com/,"Creativity. Technology. Occasionally monsters. With jokes. Uncommon insights learned from creating for Microsoft, the Edinburgh Festival Fringe, and a bunch of film festivals.",https://supapjpiqdfzuaordcdx.supabase.co/storage/v1/render/image/public/images/1736791220065-Autosig-logo-1.png?width=75&height=75&resize=contain,False,['culture'],0,False,,False,10500000,False,,,,#3ab3c6,en,0,0,True,196bf035-cd0a-4a5b-9cf9-55991e1e9bf3,1731202002,1743098444
The Sunday Glossword,https://www.thesundayglossword.com/,The NYT Sunday Crossword – annotated.,https://supapjpiqdfzuaordcdx.supabase.co/storage/v1/render/image/public/images/1738446929579-small-logo.png?width=75&height=75&resize=contain,False,['culture'],0,False,,False,10500000,False,,,,#717bc5,en,0,0,True,10db0893-f029-4695-9c32-34076e29c8aa,1738446931,1743865213
Round World Society,https://round-world-society.ghost.io/,Because the world is round and facts matter.,https://supapjpiqdfzuaordcdx.supabase.co/storage/v1/render/image/public/images/1739301621204-IMG_6233.jpeg?width=75&height=75&resize=contain,False,['culture'],0,False,,False,10500000,False,,,,#FF1A75,en,0,0,True,108fffc0-8dab-4085-9a35-3ab3cb9ca360,1738887754,1743430506
Exds Web Digest,https://www.603550.xyz/,Exds Web Digest is a delicious blog,https://supapjpiqdfzuaordcdx.supabase.co/storage/v1/render/image/public/images/1701411265254-heart_ukraine_peace_freedom_fly_dove_charity_bird_icon_219127-1.png?width=75&height=75&resize=contain,False,['culture'],0,False,,False,10500000,False,,,,#857dbd,cn,0,0,True,0d9b2272-eb8d-4ec2-8ac0-13b54206dfe5,1701411266,1700756746
a sunday note,https://sundaynote.ghost.io/,things that were good from the week that was,https://supapjpiqdfzuaordcdx.supabase.co/storage/v1/render/image/public/images/1713840649025-Clean%20Modern%20Programmer%20Developer%20Web%20Designer%20Logo.png?width=75&height=75&resize=contain,False,['culture'],0,False,,False,10500000,False,,,,#3b98a1,en,0,0,True,0d457b8d-240a-4669-817f-9da543e8da5b,1713840650,1713751211
PrizeFighting.org,https://prizefighting.org/,"Boxing blog about the past, present, and future of the sport. And also miscellaneous boxing media. Sometimes about other things too.",https://supapjpiqdfzuaordcdx.supabase.co/storage/v1/render/image/public/images/1737271146032-favicon---Copy.ico?width=75&height=75&resize=contain,False,['culture'],0,False,,False,10500000,False,,,,#24b0f4,en,0,0,True,0910722b-991d-4a7e-9735-78c8479e947e,1737271147,1736565439
Huxleian,https://www.huxleian.com/,"Commodized Consumerism Society Tidbits of Digital Nomadism, Travel and Life.",https://supapjpiqdfzuaordcdx.supabase.co/storage/v1/render/image/public/images/1670197022562-tactics.png?width=75&height=75&resize=contain,False,['culture'],0,False,,False,10500000,False,,,,#5e5851,en,0,0,True,07e28665-6023-4ef4-a587-de58d5087c6f,1670197023,1741829855
Pocket Observatory,https://www.pocketobservatory.org/,"Writing from the intersection of capitalism, culture and care work.",https://supapjpiqdfzuaordcdx.supabase.co/storage/v1/render/image/public/images/1710025698599-Copy-of-pocket-observatory-logo-5.png?width=75&height=75&resize=contain,False,['culture'],0,False,,False,10500000,False,,,,#F14535,en,0,0,True,01ded72f-7b53-423e-aaca-92002d55617a,1710025699,1709943587
Jen Myers: The Newsletter,https://newsletter.jenmyers.net/,Free monthly newsletter of ideas and happenings from writer and technologist Jen Myers,https://supapjpiqdfzuaordcdx.supabase.co/storage/v1/render/image/public/images/1703789725161-jm-swallow.png?width=75&height=75&resize=contain,False,['culture'],0,False,,False,10513462,False,,,,#e13e3e,en,0,0,False,d62eca03-875f-4093-8365-441c9723c5cc,1703789726,1701381742
Kyle's Junk Drawer,https://newsletter.houseofkyle.com/,"Recommended articles, social posts and videos on culture, tech, entertainment & more. Free every Sunday morning!",https://supapjpiqdfzuaordcdx.supabase.co/storage/v1/render/image/public/images/1725726171775-icon.png?width=75&height=75&resize=contain,False,['culture'],0,False,,False,10699707,False,,,,#7746d4,en,0,0,True,af4a006b-efcd-45f8-aea9-cfe971368ee0,1713717478,1743944408
Homesick: An Atlas,https://www.duncand.com/,"Homesick: An Atlas is a memoir by Duncan Dobbelmann, published serially by email and archived on this site. Subscription is free. No ads, no spam. Check it out below.",https://supapjpiqdfzuaordcdx.supabase.co/storage/v1/render/image/public/images/1660057408183-Dama 2 copy.jpg?width=75&height=75&resize=contain,False,['culture'],0,False,,False,11000000,False,,,,#ff572f,en,0,0,True,be538750-83cb-4242-b115-a90c7664ed7d,1660057409,1741457227
Cinématique,https://cinematique.ghost.io/,Writings on film,https://supapjpiqdfzuaordcdx.supabase.co/storage/v1/render/image/public/images/1721137909985-IMG_0175.jpg?width=75&height=75&resize=contain,False,['culture'],0,False,,False,11500000,False,,,,#FF1A75,en,0,0,True,ca036a45-c8b5-4efc-aadb-df7e184f6e07,1721137911,1720014296
Brown Paper Packages,https://brownpaperpackages.ghost.io/,"A few favorite things, shared weekly(ish): music, literature, slow-cooked food for thought. A tiny, shiny treasure trove of keys to the sublime.",https://supapjpiqdfzuaordcdx.supabase.co/storage/v1/render/image/public/images/1740610582309-khampha-phimmachak-1MpazUuiIDI-unsplash.jpg?width=75&height=75&resize=contain,False,['culture'],0,False,,False,11500000,False,,,,#417114,en,0,0,True,c9e2f5d9-a0fb-4a7d-804c-da30bdadc97f,1740610583,1740610412
80 ALARMS,https://www.80alarms.com/,This is 80 ALARMS. 80 posts that you can receive in your inbox. May you find the revolution before it's over.,https://supapjpiqdfzuaordcdx.supabase.co/storage/v1/render/image/public/images/1713114115592-80%20ALARMS.png?width=75&height=75&resize=contain,False,['culture'],0,False,,False,11500000,False,,,,#DCB104,en,0,0,True,9d08fedc-2ac8-4771-9c35-9bc988d14115,1713114117,1713090660
clarityandconfidenceacademy,https://clarityandconfidenceacademy.ghost.io/,hi to welcome to my site,https://supapjpiqdfzuaordcdx.supabase.co/storage/v1/render/image/public/images/1725131570485-cZIlbGwAwRzfCoW3r4mxj3NQnNq1682341299762_200x200.png?width=75&height=75&resize=contain,False,['culture'],0,False,,False,11500000,False,,,,#FF1A75,en,0,0,True,83db98da-76b5-4c30-a61f-d46e98201ded,1725131572,1725131325
INDIGHUB LABS,https://www.indighub.org/,Empower. Connect. Thrive.,https://supapjpiqdfzuaordcdx.supabase.co/storage/v1/render/image/public/images/1716594119835-DALL-E-2024-05-23-23.45.57---A-clean-and-minimalist-favicon-design-for-IndigHub.-The-favicon-should-incorporate-elements-of-Indigenous-culture-in-a-subtle-and-modern-way.-It-shoul.webp?width=75&height=75&resize=contain,False,['culture'],0,False,,False,11500000,False,,,,#EA445A,en,0,0,True,836e0ef0-14b1-4ed1-99eb-ab40c625a6b9,1716594121,1716593462
From Odessa to the Future,https://from-odessa-to-the-future.ghost.io/,"Thoughts about the future, informed by the past.",https://supapjpiqdfzuaordcdx.supabase.co/storage/v1/render/image/public/images/1740762862492-_wikipedia_commons_8_87_Potemkinstairs.webp?width=75&height=75&resize=contain,False,['culture'],0,False,,False,11500000,False,,,,#2D5F8A,en,0,0,True,7649aea8-33cf-4371-ba73-af7dd321194c,1740762863,1740608352
sowhocares?,https://sowhocares.ghost.io/,"I write about things I care about such as the environment, nature, culture etc :)",https://supapjpiqdfzuaordcdx.supabase.co/storage/v1/render/image/public/images/1733389013895-so-who-cares.png?width=75&height=75&resize=contain,False,['culture'],0,False,,False,11500000,False,,,,#a2c583,en,0,0,True,72f4cebd-5839-4d13-9fdb-305011c4e4db,1733389015,1733365792
Curated by McBride,https://curated-by-mcbride.ghost.io/,"Curated Style, Inspired Living",https://supapjpiqdfzuaordcdx.supabase.co/storage/v1/render/image/public/images/1728858573074-DTS_System_Caroline_Fayette_Photos_ID4701.jpg?width=75&height=75&resize=contain,False,['culture'],0,False,,False,11500000,False,,,,#F4B6C2,en,0,0,True,4e03659a-d88b-48aa-8718-fa7548beea1d,1728858574,1728853723
It Was Ninety Years Ago Today...,https://it-was-ninety-years-ago-today.ghost.io/,"Ramblings from podcaster Andrew Hickey about music, comics, politics and other things not directly connected to his podcast (except when they are).",https://supapjpiqdfzuaordcdx.supabase.co/storage/v1/render/image/public/images/1737583382547-me.jpg?width=75&height=75&resize=contain,False,['culture'],0,False,,False,11500000,False,,,,#FF1A75,en,0,0,True,2b49041f-cc24-41a9-8d78-b2f0edfc9f82,1737583383,1737583195
One Last Scare,https://one-last-scare.ghost.io/,One Last Scare is a newsletter dedicated to exploring the richness and diversity of the horror genre.,https://supapjpiqdfzuaordcdx.supabase.co/storage/v1/render/image/public/images/1708539347441-IMG_1060.jpeg?width=75&height=75&resize=contain,False,['culture'],0,False,,False,11500000,False,,,,#ff3c1a,en,0,0,True,270b1e04-1f7e-449f-80fb-e124a67ad440,1708539348,1708536216
OnlySky,https://onlys.ky/,"Journey into a future shaped by creativity, critical thought, and secular habits of mind. Help shape what’s next!",https://supapjpiqdfzuaordcdx.supabase.co/storage/v1/render/image/public/images/1728529175598-6-25-243pm-OS_FAVICON.svg?width=75&height=75&resize=contain,False,['culture'],0,False,,False,12581496,False,,,,#e65e04,en,0,0,True,571196d5-a868-4f74-a589-087b08f2742c,1724125770,1744053998
James Lanternman,https://jameslanternman.online/,"James Lanternman writes movie reviews, short fiction, essays, and moonlit thoughts.",https://supapjpiqdfzuaordcdx.supabase.co/storage/v1/render/image/public/images/1660757342194-favicon.png?width=75&height=75&resize=contain,False,['culture'],0,False,,False,12898417,False,,,,#000000,en-gb,0,0,True,4dff73d3-d53f-46a3-9602-9cac339e4f6d,1660757343,1741865694
Collapse 2050,https://www.collapse2050.com/,The unspoken truth about humanity's frightening future.,https://supapjpiqdfzuaordcdx.supabase.co/storage/v1/render/image/public/images/1721710588593-Untitled-design.jpg?width=75&height=75&resize=contain,False,['culture'],0,False,,False,13530650,False,,,,#000000,en,0,0,True,1f38b8d9-2e5b-43b0-912b-b719e36c2217,1721710590,1744315853
Taam Media,https://www.taammedia.com/,"Digital media that aims to promote and give a voice to people of diversity, people who stand out and invite society to a dialogue. Our content is only available in French (for now)",https://supapjpiqdfzuaordcdx.supabase.co/storage/v1/render/image/public/images/1668303990605-1668303770130-logo-site.png?width=75&height=75&resize=contain,False,['culture'],0,False,,False,13848637,False,,,,#000000,fr,0,0,True,1bb99120-8f8c-441e-a922-2cc14ef4f23d,1668303773,1731083432
一杯咖啡的生活,https://www.yeungkwan.com/,一杯咖啡談說書、談寫作、談信仰、談人生⋯⋯,https://supapjpiqdfzuaordcdx.supabase.co/storage/v1/render/image/public/images/1702998587376-YK--5-.png?width=75&height=75&resize=contain,False,['culture'],0,False,,False,14021686,False,,,,#784d06,zh-hant,0,0,True,00afcf29-f170-4e2d-8d70-df83472f0fcd,1702998588,1702742743
Capitalize the B.,https://www.capitalizetheb.com/,"A newsletter filled with interesting thoughts about film, television, sports, pop culture, and current events from the perspective of a writer with way too many ideas.",https://supapjpiqdfzuaordcdx.supabase.co/storage/v1/render/image/public/images/1735793609391-Black-and-White-Bordered-Band-Logo--1-.png?width=75&height=75&resize=contain,False,['culture'],0,False,,False,14708188,False,,,,#8b585d,en,0,0,True,a400b577-3f22-4c74-8949-be659984a07d,1713546079,1735939889
Strange Tourist,https://www.strangetourist.co.uk/,"A weekly lifestyle and culture newsletter focussed on Thanet, with a bit of East Kent and London too.",https://supapjpiqdfzuaordcdx.supabase.co/storage/v1/render/image/public/images/1726234667373-Strange-Tourist-3.jpg?width=75&height=75&resize=contain,False,['culture'],0,False,,False,15142191,False,,,,#41717b,en,0,0,True,d8700af4-b0b4-40af-a85d-5c0080f81eca,1715359903,1744095659
Cambria Stories,https://www.cambriastories.net/,"Short stories, serialisations, extracts and author news - all that good writing that isn’t put into a traditional paperback.",https://supapjpiqdfzuaordcdx.supabase.co/storage/v1/render/image/public/images/1682332439953-Cambria-Publishing---Logo-04.png?width=75&height=75&resize=contain,False,['culture'],0,False,,False,16136026,False,,,,#bc3623,en,0,0,True,b0c1a6c6-48e9-4bab-b4bc-7ced10209dec,1682332440,1743760810
