Title,URL,Description,Publication Icon,Not Safe For Work,Categories,Member Count,Show Member Count,Monthly Recurring Revenue (MRR),Show MRR,Ghost Rank,Featured,Feature Image,Text Color,Background Color,Accent Color,Language,MRR Members Rank,MRR Members Diff Rank,Show Iframe,Object ID,Created At,Updated At
Life is a Sacred Text,https://www.lifeisasacredtext.com/,"Life is a Sacred Text is about truth & transformation, with ancient stories serving as mirrors & lights. Collective liberation. Everybody-celebratory.",https://supapjpiqdfzuaordcdx.supabase.co/storage/v1/render/image/public/images/1726629129837-life_is_a_sacred_text_icon_only--1-.png?width=75&height=75&resize=contain,False,['faith & spirituality'],31629,True,11K,True,1999896,False,,,,#15560c,en,136820.1,63,True,7b1100fa-1bbf-4e2a-bde2-a7155dc956f3,1706465422,1741597220
Hit Rádió,https://hitinfo.hu/,A Hit Rádióban elhangzott hitéleti beszélgetések egy helyen.,https://supapjpiqdfzuaordcdx.supabase.co/storage/v1/render/image/public/images/1705960583495-Hi-rek-11--10--2.png?width=75&height=75&resize=contain,False,['faith & spirituality'],5531,True,1K,True,10492650,False,,,,#566EFD,hu,20212.238,0,False,fdc2a3a5-8458-410f-9d0d-324e93a9ce44,1705960586,1705943146
BLF Éditions,https://www.blfeditions.com/,Vous aider à nourrir une passion pour Dieu,https://supapjpiqdfzuaordcdx.supabase.co/storage/v1/render/image/public/images/1691435041968-favicon.png?width=75&height=75&resize=contain,False,['faith & spirituality'],3142,True,2K,True,10838289,False,,,,#006d8f,fr,18363.106945,90,True,3b3bae5e-1c8d-4535-ad16-d3fc2afd9777,1670509733,1741411807
Svensk Pastoraltidskrift,https://pastoraltidskrift.se/,"SPT is a periodical for anyone interested in the Church and the Christian faith. It covers the Church of Sweden. SPT wants to be a voice for classical, apostolic Christian faith in our time.",https://supapjpiqdfzuaordcdx.supabase.co/storage/v1/render/image/public/images/1674814221124-blue2023-round-border-2.png?width=75&height=75&resize=contain,False,['faith & spirituality'],980,True,618,True,69605672,False,,,,#2d78b9,sv,7158.956824000001,50,True,b9852b32-771d-41ba-9211-dbf628619def,1674814222,1741336654
Evangelical Times,https://www.evangelical-times.org/,"The Reformed Evangelical Christian newspaper online and in print. Worldwide news, comment and analysis on topics crucial to biblical Christian life today.",https://supapjpiqdfzuaordcdx.supabase.co/storage/v1/render/image/public/images/1660201029006-ET-logo-150x150.png?width=75&height=75&resize=contain,False,['faith & spirituality'],6357,True,,False,103849,False,,,,#d12027,en,6357,0,True,a49a541a-86be-4071-819d-47ff7160268b,1660201031,1741189866
Fresh Road Media,https://freshroadmedia.com/,"Bold Faith. Biblical Truth. No Apologies. Broadcasting hope, humor, and biblical confidence through podcasts, teaching, and resources for Christians tired of feeling alone in their faith.",https://supapjpiqdfzuaordcdx.supabase.co/storage/v1/render/image/public/images/1738000032816-Fresh-Road-Media-Logo-favicon-1.png?width=75&height=75&resize=contain,False,['faith & spirituality'],0,False,308,True,269802843,False,,,,#00c7db,en,3080,1460,True,ac9c0f99-2f5a-490e-ae7e-a79434a94d24,1737999915,1741557603
Sweetjulian.co,https://sweetjulian.co/,"Blogging My Journey from Loss to Renewal. Embracing Healing, Homeschool, Art, and the Peaceful Charms of Country Living",https://supapjpiqdfzuaordcdx.supabase.co/storage/v1/render/image/public/images/1698551058417-Insurance%20logo-8.png?width=75&height=75&resize=contain,False,['faith & spirituality'],1167,True,73,True,83638064,False,,,,#d2b7b4,en,1892.6,11,True,c25c9726-7e57-4baf-9db4-6ea9ea842364,1698288640,1741221826
Creative Compact Publishing,https://www.creativecompact.com/,Analyizing Unexplained Phenomena,https://supapjpiqdfzuaordcdx.supabase.co/storage/v1/render/image/public/images/1706654680795-Black-Orange-Solar-Eclipse-Astrology-Channel-Youtube-Banner--1048-x-250-px---1000-x-1000-px---3-.png?width=75&height=75&resize=contain,False,['faith & spirituality'],1747,True,,False,10498165,False,,,,#020202,en,1747,0,True,fb52a9ed-fd90-477d-8cef-41748a947849,1706654682,1706619821
SmileyBlue,https://www.smileyblue.org/,"SmileyBlue is a world-wide media company, our mission is to guide all people, professionals, and businesses towards a powerful transformation of the mind.",https://supapjpiqdfzuaordcdx.supabase.co/storage/v1/render/image/public/images/1738676209227-Untitled-design--7--1.png?width=75&height=75&resize=contain,False,['faith & spirituality'],1551,True,16,True,2023150,False,,,,#19abff,en,1715.9,5,True,6411f22b-8dd3-4b6f-9466-66b7acc87c25,1689194028,1741561594
Chelsea Kim Long,https://www.chelseakimlong.com/,Exploring the ordinary; encountering the Divine.,https://supapjpiqdfzuaordcdx.supabase.co/storage/v1/render/image/public/images/1701193553162-chels-headshot-1.JPG?width=75&height=75&resize=contain,False,['faith & spirituality'],299,True,132,True,576887,False,,,,#000000,en,1614.6,0,True,5d05555b-5050-48e2-ba40-51f15c29d480,1701193554,1701104429
Spiritual Deep Dive,https://spiritualdeepdive.com/,"When you're ready to go beyond the surface of your life -- words of wisdom for body, mind, heart, and soul.",https://supapjpiqdfzuaordcdx.supabase.co/storage/v1/render/image/public/images/1706550364854-SpiritualDeepDive_logosq.png?width=75&height=75&resize=contain,False,['faith & spirituality'],1469,True,,False,10498457,False,,,,#990115,en,1469,0,True,119b3fde-c68e-4c50-bf18-1f3597218903,1706550366,1706394097
Armada Network,https://www.armadanetwork.org/,Home of the TenMen Project,https://supapjpiqdfzuaordcdx.supabase.co/storage/v1/render/image/public/images/1665619964981-Blue-ARMADA-logo.png?width=75&height=75&resize=contain,False,['faith & spirituality'],791,True,20,True,5826953,False,,,,#3771c8,en,991,1,True,aef910ba-b209-41fa-b4e1-99d22e81068e,1665619960,1740000905
Vine of Devotion,https://www.vineofdevotion.com/,"Studying scripture, learning stotras, and discussing topics related to bhakti, sādhana and life",https://supapjpiqdfzuaordcdx.supabase.co/storage/v1/render/image/public/images/1737812603154-sprout-1.png?width=75&height=75&resize=contain,False,['faith & spirituality'],191,True,77,True,10499718,False,,,,#4f7a28,en,960.0999999999999,47,True,1717dbf7-84eb-4c17-a453-59481c24f339,1676974723,1741541760
We Are Human Angels,https://www.wearehumanangels.org/,"The #1 Site for Angel Prayers, Angelic Wisdom, Spiritual Books and Tips for a Fulfilled Life",https://supapjpiqdfzuaordcdx.supabase.co/storage/v1/render/image/public/images/1699288385987-YouTube_HA-LOGO.png?width=75&height=75&resize=contain,False,['faith & spirituality'],935,True,,False,23781655,False,,,,#15171A,en,935,14,True,fb16f3bd-a2fa-49b2-89bf-1a4525973a42,1699288387,1741033362
The Garden Weekly,https://www.thegardenweekly.com/,"7 links per week to Christian videos, podcasts, and articles that will help you understand the Bible, God, and how to live the Christian life.",https://supapjpiqdfzuaordcdx.supabase.co/storage/v1/render/image/public/images/1667438682174-1662319259497-Large-Square-Logo-White-Background.png?width=75&height=75&resize=contain,False,['faith & spirituality'],931,True,,False,267261058,False,,,,#586C5C,en,931,3,True,46ee6897-0809-400c-9034-10db495f1df6,1660394415,1680892251
Una vida sencilla,https://www.luispascasio.com/,"Cada vez me queda menos de vida, a ti también Esto lo debes de entender... el tiempo no se detiene. Ahora tu decides, si quieres seguir con una vida de insatisfacción, de estancamiento y agotamiento",https://supapjpiqdfzuaordcdx.supabase.co/storage/v1/render/image/public/images/1741416510759-logo---una-vida-sencilla--1--2.png?width=75&height=75&resize=contain,False,['faith & spirituality'],924,True,,False,63663597,False,,,,#41b8de,es,924,0,True,be0d59f1-787a-4782-9e01-f0c5efbf7c87,1741416512,1741415560
Ask Bashar,https://www.askbashar.org/,"A community of seekers & dreamers, based on the teachings of Bashar channeled by Darryl Anka",https://supapjpiqdfzuaordcdx.supabase.co/storage/v1/render/image/public/images/1712190734395-logo-alien-HEAD.png?width=75&height=75&resize=contain,False,['faith & spirituality'],233,True,32,True,9999734,False,,,,#3cacff,en,554.5,1,True,510b5167-1edc-48f0-ae21-548b48c53cb4,1712190605,1718825717
MEVAR,https://mevar.org/,Mission d'Evangélisation et de Réveil,https://supapjpiqdfzuaordcdx.supabase.co/storage/v1/render/image/public/images/1685725851998-android-chrome-512x512.png?width=75&height=75&resize=contain,False,['faith & spirituality'],471,True,,False,99210958,False,,,,#8B2F2E,fr,471,3,True,ad1370fc-310a-43fd-b44e-349d1fbfa847,1672439078,1733053400
The Ecological Disciple,https://www.ecodisciple.com/,Learning to Follow Jesus From the Ground Up,https://supapjpiqdfzuaordcdx.supabase.co/storage/v1/render/image/public/images/1738811728682-Favicon-tree-3-.png?width=75&height=75&resize=contain,False,['faith & spirituality'],434,True,,False,17960477,False,,,,#618669,en,434,0,True,ec1c4a0d-c55b-4903-bdc4-fb4dd2b20d83,1738811729,1738605652
Sacred Web,https://www.sacredweb.com/,"Through articles and poems, Sacred Web explores the wisdom of Tradition in helping us navigate the issues of modern life.",https://supapjpiqdfzuaordcdx.supabase.co/storage/v1/render/image/public/images/1739021121163-Untitled-design.png?width=75&height=75&resize=contain,False,['faith & spirituality'],422,True,,False,414676,False,,,,#32b1d1,en,422,21,True,fe13a282-b73a-4529-9f7b-32334de65aa5,1726606601,1738953804
Modern Relics,https://www.modernrelics.email/,"Artefacts found at the crossroads of religion, popular culture and the internet.",https://supapjpiqdfzuaordcdx.supabase.co/storage/v1/render/image/public/images/1705712348888-Logo--03-V2-White-Background-01---Copy.png?width=75&height=75&resize=contain,False,['faith & spirituality'],421,True,0,True,10499557,False,,,,#2a7182,en,421,0,True,b9ef304e-e7f9-4133-a8ff-35bb9bdb8520,1705712350,1705646335
"Anonymously, Zara",https://www.anonymouslyzara.com/,"A Muslim twenty-something in London. Join me as I document my journey of personal growth, mental health, and productivity—woven with the thread of faith.",https://supapjpiqdfzuaordcdx.supabase.co/storage/v1/render/image/public/images/1735739488092-Your%20paragraph%20text%20(5)%202.PNG?width=75&height=75&resize=contain,False,['faith & spirituality'],381,True,,False,10035138,False,,,,#ffcee1,en,381,2,True,41b575b2-3948-48ca-ac77-9ee7dad39af6,1670856624,1740745865
BibleSumo,https://www.biblesumo.com/,"Bible Study, Christian Life, Theology, and Study Tools",https://supapjpiqdfzuaordcdx.supabase.co/storage/v1/render/image/public/images/1698069639762-BibleSumo-Blue-Icon-Only.png?width=75&height=75&resize=contain,False,['faith & spirituality'],312,True,,False,1157599,False,,,,#15171A,en,312,1,True,3dab000e-8ce4-4be3-949e-d2c6b821ff37,1698069448,1741614825
Gate 65,https://www.gate65.ee/,Консультируем и обучаем Дизайну Человека.,https://supapjpiqdfzuaordcdx.supabase.co/storage/v1/render/image/public/images/1730389768490-favikon.png?width=75&height=75&resize=contain,False,['faith & spirituality'],292,True,,False,58144038,False,,,,#485156,ru,292,6,True,51f58592-bb4c-4ef2-98e9-f445a9f7abee,1730388800,1741006773
The Hidden Orchard Project,https://www.thehiddenorchard.com/,"The Hidden Orchard Project offers a fresh look at Spirituality, the Bible, Science, the New Testament, and more.",https://supapjpiqdfzuaordcdx.supabase.co/storage/v1/render/image/public/images/1665503835631-HiddenOrchard_Logo-02-1.png?width=75&height=75&resize=contain,False,['faith & spirituality'],289,True,,False,305715784,False,,,,#81982f,en,289,10,True,88d8814d-1582-463d-bd25-60a3218c01ec,1664759639,1741527456
On Life & Scripture,https://jeremysarber.com/,"Insights into God, salvation, and ourselves from Jeremy Sarber.",https://supapjpiqdfzuaordcdx.supabase.co/storage/v1/render/image/public/images/1732768518516-me-edit.png?width=75&height=75&resize=contain,False,['faith & spirituality'],267,True,,False,1732478,False,,,,#800000,en,267,0,True,75f52ec5-1553-4177-88cf-c037d7c4ef54,1732768519,1732633817
Auf kosmischer Mission,https://cosmic-mission.eu/,"Bewusstsein & Selbstermächtigung - Einsichten in psychologische und emotionale Prinzipien des Menschseins. Atem-, Mentaltechniken und Körperübungen zur Selbstregulation und noch viel mehr. ❤️",https://supapjpiqdfzuaordcdx.supabase.co/storage/v1/render/image/public/images/1741085580224-Logo_Final.png?width=75&height=75&resize=contain,False,['faith & spirituality'],33,True,23,True,155936151,False,,,,#294991,de,258.3405,0,True,5859018a-66ef-46ab-bd9c-518a67653d62,1741085374,1740315656
Strategic Intercession,https://www.strategicintercession.com/,We help leaders set up prayer teams for success.,https://supapjpiqdfzuaordcdx.supabase.co/storage/v1/render/image/public/images/1737793779215-Shield-color---no-background.png?width=75&height=75&resize=contain,False,['faith & spirituality'],211,True,,False,10499778,False,,,,#f5793b,en,211,2,True,260696f2-a9c0-480d-be97-0841a3098af5,1733404652,1740127011
Astrology with Julie,https://www.astrologywithjulie.com/,"I help astrology lovers and cosmic seekers practice astrology so they can deeply know and accept themselves through their birth chart, and live in alignment with cosmic cycles for meaning and purpose.",https://supapjpiqdfzuaordcdx.supabase.co/storage/v1/render/image/public/images/1710359339122-astrology-with-julie-julie-francis-writer-astrologer.png?width=75&height=75&resize=contain,False,['faith & spirituality'],190,True,,False,10499800,False,,,,#A3512C,en,190,0,True,ae996f8c-9763-4bc1-bedd-3c0bd41f884f,1710359340,1710356982
Bruce Merrill,https://www.bruc3.com/,Innermost thoughts and reflections.,https://supapjpiqdfzuaordcdx.supabase.co/storage/v1/render/image/public/images/1731952335312-Zen-symbol-5.jpg?width=75&height=75&resize=contain,False,['faith & spirituality'],177,True,,False,10499814,False,,,,#000000,en,177,0,True,37f8eb9b-2e96-462a-b5ed-4e904a5c8e99,1731952336,1731866443
Paulton Benefice,https://paulton-benefice.org.uk/,"Welcome to the homepage of churches in Paulton, High Littleton and Farrington Gurney. Paulton Benefice is a group of three lively and welcoming churches south of Bath.",https://supapjpiqdfzuaordcdx.supabase.co/storage/v1/render/image/public/images/1704657834070-Site-Logo.png?width=75&height=75&resize=contain,False,['faith & spirituality'],162,True,,False,19244580,False,,,,#92d41e,en,162,2,True,b628c6bf-619d-4c5e-a2eb-4397a4884606,1704651173,1741179128
No Fear Astrology,https://www.nofearastrology.com/,"All of the astrology, none of the fear. Sign up to stop fearing astrology through monthly Q&As, transit overviews, and more.",https://supapjpiqdfzuaordcdx.supabase.co/storage/v1/render/image/public/images/1680006044272-logo%20).png?width=75&height=75&resize=contain,False,['faith & spirituality'],131,True,,False,5485035,False,,,,#ff8c82,en,131,0,True,05728aee-70cc-4dd8-b00f-f80252ffeb73,1665454141,1741489539
tate,https://www.tate.fyi/,a life observed,https://supapjpiqdfzuaordcdx.supabase.co/storage/v1/render/image/public/images/1682794238937-logo-2.png?width=75&height=75&resize=contain,False,['faith & spirituality'],129,True,,False,54676042,False,,,,#3d3846,en,129,2,True,1dc9e6f6-bf38-4a77-a78c-d2c590cfe34d,1682781735,1707053360
Amen Peoria,https://www.amenpeoria.com/,Connecting Christians in the central Illinois Tri-County area through church and ministry news.,https://supapjpiqdfzuaordcdx.supabase.co/storage/v1/render/image/public/images/1741120683204-456694015_122105546972477715_1533306457509264276_n-1.jpg?width=75&height=75&resize=contain,False,['faith & spirituality'],128,True,,False,10499865,False,,,,#000000,en,128,0,True,5b171582-3766-48d2-9e85-1f92f638e606,1741120684,1740842537
lifepurpose.com,https://www.lifepurpose.com/,"We help our BIG ONES to find, live, and unleash their life purpose.",https://supapjpiqdfzuaordcdx.supabase.co/storage/v1/render/image/public/images/1695973175115-lifepurpose.com-favicon-60x60px-3.png?width=75&height=75&resize=contain,False,['faith & spirituality'],116,True,0,True,6921921,False,,,,#009dff,en,116,4,True,c8c3d1fb-4e83-4bd1-914d-a24efa59205c,1695973176,1741487636
Akashic Records Archive,https://akashicrecordsarchive.com/,"Understand, Connect, and Expand as you explore your path within the Akashic Records.",https://supapjpiqdfzuaordcdx.supabase.co/storage/v1/render/image/public/images/1706550483822-AkashicRecordsArchive_faviconR.png?width=75&height=75&resize=contain,False,['faith & spirituality'],116,True,,False,10499878,False,,,,#990115,en,116,0,True,4d505707-ccaf-47ea-abae-6cb43b23545a,1706550484,1706391002
Matt Crummy,https://www.mattcrummy.com/,"Essays on faith, art, and culture from Matt Crummy",https://supapjpiqdfzuaordcdx.supabase.co/storage/v1/render/image/public/images/1695174442697-mc-fav.png?width=75&height=75&resize=contain,False,['faith & spirituality'],116,True,,False,288230756,False,,,,#ff4d00,en,116,1,True,06c29bbc-f39f-48a7-b5f3-e242106ff346,1660094259,1705580123
Mark 16 Mission,https://blog.mark16mission.com/,"Deliverance Ministry in Orange County, California - We cast out demons in Jesus name.",https://supapjpiqdfzuaordcdx.supabase.co/storage/v1/render/image/public/images/1679962764540-Original-Logo-Symbol-2.png?width=75&height=75&resize=contain,False,['faith & spirituality'],86,True,2,True,10499909,False,,,,#a81f41,en,106.8,0,True,68cf2b37-5224-44eb-a01a-2dd416612f06,1679962765,1739408116
Seth Quant,https://sethquant.com/,"Sharing lessons learned and fresh resources to build your faith in Jesus. Planting churches near Tokyo so Japanese people find help, hope, and happiness in Christ.",https://supapjpiqdfzuaordcdx.supabase.co/storage/v1/render/image/public/images/1664106561347-Qsai_Logo_152-1.png?width=75&height=75&resize=contain,False,['faith & spirituality'],98,True,,False,87720568,False,,,,#50c130,en,98,14,True,89471e84-5a51-4b34-a71b-763203c44440,1664106563,1740636540
Astrology With Destiny,https://astrologywithdestiny.com/,"Learn astrology basics, stay up to date with planetary weather and explore the archetypes of the signs in pop culture. Subscribe Below For Bi-monthly Posts Straight To Your Inbox!",https://supapjpiqdfzuaordcdx.supabase.co/storage/v1/render/image/public/images/1688862229642-Astrology-With-Destiny--Logo---1--1.png?width=75&height=75&resize=contain,False,['faith & spirituality'],89,True,,False,649204,False,,,,#FF1A75,en,89,0,True,f12b87b0-a678-4116-9108-3261e71aa56f,1687828755,1739899052
AMC Seattle,https://www.islaminseattle.com/,"The Official Website of the Ahmadiyya Muslim Community, United States, Seattle Chapter.",https://supapjpiqdfzuaordcdx.supabase.co/storage/v1/render/image/public/images/1711185964945-AMC_logo.png?width=75&height=75&resize=contain,False,['faith & spirituality'],88,True,,False,10499907,False,,,,#3a5a40,en,88,0,True,76f92ba4-fad7-45dd-8eb9-a80c35402e0b,1711185967,1711156199
Rdr. Seraphim Pardee,https://srp.life/,The Musings of an Orthodox Christian Reader and Software Engineer,https://supapjpiqdfzuaordcdx.supabase.co/storage/v1/render/image/public/images/1741616045437-453064960_3021890884616733_2803591731230311694_n.jpg?width=75&height=75&resize=contain,False,['faith & spirituality'],29,True,5,True,3791302,False,,,,#0099ff,en,79,0,True,62f4006e-3e5c-4f5c-bd9e-d1ee2b0dc66e,1741616046,1741613297
Earth-Portal,https://earth-portal.com/,"This platform is about (cosmic) human consciousness, who we really are, why we are here, and our enormous, natural abilities. It also serves the purpose of connecting people and connecting worlds.",https://supapjpiqdfzuaordcdx.supabase.co/storage/v1/render/image/public/images/1740680975070-Logo.png?width=75&height=75&resize=contain,False,['faith & spirituality'],53,True,0,True,10499944,False,,,,#cf9000,en,53,10,True,b102db4e-62df-40d9-ab69-2bdee5d52872,1740680976,1741264197
I AM James Gómez,https://www.jamesgomez.co/,"Cultivating a progressive, compassionate, and deeply spiritual faith.",https://supapjpiqdfzuaordcdx.supabase.co/storage/v1/render/image/public/images/1706808111332-iam-copy.png?width=75&height=75&resize=contain,False,['faith & spirituality'],44,True,0,True,10499953,False,,,,#f81818,en,44,0,True,1c402efe-edf0-41c5-a1dc-5c382e33feba,1706808116,1706713235
Pastor Joe Podcast,https://www.pastorjoepodcast.com/,Become All You Have Been Created To Be!,https://supapjpiqdfzuaordcdx.supabase.co/storage/v1/render/image/public/images/1723794681357-icon_podcast.png?width=75&height=75&resize=contain,False,['faith & spirituality'],36,True,,False,83332275,False,,,,#1c4e97,en,36,0,True,f0919747-e261-4068-862c-e7f5269151c7,1723794682,1723770715
The Relief Mine,https://www.reliefmine.com/,"Bishop Koyle's visions were divine, unlocking the secrets of a Nephite gold mine.",https://supapjpiqdfzuaordcdx.supabase.co/storage/v1/render/image/public/images/1713831470223-relief-mine.jpg?width=75&height=75&resize=contain,False,['faith & spirituality'],33,True,0,True,9078411,False,,,,#aa7941,en,33,0,True,939e6a8c-0a03-44bb-ad58-d7eb6149eddc,1713831472,1713733235
God’s Faint Path,https://www.godsfaintpath.com/,A collection of wisdom from desert mothers and fathers to modern mystics.,https://supapjpiqdfzuaordcdx.supabase.co/storage/v1/render/image/public/images/1701916292776-GodsFaintPath-icon_trim@2x.png?width=75&height=75&resize=contain,False,['faith & spirituality'],33,True,,False,30740613,False,,,,#4a7753,en,33,0,True,a0234a2e-68fc-4e0c-be37-02d67632c896,1701916293,1701913301
Dogma Think,https://www.dogmathink.com/,"Theologie, Dogmatik, Ethik. Wissenschaftliche und kreative Essays zu den Fundamenten und Zweifeln des christlichen Glaubens.",https://supapjpiqdfzuaordcdx.supabase.co/storage/v1/render/image/public/images/1660727111522-icon3.png?width=75&height=75&resize=contain,False,['faith & spirituality'],32,True,0,True,20274527,False,,,,#000000,de,32,7,True,ef9da7e2-f6cd-4580-9bdf-8db3c6361cf7,1660727114,1737305539
Keepin' It Jesus,https://keepinitjesus.com/,"Keepin’ the main thing, the main thing. Eyes to Jesus.🧎🏽HEB‬ ‭12.2",https://supapjpiqdfzuaordcdx.supabase.co/storage/v1/render/image/public/images/1677033200656-Keepin'%20It%20Jesus%20Social%20Avi-v2%203000x3000.png?width=75&height=75&resize=contain,False,['faith & spirituality'],27,True,,False,45971102,False,,,,#0b91e8,en,27,1,True,328594ef-6b88-4faa-add3-85f13c2297b6,1677033201,1723157664
The Rhythm of Grace,https://chuck-warnock.ghost.io/,"Exploring the rhythms of the Christian Year thru a weekly meditation on the current Gospel reading, plus related resources.",https://supapjpiqdfzuaordcdx.supabase.co/storage/v1/render/image/public/images/1735694708955-Substack_Logo_Large_-1.png?width=75&height=75&resize=contain,False,['faith & spirituality'],25,True,,False,10499973,False,,,,#3319ff,en,25,0,True,bbae7ae0-8683-4386-a81f-96a10612c119,1735694709,1735608272
H.G. & Me Magazine,https://h-g-and-me-magazine.ghost.io/,"God Almighty, we love you! Jesus Christ, we trust in you! Holy Ghost, H.G. we adore you!",https://supapjpiqdfzuaordcdx.supabase.co/storage/v1/render/image/public/images/1699288424546-hgnme60x60PubIcon-2.png?width=75&height=75&resize=contain,False,['faith & spirituality'],24,True,,False,9999976,False,,,,#ffe2d6,en,24,2,True,1d302853-c89b-4ffa-a089-a67092738ce2,1697979893,1736223125
virtual diary - blog series,https://www.esa-media.org/,"an eclectic blog by a 17yr old girl with a fresh perspective. explore realms of philosophy, music, fashion, architecture, spirituality, photography, and beyond.",https://supapjpiqdfzuaordcdx.supabase.co/storage/v1/render/image/public/images/1698248389336-esa%20lowercase%20logo.png?width=75&height=75&resize=contain,False,['faith & spirituality'],17,True,0,True,10499982,False,,,,#abaa9b,en,17,10,True,83a85cbd-90e8-4a19-97a1-755859b63780,1692039339,1741309961
Maitreya Fields,https://blog.maitreyafields.com/,Maitreya Fields Blog for transformative energy insights,https://supapjpiqdfzuaordcdx.supabase.co/storage/v1/render/image/public/images/1709759605682-logo-black.png?width=75&height=75&resize=contain,False,['faith & spirituality'],15,True,0,True,10499984,False,,,,#021746,en,15,0,False,411442c4-cc22-46a4-815c-2f32a0053a9e,1709759607,1709731833
Kairos Way,https://www.kairosway.faith/,"Kairos Way is a lifestyle centered around intentional living in accordance with our Father’s purpose for our lives. Kairos Way is practical and requires collaboration with God, the Holy Spirit, Jesus.",https://supapjpiqdfzuaordcdx.supabase.co/storage/v1/render/image/public/images/1726951771741-Subject.png?width=75&height=75&resize=contain,False,['faith & spirituality'],12,True,,False,9999988,False,,,,#859677,en,12,0,True,397b3c0b-351d-4e0e-893b-17ad9aa8eca5,1726951773,1717789936
GG Spiritual Maverick,https://www.ggspiritualmaverick.com/,"GG Spiritual Maverick:Wacky,weird, fun ,and wonderful spiritual perceptions processes, and , recommendations.",https://supapjpiqdfzuaordcdx.supabase.co/storage/v1/render/image/public/images/1740256831976-c-3.jpg?width=75&height=75&resize=contain,False,['faith & spirituality'],11,True,0,True,5221838,False,,,,#a71aff,en,11,7,True,3f03b8e8-1f47-46c0-a878-c4a913b9c662,1692595353,1741436580
Back to Basics: Christian living,https://back-to-basics-christian-living.ghost.io/,...laying the foundation for a Christian life...,https://supapjpiqdfzuaordcdx.supabase.co/storage/v1/render/image/public/images/1667304865535-New-Cornerstone2-pic-1.jpg?width=75&height=75&resize=contain,False,['faith & spirituality'],11,True,,False,10499988,False,,,,#45454f,en,11,2,True,833154a2-d531-4a6c-986f-51fe1b6054cc,1667304868,1741588068
