Investing For Everyone,https://investing-for-everyone.ghost.io/,"We’re passionate about finding great companies, and we believe every investor—regardless of their budget—should have the chance to benefit from our work.",https://supapjpiqdfzuaordcdx.supabase.co/storage/v1/render/image/public/images/1743551043659-Preview.png?width=75&height=75&resize=contain,False,['finance'],0,False,,False,10500000,False,,,,#1937ff,en,0,0,True,ad5de243-ee76-4bb0-88cd-8c5ad985c6b4,1743551044,1754046047
fruglify,https://fruglify.com/,Your guide to smart personal finance and frugal living,https://supapjpiqdfzuaordcdx.supabase.co/storage/v1/render/image/public/images/1750596965045-svgviewer-png-output--2-.png?width=75&height=75&resize=contain,False,['finance'],0,False,,False,10500000,False,,,,#000000,en,0,0,True,ac5398f3-0d2e-4e3c-abc4-2c0a4fd93b3b,1750596966,1750519838
My Daily Oracle,https://www.mydailyoracle.com/,"Unlock the secrets of successful investing with daily inspiration from history's greatest investors and thinkers. Featuring quotes, bios, and further reading.",https://supapjpiqdfzuaordcdx.supabase.co/storage/v1/render/image/public/images/1746009767863-Rushmore-Buffet-cropped-1.jpg?width=75&height=75&resize=contain,False,['finance'],0,False,,False,10500000,False,,,,#74786e,en,0,0,True,9f58e51f-3dc1-493a-be9a-757a084313b8,1745570128,1754047863
Investitore Meraviglioso,https://www.investitoremeraviglioso.com/,Non serve essere esperti per investire e diventare ricchi. Il manuale di finanza personale più semplice che tu possa trovare.,https://supapjpiqdfzuaordcdx.supabase.co/storage/v1/render/image/public/images/1730640461137-cristianeffe1710_An_image_representing_success._Vector_style__fe77d64b-e0d5-4253-ae40-352550760bb2_0.png?width=75&height=75&resize=contain,False,['finance'],0,False,,False,10500000,False,,,,#0e9561,it,0,0,True,9f22514c-5a84-4a12-b2b8-205990ed6204,1730640463,1730587566
EconScope by The Agora Review,https://econscope-by-the-agora-review.ghost.io/,"EconScope by The Agora Review delivers AI-driven economic analysis, offering clarity, insight, and rigor in a world of fleeting headlines. Explore macroeconomics, finance, and geopolitics with depth.",https://supapjpiqdfzuaordcdx.supabase.co/storage/v1/render/image/public/images/1741324161015-EconScope-Logo.jpg?width=75&height=75&resize=contain,False,['finance'],0,False,,False,10500000,False,,,,#FF1A75,en,0,0,True,9c513111-94ec-4abe-a7c5-f283fda935d8,1741324161,1741246082
Vestmint,https://www.vestmint.in/,All your queries on trading and markets answered. Now trade well informed.,https://supapjpiqdfzuaordcdx.supabase.co/storage/v1/render/image/public/images/1711679174230-Screenshot-2024-03-29-at-7.50.57-AM.png?width=75&height=75&resize=contain,False,['finance'],0,False,,False,10500000,False,,,,#20c49b,en,0,0,True,99f51408-2d9d-4e87-8468-8b82991ef20e,1711679176,1711356037
The Parabolic,https://www.the-parabolic.com/,"An extremely simple financial newsletter >>> One parabolic chart. Three times a week. 180 seconds max >>> Sign up to stay ahead of runaway tech, debt, and finance.",https://supapjpiqdfzuaordcdx.supabase.co/storage/v1/render/image/public/images/1717928430805-moar----BANANA-LOGO-emoji----p6-round.png?width=75&height=75&resize=contain,False,['finance'],0,False,,False,10500000,False,,,,#dc0000,en,0,0,True,953d176a-f714-4e6c-9500-9da58d5e235b,1717928432,1717861015
Everyday Money,https://blog.everydaymoney.app/,We help you build the ability to ability to withstand life events that impact your income or assets,https://supapjpiqdfzuaordcdx.supabase.co/storage/v1/render/image/public/images/1703859965981-favicon.ico?width=75&height=75&resize=contain,False,['finance'],0,False,,False,10500000,False,,,,#1c5ed3,en,0,0,False,8372c0f1-ae7a-414d-aa5d-39b4574c750e,1703859967,1702142643
Macro Dispatch,https://www.macrodispatch.com/,"Exploring Macro, Data Point Per Data Point",https://supapjpiqdfzuaordcdx.supabase.co/storage/v1/render/image/public/images/1719340056199-logo_sem_nome.-PhotoRoom.png?width=75&height=75&resize=contain,False,['finance'],0,False,,False,10500000,False,,,,#024a85,en,0,0,True,77563270-08af-46b7-83b2-46ec6373f2cd,1719340057,1719337606
"Stop Profit, Take Loss",https://stopprofittakeloss.com/,"Someone is making 10 times the amount of money you are, with half the IQ you have, because they're too dumb to doubt themselves. Come learn how to trade.",https://supapjpiqdfzuaordcdx.supabase.co/storage/v1/render/image/public/images/1731114150201-333770-589840174%20(1).jpg?width=75&height=75&resize=contain,False,['finance'],0,False,,False,10500000,False,,,,#09a50e,en,0,0,True,687801fd-7122-427e-a1f3-9a4ba639971f,1731114151,1731099162
Money Matters,https://codebin.co.za/,"Journey through the latest tech innovations, business and investment ideas, coding breakthroughs and digital transformations. Your daily source for in-depth tech analysis and future insights.",https://supapjpiqdfzuaordcdx.supabase.co/storage/v1/render/image/public/images/1738164121599-logo.png?width=75&height=75&resize=contain,False,['finance'],0,False,,False,10500000,False,,,,#1c90af,en,0,0,False,6068d7b6-4193-46c0-a2c5-ce2665f74c74,1738164123,1738163719
Uneducated Investor,https://www.uneducatedinvestor.com/,Plain-spoken insights from an ordinary guy just trying to figure out markets. Expect contrarian views that challenge consensus thinking. No fancy finance degrees here.,https://supapjpiqdfzuaordcdx.supabase.co/storage/v1/render/image/public/images/1707058873703-idea.png?width=75&height=75&resize=contain,False,['finance'],0,False,,False,10500000,False,,,,#ffd01b,en,0,0,True,5e9917a2-c0d7-4950-89ef-9c33f8f67b94,1707058875,1707022260
Oracle Ayano 9 Trends,https://oracle-ayano-9-trends.ghost.io/,Concise snapshots where Nine-Star Ki meets world economy.,https://supapjpiqdfzuaordcdx.supabase.co/storage/v1/render/image/public/images/1748347165129-image--1-.jpg?width=75&height=75&resize=contain,False,['finance'],0,False,,False,10500000,False,,,,#D4AF37,en,0,0,True,4febe42d-d515-44cb-a583-a4ca10dc7429,1748347166,1748257643
A Good Gig,https://www.agoodgig.com/,"Unlock financial success in the gig economy with proven strategies. Explore gig tips, side hustle ideas, and more at A Good Gig.",https://supapjpiqdfzuaordcdx.supabase.co/storage/v1/render/image/public/images/1706410810243-a%20good%20gig-6.png?width=75&height=75&resize=contain,False,['finance'],0,False,,False,10500000,False,,,,#1DB954,en,0,0,True,4d6eb10c-f968-4f50-afcb-0ed6759a71b3,1706410811,1706400573
Budgie Bytes & Bucks,https://yellowplannet.com/,"Where finance and tech take flight. Explore the latest insights in investing, programming, and technology.",https://supapjpiqdfzuaordcdx.supabase.co/storage/v1/render/image/public/images/1742646287936-favicon.ico?width=75&height=75&resize=contain,False,['finance'],0,False,,False,10500000,False,,,,#ff3737,en,0,0,True,4cf0fc34-683f-4f1e-97cd-287125fbf929,1742646289,1754138363
Dive Into Investment,https://diveinvest.net/,Turning overlooked data into investment alpha.,https://supapjpiqdfzuaordcdx.supabase.co/storage/v1/render/image/public/images/1739196644311-IMG_3814-1.JPG?width=75&height=75&resize=contain,False,['finance'],0,False,,False,10500000,False,,,,#43a5d2,en,0,0,True,470ff8d5-8be5-41b9-899c-ab74ba496393,1739196649,1739194528
Uraume,https://www.uraume.com/,"Stars on a winter night, clear as if the air had frozen",https://supapjpiqdfzuaordcdx.supabase.co/storage/v1/render/image/public/images/1711993872159-yabawihub_Ice_Mood_03ddb1ac-500c-4147-88b0-71b3993a3438-removebg-1.png?width=75&height=75&resize=contain,False,['finance'],0,False,,False,10500000,False,,,,#000000,en,0,0,True,3f3193f2-f944-4fa7-94d3-d4628fa0cc6f,1711993874,1711963844
Fund Fluxes,https://from.fundfluxes.com/,Stay ahead with Fund Fluxes — daily educational financial news,https://supapjpiqdfzuaordcdx.supabase.co/storage/v1/render/image/public/images/1748688636788-logo-3.png?width=75&height=75&resize=contain,False,['finance'],0,False,,False,10500000,False,,,,#000000,en,0,0,True,2d6d622d-23b1-4eeb-b13f-30122f18efd8,1748688637,1753819404
Unlock Your Financial Potential,https://financial-freedom-101.com/,"Master Your Money, Master Your Life",https://supapjpiqdfzuaordcdx.supabase.co/storage/v1/render/image/public/images/1708124245560-ff101-logo-4.png?width=75&height=75&resize=contain,False,['finance'],0,False,,False,10500000,False,,,,#000000,en,0,0,True,26b95b0d-3e33-4ade-b926-df8c304cff24,1708124247,1708092552
Jason with his AI analysts,https://jason-with-his-ai-analysts.ghost.io/,100% AI generated invesetment research in global DM equity markets & AI knowledge sharing,https://supapjpiqdfzuaordcdx.supabase.co/storage/v1/render/image/public/images/1753365742868-obsidian-logo-1.png?width=75&height=75&resize=contain,False,['finance'],0,False,,False,10500000,False,,,,#8A5CF5,english & chinese,0,0,True,13be0b9a-7dd8-4379-b31e-0fe350deb1b4,1753365742,1754229114
Foolish Trader,https://www.foolishtrader.com/,Documenting financial (mis)adventures with more confidence than competence!,https://supapjpiqdfzuaordcdx.supabase.co/storage/v1/render/image/public/images/1739343016161-foolish-trader-logo-II-1.png?width=75&height=75&resize=contain,False,['finance'],0,False,,False,10500000,False,,,,#b551ff,en,0,0,True,124ff998-b50a-46f1-a482-460f49bf51d7,1739343017,1739342518
Soo의 일상,https://sooo.ghost.io/,"기술, 경제, 산업, 기업 등 생각 정리",https://supapjpiqdfzuaordcdx.supabase.co/storage/v1/render/image/public/images/1735284562750--------1.jpg?width=75&height=75&resize=contain,False,['finance'],0,False,,False,10500000,False,,,,#000000,kr,0,0,True,1101840e-faea-42af-95e7-2db47b64870e,1735278750,1754138680
Le Journal des Investisseurs en Private Equity,https://www.journalprivateequity.fr/,"Analyses, stratégies et opportunités pour mieux comprendre et investir dans le capital-investissement.",https://supapjpiqdfzuaordcdx.supabase.co/storage/v1/render/image/public/images/1741976572443-Untitled.jpg?width=75&height=75&resize=contain,False,['finance'],0,False,,False,10500000,False,,,,#FF1A75,fr,0,0,True,0c62d47e-35ab-463e-bd75-b7dd588b1e03,1741976573,1741954737
Fintantech,https://blog.fintantech.com/,Empowering Tanzanians to achieve financial freedom,https://supapjpiqdfzuaordcdx.supabase.co/storage/v1/render/image/public/images/1719605348596-fintantech_logo.png?width=75&height=75&resize=contain,False,['finance'],0,False,,False,10500000,False,,,,#FF1A75,en,0,0,True,0c2fe10c-fdc3-4ad2-bd1a-840f6a008c49,1719605350,1719578077
Blockdag Finance,https://blockdag.finance/,"Discover BlockDAG Finance, your premier source for the latest news and updates on the cryptocurrency BlockDAG.",https://supapjpiqdfzuaordcdx.supabase.co/storage/v1/render/image/public/images/1745506185703-icon.svg?width=75&height=75&resize=contain,False,['finance'],0,False,,False,10500000,False,,,,#003AFF,en,0,0,False,0566fa90-5a46-4989-8382-bc136b733935,1745506187,1745074952
Nook,https://nookmoney.com/blog/,"Everything Counts is Nook’s newsletter that explores the rate moves, price shifts, and policy tweaks that shape our everyday money choices.",https://supapjpiqdfzuaordcdx.supabase.co/storage/v1/render/image/public/images/1747153852941-Nook-Avatar-1.png?width=75&height=75&resize=contain,False,['finance'],0,False,,False,10500000,False,,,,#FF2D64,en,0,0,True,01b80dc1-24ff-4ea3-bb19-bc6bfcc6baae,1729866032,1753990981
The S-Curve,https://thescurve.ghost.io/,Business and Finance Made Simple.,https://supapjpiqdfzuaordcdx.supabase.co/storage/v1/render/image/public/images/1714885615509-Daraia-Zjun--2-.png?width=75&height=75&resize=contain,False,['finance'],0,False,,False,11500000,False,,,,#16537e,en,0,0,True,b0593c69-c67a-430a-9aff-2122bd8e0deb,1714885617,1714802510
A Nonlinear Life,https://www.anonlinearlife.blog/,"A personal finance and lifestyle blog about my life of calculated risks, successes and failures, and everything in between.",https://supapjpiqdfzuaordcdx.supabase.co/storage/v1/render/image/public/images/1720313340342-nonlinearlife_logo_large.jpg?width=75&height=75&resize=contain,False,['finance'],0,False,,False,11500000,False,,,,#076ac3,en,0,0,True,75280aae-a56e-4434-8c80-43a233ecf904,1720313342,1719946319
FNCE Magazine,https://fnce.online/,Read academic financial articles with ease.,https://supapjpiqdfzuaordcdx.supabase.co/storage/v1/render/image/public/images/1707841138077-FNCE%20Magazine.png?width=75&height=75&resize=contain,False,['finance'],0,False,,False,11500000,False,,,,#FF1A75,en,0,0,False,45687f5f-8903-4ce2-b758-27dd862985b8,1707841139,1707840124
ProspireWealth,https://prospirewealth.ghost.io/,Inspired by Prosparity,https://supapjpiqdfzuaordcdx.supabase.co/storage/v1/render/image/public/images/1741427295206-Logo-watermark-image.png?width=75&height=75&resize=contain,False,['finance'],0,False,0,True,11500000,False,,,,#1b5a11,en,0,0,True,35ee26a0-3583-4331-8a53-00a44f4e335c,1741427296,1741427050
Drug Duel,https://neutral-capital.ghost.io/,Commentary on Biotech Stocks,https://supapjpiqdfzuaordcdx.supabase.co/storage/v1/render/image/public/images/1704043296177-f33e3072-2f04-4d25-b577-fc35fa17bf8b_upscaled_900.png?width=75&height=75&resize=contain,False,['finance'],0,False,,False,11500000,False,,,,#5988e6,en,0,0,True,31881aea-eb5e-4292-a1f0-7c138749670a,1704043297,1703991885
Funders' Found,https://fundersfound.co/,What I found in AI.,https://supapjpiqdfzuaordcdx.supabase.co/storage/v1/render/image/public/images/1747049340973-IMG_6432.JPG?width=75&height=75&resize=contain,False,['finance'],0,False,,False,11500000,False,,,,#6800ff,en,0,0,True,0724f557-36ab-4632-8230-4f84be70ed18,1747049343,1746973870
mykronor,https://mykronor.ghost.io/,"A down-to-earth resource for navigating finances in Sweden - from investment accounts to pensions, taxes, and everyday life. All written with newcomers in mind, by someone who’s been there.",https://supapjpiqdfzuaordcdx.supabase.co/storage/v1/render/image/public/images/1754234016677-Untitled-design--1-.png?width=75&height=75&resize=contain,False,['finance'],0,False,0,True,11500000,False,,,,#3e5dca,en,0,0,True,0511069a-e287-4226-8da9-93bae3863259,1754234017,1754229642
Exchange Invest,https://www.exchangeinvest.com/,"“Exchange Invest” Is “The Exchange of Information,"" a pithy daily newsletter providing insights into the world’s marketplaces & the clearing & settlement plumbing which accompanies them!",https://supapjpiqdfzuaordcdx.supabase.co/storage/v1/render/image/public/images/1693575564993-Stock-up-EI-Logo--1--1.png?width=75&height=75&resize=contain,False,['finance'],0,False,,False,13069970,False,,,,#060b56,en,0,0,True,5c170bbf-fd28-4966-b585-c9d9a92992cb,1693575566,1754109040
MortgageLogic.news,https://www.mortgagelogic.news/,Canada's most trusted source for breaking news on Canadian mortgage rates.,https://supapjpiqdfzuaordcdx.supabase.co/storage/v1/render/image/public/images/1699472427718-icon-colored@4x.png?width=75&height=75&resize=contain,False,['finance'],0,False,,False,13123253,False,,,,#E15718,cae,0,0,True,50e5555f-48e8-41c1-ae7e-8c542ac6e0ae,1699472429,1754107474
AfterPullback - Trade Smarter,https://blog.afterpullback.com/,"Explore topics about trading in the financial markets, focused on helping you to improve your trading edge and take control of your trading journey.",https://supapjpiqdfzuaordcdx.supabase.co/storage/v1/render/image/public/images/1700493965557-favicon.png?width=75&height=75&resize=contain,False,['finance'],0,False,,False,20970883,False,,,,#48BF84,en,0,0,True,6da45914-5346-417e-9e85-b60f5afc8821,1700493966,1753959188
InvestoBuzz,https://investobuzz.com/,InvestoBuzz simplifies money and investing to empower people in managing their finances confidently.,https://supapjpiqdfzuaordcdx.supabase.co/storage/v1/render/image/public/images/1746070400202-icon.png?width=75&height=75&resize=contain,False,['finance'],0,False,,False,21195410,False,,,,#970747,en,0,0,False,80e3dccd-dc7e-4077-b68a-debf770ce1cd,1746070401,1746069459
Liquide Blog,https://blog.liquide.life/,Get the best Financial news oon Indian equities,https://supapjpiqdfzuaordcdx.supabase.co/storage/v1/render/image/public/images/1688468372912-liquideicon-2.png?width=75&height=75&resize=contain,False,['finance'],0,False,,False,21405977,False,,,,#26145c,en,0,0,True,cd36bc2e-ab69-438e-a500-34a7a46f4629,1688468374,1754225111
Latest UK tax news from TaxAssist Accountants,https://www.taxtrends.co.uk/,UK Tax and Accountancy News from the leading bilingual accountant in London - both in English and in French,https://supapjpiqdfzuaordcdx.supabase.co/storage/v1/render/image/public/images/1737215811557-Yellow-Plus-2.ico?width=75&height=75&resize=contain,False,['finance'],0,False,,False,24061979,False,,,,#2965d3,en,0,0,True,f333a61a-3f87-4b68-9f5a-d28cf4137d29,1722931389,1753802097
AppliedMMT,https://appliedmmt.com/,Macroeconomic Research & Analysis from a Modern Monetary Theory perspective.,https://supapjpiqdfzuaordcdx.supabase.co/storage/v1/render/image/public/images/1712781151272-YouTube-Watermark--2-.png?width=75&height=75&resize=contain,False,['finance'],0,False,,False,26170860,False,,,,#0044a3,en,0,0,False,1ceeafeb-a92f-4a7b-bdc7-8bda2fe56e04,1701665603,1753738140
Tuna Payments,https://blog.tuna.uy/,"Tuna helps you increase approval rates and lower fraud costs. Choose which payments and antifraud providers you want, do AB tests between them and find out which combination brings the best results",https://supapjpiqdfzuaordcdx.supabase.co/storage/v1/render/image/public/images/1681856102785-Sem-T-tulo-5.png?width=75&height=75&resize=contain,False,['finance'],0,False,,False,29148173,False,,,,#31b34e,pt,0,0,True,b6313eef-e675-4962-a967-004af5951511,1681855686,1681131605
버니레이트,https://www.bunnyrate.com/,스타트업과 중소기업을 위한 맞춤형 재무 서비스,https://supapjpiqdfzuaordcdx.supabase.co/storage/v1/render/image/public/images/1742536098517-profile_bunnyrate_transperant.png?width=75&height=75&resize=contain,False,['finance'],0,False,,False,29392956,False,,,,#000000,ko,0,0,True,713686fc-9796-4342-97dd-1e32cf417ce9,1742536100,1750913425
Loonies and Sense,https://www.looniesandsense.com/,Helping DIY investors with better financial outcomes,https://supapjpiqdfzuaordcdx.supabase.co/storage/v1/render/image/public/images/1730416281205-looniesandsense_logo_new-just-brain-coin.png?width=75&height=75&resize=contain,False,['finance'],0,False,,False,35086994,False,,,,#3f3e3e,en,0,0,True,a7d83d19-49a2-4681-9154-f09332f6f6b0,1721156640,1743772032
Wall St Savage,https://www.wallstsavage.com/,Financial markets' ideas & insights without the BS.,https://supapjpiqdfzuaordcdx.supabase.co/storage/v1/render/image/public/images/wallstsavage.png?t=2022-07-19T13%3A16%3A36.389Z?width=75&height=75&resize=contain,False,['finance'],0,False,,False,36205338,False,,,,,en,0,0,True,c2ec0f5d-bda3-45a9-b178-fa6e62d1c073,1658238539,1649289600
Börse.net,https://www.xn--brse-5qa.net/,"Finanzportal rund um Aktien, Börse, Krypto, Devisen, ETFs & mehr",https://supapjpiqdfzuaordcdx.supabase.co/storage/v1/render/image/public/images/1675605867529-icon.png?width=75&height=75&resize=contain,False,['finance'],0,False,,False,36970234,False,,,,#61177c,de,0,0,False,304cf5f0-37c5-4dbf-90cb-75bb8c227c99,1675605868,1754111606
Roland Head,https://www.rolandhead.com/,"UK dividend share commentary and analysis, plus my model portfolio. This contains the same shares I own myself.",https://supapjpiqdfzuaordcdx.supabase.co/storage/v1/render/image/public/images/1689780373041-icon-v2.png?width=75&height=75&resize=contain,False,['finance'],0,False,,False,61201263,False,,,,#171db5,en,0,0,True,9ee7ed85-d90c-4c91-b1eb-e4ede78fcd7c,1689780373,1754204511
The Steadfast Club,https://www.thesteadfastclub.com/,Stock Trading Ideas for Short and Long Term Investment.,https://supapjpiqdfzuaordcdx.supabase.co/storage/v1/render/image/public/images/1731614736621-Jamie+Lund.png?width=75&height=75&resize=contain,False,['finance'],0,False,,False,76880630,False,,,,#7fc23e,en,0,0,True,c7d20e75-9fef-4970-b37d-8e902ec36a57,1731614738,1731182946
CrackingMarkets,https://www.crackingmarkets.com/,"Trade with confidence, powered by data and strategy. Systematic trading of stock, futures, options and crypto markets.",https://supapjpiqdfzuaordcdx.supabase.co/storage/v1/render/image/public/images/1727704017330-LAUxHx9gSIC3Ntc63qmlUw-1.jpg?width=75&height=75&resize=contain,False,['finance'],0,False,,False,78895223,False,,,,#0061FF,en,0,0,True,b4609938-4efc-459c-92a8-4f8b7cc0486e,1727444438,1748514475
FH Premium,https://www.fhpremium.com/,"Financial Horse was founded with a simple goal – To provide high quality financial commentary, to empower investors.",https://supapjpiqdfzuaordcdx.supabase.co/storage/v1/render/image/public/images/1700050489927-Financial-Horse--small-.jpg?width=75&height=75&resize=contain,False,['finance'],0,False,,False,82755273,False,,,,#005616,en,0,0,True,938920b6-aa97-4aa6-ba2b-899efc2b200d,1700050491,1754142169
The Gorilla Game,https://www.thegorillagame.com/,Deep Dives on Compounders,https://supapjpiqdfzuaordcdx.supabase.co/storage/v1/render/image/public/images/1750612038414-image--17-.jpg?width=75&height=75&resize=contain,False,['finance'],0,False,,False,84304924,False,,,,#000000,en,0,0,True,ec4b3abb-7248-4ac5-9a89-899385a39943,1750612039,1753402687
Zirkel Exchange,https://www.zirkelexchange.com/,Save money on corporate taxes while supporting clean energy!,https://supapjpiqdfzuaordcdx.supabase.co/storage/v1/render/image/public/images/1719961862358-ZX-Square-Logo.png?width=75&height=75&resize=contain,False,['finance'],0,False,,False,85778076,False,,,,#3CBBC2,en,0,0,True,3bf17aba-858c-413b-b6aa-7638fa553de7,1719961864,1719893626
Armchair Banker,https://www.armchairbanker.com/,"A newsletter delivering 'Learning finance made easy', with a humorous twist that makes even the driest financial news enjoyable",https://supapjpiqdfzuaordcdx.supabase.co/storage/v1/render/image/public/images/1733441700794-Armchair-banker-icon-60x60.png?width=75&height=75&resize=contain,False,['finance'],0,False,,False,117047814,False,,,,#e40f0f,en,0,0,True,c2f5e69c-8c8d-4b44-b5f4-b3af0ec12c66,1728970642,1753337006
Daan Investor,https://www.daaninvestor.com/,Fresh and inspiring path to financial freedom trough value investing.,https://supapjpiqdfzuaordcdx.supabase.co/storage/v1/render/image/public/images/1733726602497-Daan-Investor.png?width=75&height=75&resize=contain,False,['finance'],0,False,,False,118230995,False,,,,#100905,en,0,0,True,fc4f3905-b408-4643-97db-c287a3ebf9ab,1733726508,1743961481
ANQ Digital Finserv,https://blog.anq.finance/,"Elevate Your Financial Future: Anq - Your Gateway to Wealth Creation, Rewards, and Intelligent Savings!",https://supapjpiqdfzuaordcdx.supabase.co/storage/v1/render/image/public/images/1691473963272-Facebook%20Cover%20851x461.png?width=75&height=75&resize=contain,False,['finance'],0,False,,False,137625453,False,,,,#FF1A75,en,0,0,True,c936667d-576f-43b0-aa41-2e7f0f406752,1691473964,1753701945
交易生活,https://ictnlife.com/,美股期货指数、加密货币 BTC ETH、外汇、黄金技术分析免费教学和进阶教学,https://supapjpiqdfzuaordcdx.supabase.co/storage/v1/render/image/public/images/1738226472535-LOGO---.png?width=75&height=75&resize=contain,False,['finance'],0,False,,False,138407028,False,,,,#ffb419,zh,0,0,True,c3fe9f9e-caa3-4cf0-ae67-8c7bf2721540,1738226473,1738225948
SFX Global,https://sfxglobal.co/,Trading Mastery Simplified,https://supapjpiqdfzuaordcdx.supabase.co/storage/v1/render/image/public/images/1691647052687-sfx-global-icon.png?width=75&height=75&resize=contain,False,['finance'],0,False,,False,164204839,False,,,,#000000,en,0,0,True,3d25d2dc-47b4-43f9-8fb4-ac58171fa781,1691647053,1721227201
CrossTrade Blog: Insights and Updates on Automated Trading.,https://blog.crosstrade.io/,CrossTrade connects TradingView and NinjaTrader for Automated trading.,https://supapjpiqdfzuaordcdx.supabase.co/storage/v1/render/image/public/images/1743165273852-Favicon--1-.png?width=75&height=75&resize=contain,False,['finance'],0,False,,False,195197884,False,,,,#0088ff,en,0,0,False,ee9f9c47-97f3-41f1-8281-f8b1296fdcae,1743107905,1753901608
BioCompounding,https://www.biocompounding.com/,Equity investment research breaking down one pharma/biotech every month.,https://supapjpiqdfzuaordcdx.supabase.co/storage/v1/render/image/public/images/1669559430849-1669559354205-1669433490564-1669433428819-1669433382293-1669044824453-Black-Minimalist-Redbird-Logo.png?width=75&height=75&resize=contain,False,['finance'],0,False,,False,212124514,False,,,,#0a2463,en,0,0,True,49f315a6-3347-481f-bd78-24966de3a69e,1669044828,1736683209
Mais Riquezas,https://www.maisriquezas.com/,Descomplicando as finanças,https://supapjpiqdfzuaordcdx.supabase.co/storage/v1/render/image/public/images/1734205572191-MR.jpg?width=75&height=75&resize=contain,False,['finance'],0,False,,False,303870659,False,,,,#2019ff,pt-br,0,0,True,406dea71-7d57-4519-8ecb-5cda2348dc47,1734205574,1734204976
The Daily Calls,https://thedailycalls.com/,"Stocks, Futures, Indices, and Options Trades",https://supapjpiqdfzuaordcdx.supabase.co/storage/v1/render/image/public/images/1737302766764-MES1!_2025-01-19_10-05-56_a6a7d.png?width=75&height=75&resize=contain,False,['finance'],0,False,,False,305689011,False,,,,#1464bf,en,0,0,False,a37e302f-bba9-4d0a-81cf-eb22222a49c7,1737302767,1736638224
Yuppie Calls,https://www.yuppiecalls.com/,"Stocks, cryptos and derivatives calls tailored for the Value Investor. Dive into curated value investing strategies and market analysis to inform your financial decisions and investment portfolio.",https://supapjpiqdfzuaordcdx.supabase.co/storage/v1/render/image/public/images/1714134345987-Logo.jpg?width=75&height=75&resize=contain,False,['finance'],0,False,,False,345324144,False,,,,#ff0066,en,0,0,True,7efd28d5-5e73-4d48-a9f5-b1df5cdf50e6,1714134348,1725546020
