Title,URL,Description,Publication Icon,Not Safe For Work,Categories,Member Count,Show Member Count,Monthly Recurring Revenue (MRR),Show MRR,Ghost Rank,Featured,Feature Image,Text Color,Background Color,Accent Color,Language,MRR Members Rank,MRR Members Diff Rank,Show Iframe,Object ID,Created At,Updated At
Sample Focus Blog,https://samplefocus.com/blog/,"Music Production tutorials, news, and sound musings.",https://supapjpiqdfzuaordcdx.supabase.co/storage/v1/render/image/public/images/1740078252467-profile.png?width=75&height=75&resize=contain,False,['music'],1384101,True,,False,-537620,False,,,,#6055F5,en,1384101,0,True,55aeb40a-c754-476b-b6aa-f66651938489,1740078253,1740044027
The Rest – A Music Newsletter,https://www.therestnewsletter.com/,"Algorithms keep giving you more of the same. Our newsletter is dedicated to the rest. A song and an interesting story about it, every weekday. Refreshing, insightful and snackable.",https://supapjpiqdfzuaordcdx.supabase.co/storage/v1/render/image/public/images/1724319942549-The-Rest-Cherry.svg?width=75&height=75&resize=contain,False,['music'],11174,True,,False,16604926,False,,,,#383838,en,11174,0,True,dd970bfa-9ca1-43b2-a7ec-971ffbff3702,1706789129,1745940398
22世紀衛星,https://www.22cs.xyz/,台灣第一個音樂產業研究型媒體暨社群,https://supapjpiqdfzuaordcdx.supabase.co/storage/v1/render/image/public/images/1724556754391-22CS_-----1.png?width=75&height=75&resize=contain,False,['music'],1011,True,604,True,35276645,False,,,,#ff7a7a,zh-hant,7048.952823,2,True,b8ed6edc-1251-4bc3-9cfc-0b6678cd97ed,1718763285,1744198268
Get It Together,https://getittogether.laurendenitzio.com/,"A weekly newsletter & subscription series written from a queer-feminist perspective by Lauren Denitzio, artist and songwriter in the band Worriers.",https://supapjpiqdfzuaordcdx.supabase.co/storage/v1/render/image/public/images/1670718393168-GIT_Header_favicon.png?width=75&height=75&resize=contain,False,['music'],1981,True,441,True,14288103,False,,,,#4d8b9f,en,6387.4,1,True,6fcc92ce-5f88-456d-ac32-142d8b984020,1660063638,1745504933
Melihat Gülses,https://melihatgulses.net/,Melihat Gülses resmi sitesi,https://supapjpiqdfzuaordcdx.supabase.co/storage/v1/render/image/public/images/1736184313173-melihat-gulses_1.jpg?width=75&height=75&resize=contain,False,['music'],4793,True,,False,9005448,False,,,,#240655,tr,4793,0,True,53916e83-3bb2-47f1-b097-014591705049,1736184314,1714646122
caryn rose's jukeboxgraduate dot com,https://jukeboxgraduate.com/,"writing about listening to music. you've read my work in Pitchfork, NPR, Vulture, Backstreets Magazine and many more.",https://supapjpiqdfzuaordcdx.supabase.co/storage/v1/render/image/public/images/1713815184817-eee007ec-3adf-4b02-a2d3-17a6cdfd28ec_147x147.jpg?width=75&height=75&resize=contain,False,['music'],1723,True,,False,11115648,False,,,,#d719ff,en,1723,0,True,acf51a62-3412-443e-af41-7e475c8c5a8c,1713815186,1713810009
Rhythm Changes,https://www.rhythmchanges.ca/,"The Canadian jazz website in Vancouver, BC: Canada's fastest-growing & most active jazz blog. A home for creative, improvising, local music people. Gig list of jazz shows, free weekly email, podcast.",https://supapjpiqdfzuaordcdx.supabase.co/storage/v1/render/image/public/images/1731824488390-wrc-80.png?width=75&height=75&resize=contain,False,['music'],1712,True,,False,512181,False,,,,#fd6a02,en,1712,4,True,97cbf664-55a5-48e6-a6aa-2928e62f22e9,1660192640,1745931619
Negative White,https://www.negativewhite.com/,Music is better when shared. — A music newsletter for curious minds.,https://supapjpiqdfzuaordcdx.supabase.co/storage/v1/render/image/public/images/1744052285304-Negative-White-2014---Logo.png?width=75&height=75&resize=contain,False,['music'],724,True,93,True,18128393,False,,,,#af170a,en,1656.5,14,True,dccc5d47-9d7e-4e35-9475-c870dd7c3813,1683871953,1745920818
Scene Pensacola,https://www.scenepensacola.com/,"Scene Pensacola is an independent publication, launched in 2023 to shine a light on and document the Pensacola and Gulf Coast's Music and Arts scene.",https://supapjpiqdfzuaordcdx.supabase.co/storage/v1/render/image/public/images/1731044126877-ScenePensqcola-WhiteBoxLogo.jpg?width=75&height=75&resize=contain,False,['music'],1575,True,,False,122416611,False,,,,#aaaaaa,en,1575,3,True,2639eb22-9fc5-447b-bcaf-b6551ab05790,1675845811,1745610158
Chasing Sundays,https://www.elienis.com/,"Music criticism, essays, and interviews by writer, editor, and podcaster Eli Enis.",https://supapjpiqdfzuaordcdx.supabase.co/storage/v1/render/image/public/images/1718992941899-chasing-sundays-logo-ball--3.jpg?width=75&height=75&resize=contain,False,['music'],1516,True,,False,7729476,False,,,,#3d487b,en,1516,12,True,02868ab0-4e21-408d-a6fd-72c30104d677,1678213895,1745575217
Abundant Living,https://zacharylipez.ghost.io/,Don't drag your orchestra into this thing,https://supapjpiqdfzuaordcdx.supabase.co/storage/v1/render/image/public/images/1680341820236-image0-4.jpeg?width=75&height=75&resize=contain,False,['music'],1417,True,,False,8714849,False,,,,#000000,en,1417,6,True,e380ca8d-3ec4-40b8-afc7-7e8098fffe52,1680341821,1741599324
i enjoy music,https://www.ienjoymusic.net/,a blog for people who enjoy music,https://supapjpiqdfzuaordcdx.supabase.co/storage/v1/render/image/public/images/1689878258817-i-enjoy-music.png?width=75&height=75&resize=contain,False,['music'],838,True,,False,10059712,False,,,,#636363,en,838,16,True,d3b7d534-a849-4ebd-89bd-350e4fe9886c,1689878259,1745512379
Sebastiaan Hooft - Author and Techno Producer,https://www.sebastiaanhooft.com/,Weekly techno radio show by producer and health visionary Sebastiaan Hooft.,https://supapjpiqdfzuaordcdx.supabase.co/storage/v1/render/image/public/images/1712131744815-Untitled--60---60-px-.ico?width=75&height=75&resize=contain,False,['music'],759,True,0,True,4364132,False,,,,#1C1C1C,en,759,8,True,edf3edf8-b4ba-4f2e-88f3-0678be5b7ad9,1660081328,1745739142
Media Events by Drew Millard,https://media-events.ghost.io/,High-level cultural commentary at recession-proof prices.,https://supapjpiqdfzuaordcdx.supabase.co/storage/v1/render/image/public/images/1725386385076-wm3.png?width=75&height=75&resize=contain,False,['music'],469,True,,False,30877111,False,,,,#BDACE5,en,469,14,True,e99a4ab0-7d5e-4b6a-b608-52e6dc6a156b,1723220203,1740524206
The Metalverse,https://www.themetalverse.net/,"The Metalverse | Rock/Heavy Metal News, Reviews, and Interviews",https://supapjpiqdfzuaordcdx.supabase.co/storage/v1/render/image/public/images/1726938971155-Black-White-Minimalist-Simple-Logo.png?width=75&height=75&resize=contain,False,['music'],394,True,7,True,10499578,False,,,,#a71515,en,464.8,0,True,b5b060d3-f9c1-44ad-9346-18bff6f8c95c,1717606347,1745875182
Thoughts of a Certain Sound,https://certainsound.net/,"writing on left-field music, arts, and culture",https://supapjpiqdfzuaordcdx.supabase.co/storage/v1/render/image/public/images/1731449060587-TCS_Favicon-100.jpg?width=75&height=75&resize=contain,False,['music'],301,True,,False,10499683,False,,,,#4319ff,en,301,0,True,4ff25980-da70-4646-86e5-5fd5de44a21b,1731449062,1731435897
Rainbow Rodeo,https://rainbowrodeomag.com/,Your home for queer country music,https://supapjpiqdfzuaordcdx.supabase.co/storage/v1/render/image/public/images/1730300836226-Untitled%20design(9)-Photoroom.png?width=75&height=75&resize=contain,False,['music'],293,True,0,True,3075194,False,,,,#ff199e,en,293,0,True,a657e8db-ddb9-4eb3-a24a-7833ccfe9908,1730300837,1730300447
BackStagePass,https://backstage.lmsuk.org/,The ultimate DIY branding kit for musicians.,https://supapjpiqdfzuaordcdx.supabase.co/storage/v1/render/image/public/images/1740651353627-89047c7d-91c7-46a7-9765-79c7a2b3d121.jpeg?width=75&height=75&resize=contain,False,['music'],270,True,,False,10499716,False,,,,#f26d34,en-gb,270,0,True,8f61e906-97d2-46d2-8fc2-6a8414227022,1740651354,1740077178
Von Bieker Backstage,https://backstage.vonbieker.com/,"Exclusive songs, stories and community for hopefuls seeking broken beauty.",https://supapjpiqdfzuaordcdx.supabase.co/storage/v1/render/image/public/images/1711642514743-broken-bow-logo-sticker.png?width=75&height=75&resize=contain,False,['music'],262,True,,False,115160837,False,,,,#2b4a3f,en,262,0,True,7453cb8d-bf79-4cef-9ec5-33671f87a01c,1711642516,1711642046
Kick Punch Slap,https://www.kickpunchslap.com/,"Improve music production through guides, deep-dives, interviews and collections of useful resources.",https://supapjpiqdfzuaordcdx.supabase.co/storage/v1/render/image/public/images/1730861211317-Punch.jpg?width=75&height=75&resize=contain,False,['music'],228,True,0,True,9999772,False,,,,#ffb700,en,228,24,True,47ef4c3e-2c99-4a54-bbed-7def1a1fc323,1730267041,1732163908
Seek HiFi,https://www.seekhifi.com/,Your stereo is an emotion engine. This is fuel. Seek HiFi hand-curates and delivers one audiophile song deep dive every week.,https://supapjpiqdfzuaordcdx.supabase.co/storage/v1/render/image/public/images/1728926798259-Seek-HiFi-Brand-7.png?width=75&height=75&resize=contain,False,['music'],224,True,,False,4772103,False,,,,#dd9120,en,224,9,True,716be9f8-3d58-465f-984c-0e9271bce79e,1728139895,1745951965
Tanda of the Week,https://www.tandaoftheweek.com/,Argentine Tango - Improving milongas around the world since 2010,https://supapjpiqdfzuaordcdx.supabase.co/storage/v1/render/image/public/images/1743584498035-totwlogo-2.gif?width=75&height=75&resize=contain,False,['music'],197,True,,False,29894535,False,,,,#FF1A75,en,197,0,True,df0b7324-e10e-4896-a858-081db4541dbc,1743584499,1743411658
𝕽𝖊𝖈𝖔𝖌𝖓𝖎𝖟𝖊 𝕽𝖊𝖈𝖔𝖗𝖉𝖘,https://www.recognizerecords.live/,"Recognize Records is a hub for hip-hop, culture, and creativity—curating mixes, DJ sets, and deep music commentary while exploring the connection between sound, self-growth, and mental health.",https://supapjpiqdfzuaordcdx.supabase.co/storage/v1/render/image/public/images/1740011456065-Untitled-design.png?width=75&height=75&resize=contain,False,['music'],17,True,14,True,9999969,False,,,,#000000,en,156.8,11,True,f5eb5e06-5aa0-4dd5-b55d-c7542e82ce5b,1740011457,1741230014
Peter Zimon,https://www.peterzimon.com/,"Designer, musician, drums and synth enthusiast writing about building electronic instruments.",https://supapjpiqdfzuaordcdx.supabase.co/storage/v1/render/image/public/images/1663592148103-pixie-cir-2.png?width=75&height=75&resize=contain,False,['music'],128,True,0,True,263826133,False,,,,#181818,en,128,7,True,cd9a5f0f-a2d5-4747-bca8-b89d67ec29e8,1663591991,1734776321
Attack & Flux,https://www.attackandflux.com/,"A song to study and an album to live in, once a week, every week. Turn discovering new music into practice and join me as I use it to unpack my knowledge of self.",https://supapjpiqdfzuaordcdx.supabase.co/storage/v1/render/image/public/images/1671134035440-A&FIcon.png?width=75&height=75&resize=contain,False,['music'],122,True,,False,283344776,False,,,,#1F1F1F,en,122,2,True,0f6125a7-e71a-4af3-99f2-b57b15aa911a,1666046052,1714956066
Daily Records,https://www.auditorymusings.net/,A music blog serving up a daily record recommendation,https://supapjpiqdfzuaordcdx.supabase.co/storage/v1/render/image/public/images/1668803948168-twitter.png?width=75&height=75&resize=contain,False,['music'],108,True,,False,7136253,False,,,,#ff881a,en,108,2,True,9fae7e6e-a8a3-4461-9ccc-2b48df60f261,1660071066,1734669730
Craft Your Sound,https://www.craftyoursound.com/,"Insights from the world's best music producers to help you write original music, finish tracks 10x faster, create better sounds, and release more projects.",https://supapjpiqdfzuaordcdx.supabase.co/storage/v1/render/image/public/images/1668481526161-craftyoursound-logo.png?width=75&height=75&resize=contain,False,['music'],91,True,0,True,17414480,False,,,,#8358f9,en,91,5,True,d3f649c0-2524-45f8-a481-dbd57c0fd518,1668481527,1726761413
Crucial Tracks,https://www.crucialtracks.org/,"There are points in your life that are defined by music. Songs represent relationships and trigger memories. These are what we call crucial tracks. Follow along for interviews, album reviews, & more!",https://supapjpiqdfzuaordcdx.supabase.co/storage/v1/render/image/public/images/1727572471416-ct-square.jpg?width=75&height=75&resize=contain,False,['music'],74,True,,False,12040860,False,,,,#ff1b40,en,74,0,True,2ab18ee0-0aee-4bee-acdb-47c724248e0f,1727572472,1727492979
Blue Note Dispatch,https://www.bluenotedispatch.com/,Curated by humans weekly selection of handpicked new electronic music from all around the world.,https://supapjpiqdfzuaordcdx.supabase.co/storage/v1/render/image/public/images/1745545824984-IMG_7591--1--1.jpeg?width=75&height=75&resize=contain,False,['music'],62,True,,False,10499934,False,,,,#0a316d,en,62,0,True,e6192435-f55e-42ee-a1e0-dbfc53162349,1721196051,1745828922
No Future Triumphant,https://nofuturetriumphant.com/,"A newsletter dedicated to thoughtful analysis of music, art & the technology changing how we interact with it. Written by Brandon Lucas Green.",https://supapjpiqdfzuaordcdx.supabase.co/storage/v1/render/image/public/images/1705714834187-_forweb_akaivertical.jpg?width=75&height=75&resize=contain,False,['music'],58,True,,False,10499939,False,,,,#707070,en,58,0,True,69798524-37c2-498f-ac4f-7b3f8a531787,1705714835,1705695045
Trilobite Polka Review,https://trilobite-polka-review.ghost.io/,"5 reviews per month of recent releases from Wisconsin artists, curated by musician and music librarian Steev Baker.",https://supapjpiqdfzuaordcdx.supabase.co/storage/v1/render/image/public/images/1745861393792-trilobite.png?width=75&height=75&resize=contain,False,['music'],57,True,,False,10499940,False,,,,#319177,en,57,0,True,6fad8f40-b791-4b9b-8847-653a4afa2606,1745861394,1745625617
Le Web3 et la musique,https://le-web3-et-la-musique.ghost.io/,Réflexions sur l'impact du Web3 dans l'industrie de la musique et les promesses d'un modèle plus juste pour les artistes.,https://supapjpiqdfzuaordcdx.supabase.co/storage/v1/render/image/public/images/1663070515300-icons8-bibliothe-que-musicale-50.png?width=75&height=75&resize=contain,False,['music'],52,True,,False,96185367,False,,,,#151618,fr,52,0,True,e4323cd4-923f-424c-a761-280c75cda623,1663070516,1745856752
glamglare,https://www.glamglare.com/,"New music every day, curated with love from NYC.",https://supapjpiqdfzuaordcdx.supabase.co/storage/v1/render/image/public/images/1722295831946-glamglare-square---savigny.jpg?width=75&height=75&resize=contain,False,['music'],43,True,,False,574973,False,,,,#Ff3399,en,43,0,True,f86706c2-4a87-4682-99cf-d7be01cb45d0,1722295833,1722191316
The Canary by Conner Lee,https://www.connerlee.com/,"Music and writing for creatives, queers, and theatre nerds. The Canary is an introspective journal of self-discovery and creativity.",https://supapjpiqdfzuaordcdx.supabase.co/storage/v1/render/image/public/images/1739502220826-favicon.png?width=75&height=75&resize=contain,False,['music'],36,True,,False,10499962,False,,,,#5524ff,en,36,0,True,4b5391bb-e8e2-4c7d-8fe7-87f1dc44d84f,1672328643,1745067632
dun4real,https://dun4real.org/,"your internet friend covering everything about twenty one pilots, including news, music and lore!",https://supapjpiqdfzuaordcdx.supabase.co/storage/v1/render/image/public/images/1710692505376-Webp.net-resizeimage-1.png?width=75&height=75&resize=contain,False,['music'],23,True,,False,364326472,False,,,,#47c4dc,en,23,0,False,ec35cde6-4428-4cfa-bb2a-cd18de418ab7,1710692508,1710687688
Raccoon Point Studios,https://raccoon-point-studios.ghost.io/,"Learn to make amazing music with our tips, tutorials, and support. We’ll help you with recording, mixing, mastering, and more.",https://supapjpiqdfzuaordcdx.supabase.co/storage/v1/render/image/public/images/1681837476221-raccoon_point_poster1-HI.jpg?width=75&height=75&resize=contain,False,['music'],13,True,,False,9999987,False,,,,#ff38e4,en,13,2,True,51512e6e-eb66-4f88-b790-6666c000b0ec,1681837477,1682092748
Spuren | Radio,https://radio.spurenkreis.net/,"Klänge, Musik, Dialoge, Lesungen & mehr...",https://supapjpiqdfzuaordcdx.supabase.co/storage/v1/render/image/public/images/1742791549731-skradio-icon-2.png?width=75&height=75&resize=contain,False,['music'],6,True,,False,6460391,False,,,,#c3975f,de,6,0,True,bbe58a73-8a97-4b8d-88b3-9ab796f386db,1742791551,1742299200
Billie Stans,https://billiestans.com/,"Explore Billie Stans for in-depth Eilish insights. Connect with fans, dive into articles, and celebrate the essence of Billie's artistry.",https://supapjpiqdfzuaordcdx.supabase.co/storage/v1/render/image/public/images/1701922587246-B.png?width=75&height=75&resize=contain,False,['music'],5,True,0,True,11499994,False,,,,#db2a26,en,5,0,False,69cd0319-23d8-4c92-a8c2-403f6bdfc67d,1701922588,1701832591
Jorge Ceja Morán,https://www.cejamoran.com/,Feel the jazz while reading,https://supapjpiqdfzuaordcdx.supabase.co/storage/v1/render/image/public/images/1721296579086-JAZZ-3.png?width=75&height=75&resize=contain,False,['music'],5,True,,False,104808709,False,,,,#007c4f,en,5,0,True,f192ed73-4219-4027-bee6-c12fc74a5460,1721296581,1720860377
Vuokko's Daily Groove,https://music.vuokko.be/,"Vuokko's Daily Groove: Your daily dose of musical inspiration! Join us as we explore a new song each day. Tune in, groove on, discover new tracks!",https://supapjpiqdfzuaordcdx.supabase.co/storage/v1/render/image/public/images/1707394344584-istockphoto-1244097573-612x612.jpg?width=75&height=75&resize=contain,False,['music'],2,True,0,True,10499997,False,,,,#010101,en,2,1,True,bba322a7-da7a-4458-a96e-d83579910545,1707291120,1745604055
The Music Doctor,https://the-music-doctor.ghost.io/,"Columns, recommendations, exploring new music and request curated playlists",https://supapjpiqdfzuaordcdx.supabase.co/storage/v1/render/image/public/images/1726246396099-Untitled.png?width=75&height=75&resize=contain,False,['music'],1,True,,False,11499998,False,,,,#FF1A75,en,1,0,True,8c938322-95b9-4365-8b58-034513d6f57f,1726246397,1726236453
Heavy Blog is Heavy,https://www.heavyblogisheavy.com/,Documenting the Golden Age of Metal,https://supapjpiqdfzuaordcdx.supabase.co/storage/v1/render/image/public/images/1664819490974-HBIH LOGO secondary symbol 1 transparent gold.png?width=75&height=75&resize=contain,False,['music'],0,False,,False,29032,False,,,,#000000,en,0,0,True,9f964e64-d34a-47ef-87ed-24b4e6335ad3,1664819492,1745942431
Metalhead Community,https://metalheadcommunity.com/,"Independent Music Magazine of the Mighty Metal Community based in Helsinki, Finland 🇫🇮.",https://supapjpiqdfzuaordcdx.supabase.co/storage/v1/render/image/public/images/1710093970019-Metalhead-Community-Social-Media-Logo-2020-August.jpg?width=75&height=75&resize=contain,False,['music'],0,False,,False,133588,False,,,,#967706,en,0,0,True,b55415c1-e2b9-4554-8335-917f0409d47b,1710093971,1709909740
Altcoin Investor,https://altcoininvestor.com/,Get the inside scoop on the most promising Altcoins. Expert advice for informed investment decisions.,https://supapjpiqdfzuaordcdx.supabase.co/storage/v1/render/image/public/images/1710888207646-Altcoin-Icon.png?width=75&height=75&resize=contain,False,['music'],0,False,,False,732596,False,,,,#694730,en,0,0,True,b4f85401-3f2b-4116-ac0c-accc6ee1e7ee,1698111863,1745671432
Music Savage,https://www.musicsavage.com/,New music for your ears. Music. No More. No Less.,https://supapjpiqdfzuaordcdx.supabase.co/storage/v1/render/image/public/images/1729697164828-3jvLqZe2_400x400.png?width=75&height=75&resize=contain,False,['music'],0,False,,False,2252456,False,,,,#ff5e23,en,0,0,True,54a4ec71-9c7f-47af-8aae-86966549c19c,1729697166,1729275369
Hearing Things,https://www.hearingthings.co/,"A new music publication for the web's next generation of audiophiles, from the team that brought you Pitchfork.",https://supapjpiqdfzuaordcdx.supabase.co/storage/v1/render/image/public/images/1736779048518-favicon.svg?width=75&height=75&resize=contain,False,['music'],0,False,,False,2438082,False,,,,#747FE7,en,0,0,True,d02ff916-aea7-449a-ae12-9175151e35f4,1732491114,1745857542
Music For All,https://www.musicforall.club/,"a blog to support decentralization, free expression & self-reliance in music.",https://supapjpiqdfzuaordcdx.supabase.co/storage/v1/render/image/public/images/1673918283839-MFA-3.png?width=75&height=75&resize=contain,False,['music'],0,False,,False,2900955,False,,,,#000000,en,0,0,True,4906dba0-a1ed-40cc-a2e4-880fd5e9e3c1,1673918284,1704943715
Cabbages,https://www.cabbageshiphop.com/,fresh veg for hip-hop heads. rapper interviews. new album recommendations. original podcasts. 420-friendly content. a biweekly newsletter.,https://supapjpiqdfzuaordcdx.supabase.co/storage/v1/render/image/public/images/1665249297987-New-Logo--2-.png?width=75&height=75&resize=contain,False,['music'],0,False,,False,3151798,False,,,,#669d34,en,0,0,True,72fc3cba-c336-4314-897f-0c0be067b200,1661260346,1745272291
Downbeat.fm,https://www.downbeat.fm/,A free monthly indie and alt rock playlist.,https://supapjpiqdfzuaordcdx.supabase.co/storage/v1/render/image/public/images/1741453485199-downbeat-fm.png?width=75&height=75&resize=contain,False,['music'],0,False,,False,3642314,False,,,,#1eb954,en,0,0,True,a673ad5a-c0d8-4515-9ecb-d590a2c4a4ef,1741453486,1738679233
Richard Pryn,https://richardpryn.com/,"An Award winning composer teaching music for movie trailers, games, and TV.",https://supapjpiqdfzuaordcdx.supabase.co/storage/v1/render/image/public/images/1673637545475-Ghost-Icon.png?width=75&height=75&resize=contain,False,['music'],0,False,,False,3794060,False,,,,#FEBD0F,en,0,0,True,2f2d9a47-8242-4051-8678-af07c3c9727d,1673637546,1745929530
obscure.com,https://obscure.com/,"DIY synthesizers, trail running, and music",https://supapjpiqdfzuaordcdx.supabase.co/storage/v1/render/image/public/images/1741889292744-logo.png?width=75&height=75&resize=contain,False,['music'],0,False,,False,5102933,False,,,,#607c36,en,0,0,False,f53f439e-879f-43de-8654-f05152dbcf7a,1741889293,1740095602
Vanity Dust,https://www.vanitydust.ninja/,Barcelona based techno music journalist standing for club culture. Sharing and releasing from tracks to live Dj Sets and interviewing worldwide key artists from the inexhaustible techno scene.,https://supapjpiqdfzuaordcdx.supabase.co/storage/v1/render/image/public/images/1671307253067-soundcloud_perfil.jpg?width=75&height=75&resize=contain,False,['music'],0,False,,False,8610521,False,,,,#94e5bb,(es),0,0,True,dba94f61-5449-411b-97dc-5e9b85b14bc7,1671307256,1718208026
Beshoy,https://beshoy.trance.productions/,Music by Beshoy,https://supapjpiqdfzuaordcdx.supabase.co/storage/v1/render/image/public/images/1687901876319-F1BC33BB-D677-45FF-98CE-B61AED8CFA0C.jpeg?width=75&height=75&resize=contain,False,['music'],0,False,,False,10000000,False,,,,#0009cd,en,0,0,True,23fb7138-7868-4094-963f-46af1b408338,1687901884,1739421582
ALL ACES,https://allaces.ghost.io/,"Shuffling through the major, minor, and wild in global pop music.",https://supapjpiqdfzuaordcdx.supabase.co/storage/v1/render/image/public/images/1712191403573-Screenshot%202024-02-28%20at%2011.17.20.png?width=75&height=75&resize=contain,False,['music'],0,False,,False,10000000,False,,,,#1111ff,en,0,0,True,1a7e41a4-4f79-4ba1-81f3-29e82034e8bb,1712191405,1712163711
Sonic Depths,https://www.sonicdepths.com/,"Experience the ultimate productivity soundtrack. Curated music playlists for better focus, delivered monthly.",https://supapjpiqdfzuaordcdx.supabase.co/storage/v1/render/image/public/images/1707296490508-Sonic-Depths---Logo-vierkant-zonder-tekst.png?width=75&height=75&resize=contain,False,['music'],0,False,,False,10000000,False,,,,#b96b40,en,0,0,True,0e145fef-8ab7-4793-bc48-c3c56b9ac169,1707296492,1717951525
Vivid Guitar,https://vividguitar.co/,"The newsletter for guitar players. Guitar lessons & practice ideas, along with the most interesting guitar news, gear info, & more.",https://supapjpiqdfzuaordcdx.supabase.co/storage/v1/render/image/public/images/1730487238893-Untitled_design-removebg-preview.png?width=75&height=75&resize=contain,False,['music'],0,False,,False,10331254,False,,,,#b6362c,en,0,0,True,ee4745e0-5e56-4ae2-a7ae-267ece2727f9,1730487240,1730388593
叶枫 yieiori,https://yieiori.digitalpress.blog/,singer/songwriter/Guitarist,https://supapjpiqdfzuaordcdx.supabase.co/storage/v1/render/image/public/images/1718081127546-tumblr_c04c37dc0647611ed0f6f57ca94d2638_fd494f84_750.jpg?width=75&height=75&resize=contain,False,['music'],0,False,,False,10500000,False,,,,#385fc9,cn,0,0,True,d2d1845c-a873-4ddf-8f96-ad734875efd9,1718081129,1718080492
The AuralisMag,https://www.theauralismag.com/,For the Love of Sound and Storytelling... Music Reviews and Coverage from Seattle.,https://supapjpiqdfzuaordcdx.supabase.co/storage/v1/render/image/public/images/1741489012233-download--1---1--2.png?width=75&height=75&resize=contain,False,['music'],0,False,,False,10500000,False,,,,#000000,en,0,0,True,c2a361c5-77cc-4b20-b7b5-5ecac46a231e,1741489014,1741469852
Subtera,https://subteramusic.com/,"Documentamos, recomendamos y compartimos la escena musical. ¡Recibe noticias, DJ Podcasts, playlists e info de eventos locales!",https://supapjpiqdfzuaordcdx.supabase.co/storage/v1/render/image/public/images/1743650579804-logo-1.svg?width=75&height=75&resize=contain,False,['music'],0,False,,False,10500000,False,,,,#FF1A75,es,0,0,True,a70eb4f8-ea74-49b2-9ef3-991d328acdf8,1743650580,1743381154
Sonic Odyssey,https://www.sonicodyssey.net/,"Sonic Odyssey is your ultimate destination for music production tips, gear reviews, and expert insights.",https://supapjpiqdfzuaordcdx.supabase.co/storage/v1/render/image/public/images/1742177550810-social%20media%20kit_insta%20and%20dp.jpg?width=75&height=75&resize=contain,False,['music'],0,False,,False,10500000,False,,,,#8c888d,en,0,0,True,a4b6641d-eb9c-41d3-a5c9-e76565eb09b3,1742177551,1742130017
