Title,URL,Description,Publication Icon,Not Safe For Work,Categories,Member Count,Show Member Count,Monthly Recurring Revenue (MRR),Show MRR,Ghost Rank,Featured,Feature Image,Text Color,Background Color,Accent Color,Language,MRR Members Rank,MRR Members Diff Rank,Show Iframe,Object ID,Created At,Updated At
Devoted 2 Dachshunds Rescue®,https://d2dr.org.au/,Devoted 2 Dachshunds Rescue is committed to the safe rescue & rehoming of Dachshunds.,https://supapjpiqdfzuaordcdx.supabase.co/storage/v1/render/image/public/images/1737679665422-D2DR_Main_ICO-01.svg?width=75&height=75&resize=contain,False,['nature & outdoors'],1102,True,1K,True,3734593,False,,,,#782B90,en,11182.336,515,False,07367a90-06a4-4ae9-8bb1-0d73c76b156a,1708212501,1752630974
Wanderstories,https://wanderstories.space/,"An adventure guide to Townsville and North Queensland's great outdoors. Hiking, running, canyoning, backpacking, bikepacking, packrafting, whitewater, rock climbing, etc",https://supapjpiqdfzuaordcdx.supabase.co/storage/v1/render/image/public/images/1693825507903-Wanderstories-publication-logo.png?width=75&height=75&resize=contain,False,['nature & outdoors'],2180,True,458,True,3405399,False,,,,#15171A,en,6761.777983999999,9,False,c1e18b5e-f5db-4a92-8e02-3e42c21edbc9,1664376588,1747724400
Hiking America,https://www.hikingamerica.com/,"Hiking America - American Discovery Trail Maps & Guides. Independent, Crowdsourced.",https://supapjpiqdfzuaordcdx.supabase.co/storage/v1/render/image/public/images/1665314415067-Hiking-America-M-B-IconCrop-1.png?width=75&height=75&resize=contain,False,['nature & outdoors'],277,True,233,True,35192120,False,,,,#145158,en,2605.8,3,True,8c20807c-9678-4aef-a701-5e9cd280fba1,1660475757,1752588005
Lawyers for Nature,https://lawyers-for-nature.ghost.io/,Representing the natural world and all who seek to defend it.,https://supapjpiqdfzuaordcdx.supabase.co/storage/v1/render/image/public/images/1665745771897-Lawyers-for-Nature-Publication-Icon--Minimised.png?width=75&height=75&resize=contain,False,['nature & outdoors'],1319,True,0,True,66176832,False,,,,#4aa2b9,en,1319,6,True,b4401702-6ffd-4f58-ba23-d24aee8a9186,1664915743,1729185560
Pitchstone Waters,https://www.pitchstonewaters.com/,Ranchers. Entrepreneurs. Environmentalists. Increasing biodiversity for a better ranch—and a better tomorrow.,https://supapjpiqdfzuaordcdx.supabase.co/storage/v1/render/image/public/images/1725976341732-pitchstone_waters_logo_SECONDARY.png?width=75&height=75&resize=contain,False,['nature & outdoors'],657,True,,False,386501,False,,,,#5C291F,en,657,0,True,913d6c54-cd43-4d01-acbc-26618b7010d9,1725976343,1725973825
Patrol: Anti-poaching in Action,https://www.patrolling.org/,"Featuring the anti-poaching work of safari operations across Africa in a twice-monthly newsletter format through written articles, photography, and short documentaries.",https://supapjpiqdfzuaordcdx.supabase.co/storage/v1/render/image/public/images/1725604028185-PATROL-icon-1.png?width=75&height=75&resize=contain,False,['nature & outdoors'],493,True,0,True,32197048,False,,,,#BE1F24,en,493,27,True,2bdc0a61-fe3c-4628-aa6d-c612041f7719,1670921093,1751961206
Postcard from Monadnock,https://www.jarviscoffin.com/,"Musings on life, love, food (and the weather) from rural New Hampshire.",https://supapjpiqdfzuaordcdx.supabase.co/storage/v1/render/image/public/images/1697023522709-Stamp_Full%20Color.svg?width=75&height=75&resize=contain,False,['nature & outdoors'],218,True,0,True,30926123,False,,,,#e0592a,en,218,7,True,ed2846af-f652-4e55-a950-933aa3f08e06,1697023523,1752602855
UK Osprey News,https://www.ospreys.net/,"A newsletter updating you on UK ospreys, and other raptor news",https://supapjpiqdfzuaordcdx.supabase.co/storage/v1/render/image/public/images/1684155649367-new-osprey-news.png?width=75&height=75&resize=contain,False,['nature & outdoors'],196,True,,False,23299936,False,,,,#669c35,en,196,3,True,bf826008-0f6e-4d76-b466-2fd8abecbee1,1667237931,1741084603
Dream Girl Sport Fishing,https://dreamgirlfishing.com/,"Located on Ocracoke Island, NC. We are the #1 choice for NC Fishing Charters. We offer trips ranging from calm water evening trips to big game fishing in the Gulf Stream. Book with us online today!",https://supapjpiqdfzuaordcdx.supabase.co/storage/v1/render/image/public/images/1679328421018-icons8-clown-fish-96.png?width=75&height=75&resize=contain,False,['nature & outdoors'],159,True,,False,27193294,False,,,,#475dff,en,159,4,True,103b92ef-4b2d-4ac7-82d8-c231653889c7,1679328422,1732153512
Parkway Colors,https://www.parkwaycolors.com/,"When the seasons change, we tell you where the color is on the Blue Ridge Parkway, simple as that. Subscribe to our weekly newsletter.",https://supapjpiqdfzuaordcdx.supabase.co/storage/v1/render/image/public/images/1728151077812-PC%20attempt%20(5).png?width=75&height=75&resize=contain,False,['nature & outdoors'],137,True,,False,228110152,False,,,,#8d053b,en,137,1,True,7cdc7750-ecbe-4239-a0de-9de5998084ca,1720883622,1751476317
OF BEASTS AND MEN,https://of-beasts-and-men.ghost.io/,We're not so different.,https://supapjpiqdfzuaordcdx.supabase.co/storage/v1/render/image/public/images/1716385505249-Screenshot-2024-02-28-at-14.18.39-3.png?width=75&height=75&resize=contain,False,['nature & outdoors'],21,True,8,True,303570389,False,,,,#0ffc8a,en,104.2,2,True,c0fddde9-b09a-4b1c-a911-8417e4062394,1716228354,1716228085
Landship Galactica,https://www.landshipgalactica.com/,Boldly Exploring Where No Van Has Gone Before.,https://supapjpiqdfzuaordcdx.supabase.co/storage/v1/render/image/public/images/1681429811062-Screenshot_20230413-164815.png?width=75&height=75&resize=contain,False,['nature & outdoors'],9,True,8,True,184057735,False,,,,#ef9025,en,92.2,0,True,5c57af93-0aab-4b87-95fd-4aadaec77cfc,1681429811,1686708587
Adam's Adventure & Photography Blog,https://blog.adamthompsonphoto.com/,"Adam Thompson, a Colorado fine-art photographer, shares hiking trip reports, photography adventures, and expert outdoor & camera tutorials.",https://supapjpiqdfzuaordcdx.supabase.co/storage/v1/render/image/public/images/1748268783809-favicon.png?width=75&height=75&resize=contain,False,['nature & outdoors'],89,True,,False,9999911,False,,,,#169dfe,en,89,3,True,66a5b8de-5295-46eb-8f21-589e8ee0fa93,1748114365,1749063958
Homestead Horizon,https://homesteadhorizon.com/,Your trusted hub for homesteading and sustainable living in Europe.,https://supapjpiqdfzuaordcdx.supabase.co/storage/v1/render/image/public/images/1750526312561-HomesteadHorizon_06-Icon-Only.png?width=75&height=75&resize=contain,False,['nature & outdoors'],50,True,,False,10499947,False,,,,#38571a,en,50,10,True,2f1082b8-16c7-4265-b3e2-32ccacc7ca86,1750526313,1752156332
Keith and Lindsey,https://keithandlindsey.com/,"Live your most adventurous life! For us, this means focusing on travel and outdoor activities, such as hiking, mountain biking, and alpine skiing.",https://supapjpiqdfzuaordcdx.supabase.co/storage/v1/render/image/public/images/1671413241117-PublicationCover-1.jpg?width=75&height=75&resize=contain,False,['nature & outdoors'],36,True,,False,5604555,False,,,,#2563eb,en,36,3,False,e3e1ac21-e456-4a74-bbaf-9ae1ab7fab4f,1671413244,1749775435
Zeytinburnu Tıbbi Bitkiler Bahçesi,https://www.ztbb.org/,Türkiye’nin ilk tıbbi bitki bahçesi. 14 dönümlük alanda kurulmuş bahçemizde 750'yi aşkın tıbbi bitki bulunmaktadır.,https://supapjpiqdfzuaordcdx.supabase.co/storage/v1/render/image/public/images/1742164924887-ztbb_400x400.png?width=75&height=75&resize=contain,False,['nature & outdoors'],30,True,,False,10922242,False,,,,#4e7a27,tr,30,0,True,bad51a21-059b-41a1-849b-94c948f6dee3,1742164925,1741095960
GreuLaDeal.ro,https://www.greuladeal.ro/,The best hiking trails in Romania,https://supapjpiqdfzuaordcdx.supabase.co/storage/v1/render/image/public/images/1699979462419-logo-greuladeal-300.png?width=75&height=75&resize=contain,False,['nature & outdoors'],20,True,0,True,3627541,False,,,,#f3a90b,ro,20,0,False,190d33c2-2215-4e51-9eaf-0bad4c629849,1699979464,1744480622
The Wild,https://thewild.news/,Your weekly briefing on the environmental stories that matter.,https://supapjpiqdfzuaordcdx.supabase.co/storage/v1/render/image/public/images/1746566383636-TheWildSocialLogo.jpg?width=75&height=75&resize=contain,False,['nature & outdoors'],20,True,0,True,9999980,False,,,,#5aa062,en,20,9,True,453159f5-b8a9-400e-b479-467030d2022f,1746242813,1748008827
Biking West,https://www.bikingwest.com/,Community Driven Biking Inspiration. Join and Share Your Story.,https://supapjpiqdfzuaordcdx.supabase.co/storage/v1/render/image/public/images/1731199596813-biking-west-logo-.png?width=75&height=75&resize=contain,False,['nature & outdoors'],17,True,,False,10499982,False,,,,#209d71,en,17,0,True,9d8deb25-b49b-4530-9dcb-81eafc33bb47,1731199598,1731199290
Johnsenblog.com,https://johnsenblog.com/,"Noen av mine historier, mine tanker, ideer og masse vas ;-)",https://supapjpiqdfzuaordcdx.supabase.co/storage/v1/render/image/public/images/1743162587184-2025-Logo-Blank-Liten-fil-JOHNSEN.png?width=75&height=75&resize=contain,False,['nature & outdoors'],12,True,,False,10499987,False,,,,#0b5200,no,12,0,True,7f618654-76e0-41b3-9d60-5b33a4e837e0,1743162588,1743097500
"Nerv Mushrooms, Mycology, Mycelium",https://www.nerv.earth/,A Community Branching Out From the Mycellium Network,https://supapjpiqdfzuaordcdx.supabase.co/storage/v1/render/image/public/images/1729699052336-Nerv_Media_logo-1.jpeg?width=75&height=75&resize=contain,False,['nature & outdoors'],12,True,0,True,375585455,False,,,,#ff2d81,en,12,0,True,2d4af780-5581-4618-aed5-747cd02e9fe4,1729699054,1727823709
Outventour,https://www.outventour.com.au/,"At its core, Outventour embodies a sense of adventure and profound respect for nature, coupled with a desire to cultivate a stronger bond with the environment.",https://supapjpiqdfzuaordcdx.supabase.co/storage/v1/render/image/public/images/1677992480483-1677991747104-outventour.png?width=75&height=75&resize=contain,False,['nature & outdoors'],6,True,0,True,9999994,False,,,,#2ba81a,en,6,1,True,c823fcb9-769a-45d2-9f03-6fec6344b047,1677991748,1692867695
Hiking Ohio,https://hiking-ohio.com/,Experience the Beauty of Ohio's Majestic Hiking Trails!,https://supapjpiqdfzuaordcdx.supabase.co/storage/v1/render/image/public/images/1721491047367-1716994969906-openart-image_t_4gq584_1716994934380_raw.png?width=75&height=75&resize=contain,False,['nature & outdoors'],6,True,,False,10499993,False,,,,#005715,en,6,0,False,8f1a2801-1cef-4c00-b233-217538a8b8d0,1721491048,1721186734
Gardens by Chazona Baum,https://gardens.chazonabaum.com/,"Tips and guidance for growing fresh fruits and vegetables in Hampton Roads, VA.",https://supapjpiqdfzuaordcdx.supabase.co/storage/v1/render/image/public/images/1741285114572-seedlings-in-pots.jpg?width=75&height=75&resize=contain,False,['nature & outdoors'],5,True,,False,9999995,False,,,,#047857,en,5,0,True,b6eb67ce-777f-4c65-b76b-1e8aa026277e,1741240711,1741217664
Dallas Rambler,https://www.dallasrambler.com/,"Exploring Dallas, one step at a time.",https://supapjpiqdfzuaordcdx.supabase.co/storage/v1/render/image/public/images/1713986231532-dallas-rambler-square.png?width=75&height=75&resize=contain,False,['nature & outdoors'],3,True,0,True,10499996,False,,,,#ffd01b,en,3,0,True,395c1792-797c-41e5-b0eb-ae39d0768a80,1713986233,1713683077
Curious Planet,https://curiousplanet.co/,"Uncover secrets of our planet! Discover breaking news, astonishing facts & heartwarming stories about our environment & natural wonders.",https://supapjpiqdfzuaordcdx.supabase.co/storage/v1/render/image/public/images/1716852317874-Artboard---1.png?width=75&height=75&resize=contain,False,['nature & outdoors'],3,True,,False,10499996,False,,,,#000000,en,3,0,True,06204251-e73d-4a81-9025-9bbc180d6f93,1716852319,1716829221
Heimatvogel,https://heimatvogel.de/,Deine Anlaufstelle für Vogelbeobachtung,https://supapjpiqdfzuaordcdx.supabase.co/storage/v1/render/image/public/images/1741447596525-Heimatvogel-Retraced-Gradient.png?width=75&height=75&resize=contain,False,['nature & outdoors'],3,True,0,True,117376228,False,,,,#e6903a,de,3,0,True,89bdae40-63af-4c9a-a261-fc1925cf2a1a,1741447598,1737906350
Garden Fables,https://gardenfables.com/,Everything Plants and Greens,https://supapjpiqdfzuaordcdx.supabase.co/storage/v1/render/image/public/images/1700693121860-gardenfables-favicon-01.png?width=75&height=75&resize=contain,False,['nature & outdoors'],3,True,,False,314422508,False,,,,#6ab04c,en,3,1,False,402ee477-9841-4491-81ad-dff4b402b00e,1700693118,1730450714
Flying With Sam: My Path to Pilot Certification,https://flight.zarn.cloud/,Explore the world of learning aviation,https://supapjpiqdfzuaordcdx.supabase.co/storage/v1/render/image/public/images/1724431614125-icon.png?width=75&height=75&resize=contain,False,['nature & outdoors'],1,True,0,True,9999999,False,,,,#428159,en,1,1,False,f0ed0a69-880b-4e02-8029-25ecbeec7b58,1720703276,1726263716
Yahoki - Chroniques des marches sauvages,https://www.yahoki.fr/,Articles in French to talk about my adventures on my hikes,https://supapjpiqdfzuaordcdx.supabase.co/storage/v1/render/image/public/images/1747396074903-blog-header2%20(1).png?width=75&height=75&resize=contain,False,['nature & outdoors'],1,True,,False,10499998,False,,,,#000000,fr,1,0,True,5bf40e13-ff4d-4d0e-ad29-77ca6036fdae,1747396076,1746776073
Camping & Outdoor Information,https://www.genuinewild.com/,"Armed with the right preparation and gear, you are ready to conquer the great outdoors. Embrace the adventure, connect with nature, and make the most of your camping experience!",https://supapjpiqdfzuaordcdx.supabase.co/storage/v1/render/image/public/images/1752293034431-outdoors%20.png?width=75&height=75&resize=contain,False,['nature & outdoors'],1,True,0,True,162180058,False,,,,#bba8ed,en,1,0,True,e2a251a2-3f2b-4fc6-b295-3f03fae4beab,1728791958,1752267600
Alex Roddie,https://www.alexroddie.com/,"Stories and photographs from the mountains. Nature, the great outdoors, backpacking, climbing, photography, and more.",https://supapjpiqdfzuaordcdx.supabase.co/storage/v1/render/image/public/images/1669217770038-Website_ident.jpg?width=75&height=75&resize=contain,False,['nature & outdoors'],0,False,,False,2139304,False,,,,#000000,en,0,0,True,569465a9-a402-4931-8d17-5c53a89a344b,1669217773,1745953236
The Bijoors Blog,https://bijoor.me/,"Explorations of my cycling, trekking, and other adventure travelogues. Also updates of technology led rural development initiatives in India in the beautiful Konkan region of Maharashtra",https://supapjpiqdfzuaordcdx.supabase.co/storage/v1/render/image/public/images/1682506254557-bijoor.png?width=75&height=75&resize=contain,False,['nature & outdoors'],0,False,,False,3625314,False,,,,#15171a,en,0,0,True,ed1a6e2e-90bb-49b6-8d24-85f637503b2d,1682506255,1727704108
Spreadhapiness.com,https://www.spreadhapiness.com/,"Animals, List of Animals & What do capybaras eat, animals that start with , a-z animals",https://supapjpiqdfzuaordcdx.supabase.co/storage/v1/render/image/public/images/1735747787583-cropped-logo-light-1.webp?width=75&height=75&resize=contain,False,['nature & outdoors'],0,False,,False,5546988,False,,,,#FF1A75,en,0,0,True,a9997374-5781-444f-9794-d290c2a8a5bc,1735747789,1735462678
Байкальская земля,https://volkov.irkutsk.ru/,Официальный сайт Сергея Волкова,https://supapjpiqdfzuaordcdx.supabase.co/storage/v1/render/image/public/images/1696571087998-favicon.ico?width=75&height=75&resize=contain,False,['nature & outdoors'],0,False,,False,9856204,False,,,,#15171A,ru,0,0,False,352cc4ab-d1b1-455c-a943-1327e20db91f,1696571088,1752427860
Wendy's Wilds & Wags,https://www.wildsnwags.com/,Explore the worlds of wild and domestic animals through photography.,https://supapjpiqdfzuaordcdx.supabase.co/storage/v1/render/image/public/images/1712148215625-2R5A0017.JPG?width=75&height=75&resize=contain,False,['nature & outdoors'],0,False,,False,10000000,False,,,,#496646,en,0,0,True,e48cd24b-2c5c-4696-94a4-93a287419794,1712148216,1739841700
Happy Outside,https://happyoutside.xyz/,Ari & Greg's blog about the outdoors!,https://supapjpiqdfzuaordcdx.supabase.co/storage/v1/render/image/public/images/1712112489957-logo-no-text.png?width=75&height=75&resize=contain,False,['nature & outdoors'],0,False,,False,10000000,False,,,,#15171A,en,0,0,True,ae6fa2e2-00c3-4e1b-97e0-f790a60f14d0,1712112492,1709189723
Resolve Reptiles,https://resolvereptiles.com/,Adding Science and Technology to the Reptile Community,https://supapjpiqdfzuaordcdx.supabase.co/storage/v1/render/image/public/images/1702266964533-ResolveReptiles_sq_icon.png?width=75&height=75&resize=contain,False,['nature & outdoors'],0,False,,False,10000000,False,,,,#ff3434,en,0,0,True,21deed15-f079-4f94-8cb7-aa30c44c4a38,1700717498,1731019280
hatpaws,https://hatpaws.com/,Your Ultimate Pet care guide,https://supapjpiqdfzuaordcdx.supabase.co/storage/v1/render/image/public/images/1725633261021-New-Project--2--1.png?width=75&height=75&resize=contain,False,['nature & outdoors'],0,False,,False,10500000,False,,,,#5b380f,en,0,0,True,f2ee84f9-2094-44a1-8417-e31da054a510,1725633263,1725387702
LittleRobotGarden,https://www.littlerobotgarden.com/,"Grow your dream garden with LittleRobotGarden, your digital guide to expert gardening tips, plant guides, and seasonal inspiration, making green thumbs of everyone.",https://supapjpiqdfzuaordcdx.supabase.co/storage/v1/render/image/public/images/1742812997520-LRG.png?width=75&height=75&resize=contain,False,['nature & outdoors'],0,False,,False,10500000,False,,,,#7ed957,en,0,0,True,9c816ee5-d239-4e53-9f9f-d3c783ec5e64,1742812998,1742810554
The Weekend Aquarist,https://www.weekendaquarist.com/,"The latest happenings in the world of aquariums, from news, reviews and interviews.",https://supapjpiqdfzuaordcdx.supabase.co/storage/v1/render/image/public/images/1733051110363-The-Weekend-Aquarist-logo-01.png?width=75&height=75&resize=contain,False,['nature & outdoors'],0,False,,False,10500000,False,,,,#19bbff,en,0,0,True,95bc38fb-37ce-46cb-b037-48d13f033880,1733051111,1733029234
Stories by DJ : Mediterranean elopements,https://storiesbydj.com/,"Your go-to blog for Mediterranean elopements, featuring articles on perfect locations, inspiring elopement stories, and the best guides and tips to make your elopement truly special.",https://supapjpiqdfzuaordcdx.supabase.co/storage/v1/render/image/public/images/1717520581518-Square-Wide.jpg?width=75&height=75&resize=contain,False,['nature & outdoors'],0,False,,False,10500000,False,,,,#EB9944,en,0,0,False,8b815957-8ad2-4dad-b203-a6fbfc853a06,1717520584,1716371353
Entangled Worlds,https://entangled-worlds.ghost.io/,Radically Imagining Our More-than-human Futures,https://supapjpiqdfzuaordcdx.supabase.co/storage/v1/render/image/public/images/1739159780924-Substack-Cover-1024x1024.png?width=75&height=75&resize=contain,False,['nature & outdoors'],0,False,,False,10500000,False,,,,#000000,en,0,0,True,749a2c01-a601-4fd3-9525-682c7036b4ea,1739159781,1739023822
Southwest Hikes,https://www.southwesthikes.com/,From alpine to desert this is your resource for gear and hiking in the beautiful American Southwest!,https://supapjpiqdfzuaordcdx.supabase.co/storage/v1/render/image/public/images/1731880503744-southwest-hikes.jpg?width=75&height=75&resize=contain,False,['nature & outdoors'],0,False,,False,10500000,False,,,,#d6bdd5,en,0,0,True,35507643-cda5-4de0-979d-1d4704c0215a,1731880505,1731877352
The Space Between,https://www.itisthespacebetween.com/,"Helping families find beauty out and bring beauty in. A newsletter and blog where travel, home, and the beautiful spaces between collide.",https://supapjpiqdfzuaordcdx.supabase.co/storage/v1/render/image/public/images/1742921134316-SPACE.png?width=75&height=75&resize=contain,False,['nature & outdoors'],0,False,,False,10500000,False,,,,#fc5151,en,0,0,True,0619e90a-ff2d-42be-83b0-354bb0716d07,1742921135,1742587642
EcoFriendly West,https://ecofriendlywest.ca/,Informing and encouraging initiatives that support Western Canada's natural environment,https://supapjpiqdfzuaordcdx.supabase.co/storage/v1/render/image/public/images/1744758024157-logo256.png?width=75&height=75&resize=contain,False,['nature & outdoors'],0,False,,False,11453862,False,,,,#64b576,en,0,0,True,ecb8a833-f372-41e5-9960-2fac1aa2bade,1744758025,1744722539
Membrive Fishing,https://membrive.com/,"Blog de pesca con señuelos artificiales. Spinning, rockfishing, ajing y mucho más.",https://supapjpiqdfzuaordcdx.supabase.co/storage/v1/render/image/public/images/1740639545722-favicon.ico?width=75&height=75&resize=contain,False,['nature & outdoors'],0,False,,False,11500000,False,,,,#000000,es,0,0,True,89e9d83e-056d-4f9e-86bc-7ea595446561,1740639547,1740518785
Stuff's COOL,https://stuffs.cool/,"Explore a world of meaningful ideas, sustainable living, and creative inspiration—crafted for those who care deeply about life, art, and the Earth.",https://supapjpiqdfzuaordcdx.supabase.co/storage/v1/render/image/public/images/1749314336366-LogoMakr-9L9mIc-1.png?width=75&height=75&resize=contain,False,['nature & outdoors'],0,False,,False,15566016,False,,,,#FF1A75,en,0,0,True,518b413f-d6ff-426e-8368-00e2510bf098,1749314338,1749221674
Lost Woods,https://www.lostwoodscomic.com/,Funny animals. Unspoiled woods. The daily comic strip we all need now.,https://supapjpiqdfzuaordcdx.supabase.co/storage/v1/render/image/public/images/1744664699135-IMG_5906.png?width=75&height=75&resize=contain,False,['nature & outdoors'],0,False,,False,30578478,False,,,,#bad03e,en,0,0,True,4880b0e0-25bf-4a93-bd1b-b0e49a26d143,1742819528,1752663629
Due West Anglers,https://www.duewestanglers.com/,Writing on | Fly Fishing + Conservation + Science,https://supapjpiqdfzuaordcdx.supabase.co/storage/v1/render/image/public/images/1703195205978-arrow_sticker--1-.png?width=75&height=75&resize=contain,False,['nature & outdoors'],0,False,,False,40147817,False,,,,#000000,en,0,0,True,b09c4359-c421-4729-9f9e-9b589ffd8556,1703195207,1752494120
FAV Reviews,https://www.favreviews.com/,FAMILY FRIENDLY FAVS. We Feature Family Friendly Products (Our Favs) for Outdoorsy People.,https://supapjpiqdfzuaordcdx.supabase.co/storage/v1/render/image/public/images/1693340874575-FAV-Reviews-FAVICON-3D.png?width=75&height=75&resize=contain,False,['nature & outdoors'],0,False,,False,66281754,False,,,,#43bccd,en,0,0,True,3d7a0d70-ade1-487b-a149-398768bfdcbe,1693340875,1743627089
The Krensh,https://krensh.com/,"Get latest update about Agriculture, Business,finance,Fertilizer, Organic Farming, Home Gardening and Crops.",https://supapjpiqdfzuaordcdx.supabase.co/storage/v1/render/image/public/images/1711372575616-IMG-20240310-WA0001.jpg?width=75&height=75&resize=contain,False,['nature & outdoors'],0,False,,False,100101112,False,,,,#684141,en,0,0,False,4384ba03-f934-4d3f-8406-89848a3da203,1660156906,1747632655
Wild Westish.,https://www.wildwestish.com/,"What's so great about the outdoors—stories about living in Central Oregon, fly fishing, dogs, trail running, art, and pinhole photography.",https://supapjpiqdfzuaordcdx.supabase.co/storage/v1/render/image/public/images/1745846115859-w_dark.png?width=75&height=75&resize=contain,False,['nature & outdoors'],0,False,,False,101775888,False,,,,#f15d36,en,0,0,True,b0ea1277-6882-4ba5-b072-851ea8a9d770,1745846116,1745763642
Stravaiger,https://blog.timday.com/,"""...one who wanders about aimlessly."" Accounts from various backpacking trips.",https://supapjpiqdfzuaordcdx.supabase.co/storage/v1/render/image/public/images/1699301472010-IMG_6729-reduced.JPG?width=75&height=75&resize=contain,False,['nature & outdoors'],0,False,,False,116108642,False,,,,#2719ff,en,0,0,False,36008f4e-5b08-4040-88f6-9635c673467a,1699301473,1726068289
Ekoziele.pl,https://ekoziele.pl/,"Ekoziele.pl to kompleksowy portal poświęcony ekologii, zielarstwu oraz zrównoważonemu stylowi życia. Nasza misja jest prosta - inspirować i edukować w zakresie świadomego współistnienia z naturą.",https://supapjpiqdfzuaordcdx.supabase.co/storage/v1/render/image/public/images/1746527220151-ekoziele.pl-blog-na-temat-ekologii-i-zielarstwa-1.png?width=75&height=75&resize=contain,False,['nature & outdoors'],0,False,,False,121259418,False,,,,#FF1A75,pl,0,0,True,2e07a7e9-dedb-4879-b2a9-f5354bf641fd,1746527221,1746526934
Velvet Cloud Cattery,https://velvetcloud.co.uk/,"Welcome to Velvet Cloud, the epitome of love and elegance",https://supapjpiqdfzuaordcdx.supabase.co/storage/v1/render/image/public/images/1700152488897-black.png?width=75&height=75&resize=contain,False,['nature & outdoors'],0,False,,False,173491111,False,,,,#b3b0b0,en,0,0,True,71a74a98-a6cd-4f80-ac22-6f0875944557,1700152490,1746104898
La crémerie,https://la-cremerie.blog/,"Récits d'aventures, topos et retours d'expériences alpines!",https://supapjpiqdfzuaordcdx.supabase.co/storage/v1/render/image/public/images/1697879165629-Logo_noir.webp?width=75&height=75&resize=contain,False,['nature & outdoors'],0,False,,False,217926452,False,,,,#21aa39,fr,0,0,True,4b58cc64-f48e-4c6e-a150-caa944a0909d,1697879167,1744097580
Current Flow State,https://current-flow-state.ghost.io/,Make fly-fishing a bigger part of your life.,https://supapjpiqdfzuaordcdx.supabase.co/storage/v1/render/image/public/images/1739251106932-cfs_glyph.png?width=75&height=75&resize=contain,False,['nature & outdoors'],0,False,,False,219124958,False,,,,#52c989,en,0,0,True,7b7dae7f-19f7-43b6-9799-fca91a85fafb,1739250882,1743429644
Carnet de montagne,https://carnet-de-montagne.com/,Récits d'aventures en montagne,https://supapjpiqdfzuaordcdx.supabase.co/storage/v1/render/image/public/images/1730193213551-logo-seul.svg?width=75&height=75&resize=contain,False,['nature & outdoors'],0,True,0,True,285317929,False,,,,#ffffff,fr,0,0,False,d490c9a8-2f99-4b52-918b-a7ca10359fe5,1730193216,1727002521
