Title,URL,Description,Publication Icon,Not Safe For Work,Categories,Member Count,Show Member Count,Monthly Recurring Revenue (MRR),Show MRR,Ghost Rank,Featured,Feature Image,Text Color,Background Color,Accent Color,Language,MRR Members Rank,MRR Members Diff Rank,Show Iframe,Object ID,Created At,Updated At
Belief Hole Podcast,https://expansion.beliefhole.com/,"Official members-only site for the paranormal podcast ""Belief Hole"" - three brothers covering the strangest stories, theories, and lore permeating our weird wonderful world.",https://supapjpiqdfzuaordcdx.supabase.co/storage/v1/render/image/public/images/1667614328723-Belief-Hole-Paranormal-Podcast-Logo-500--compressed.png?width=75&height=75&resize=contain,False,['podcasts'],3386,True,11K,True,6182939,False,,,,#eb041c,en,115426.8,10,True,b54bf245-1823-46ec-a069-f4bbd0ae2bf0,1658238539,1741579755
"Give 'Em Hell, Brigham",https://giveemhellbrigham.com/,"A freemium podcast, newsletter, & Discord community for the in depth, off brand, BYU fan",https://supapjpiqdfzuaordcdx.supabase.co/storage/v1/render/image/public/images/1689878579775-square_png_logo.png?width=75&height=75&resize=contain,False,['podcasts'],1177,True,,False,523792,False,,,,#0062b8,en,1177,3,False,ad2f7c3d-695f-44bf-803f-c99f5b3a9e18,1689878580,1741700910
overflo.,https://www.overflo.co/,overflo is a multimedia learning and development platform for mystics supporting wholeness through sacred Self discovery.,https://supapjpiqdfzuaordcdx.supabase.co/storage/v1/render/image/public/images/1704300977804-favicon-overflo-1.png?width=75&height=75&resize=contain,False,['podcasts'],832,True,,False,386380309,False,,,,#627246,en,832,0,True,af9eebbb-f9ce-4353-9b0d-1962a2386681,1704300978,1702149259
A&T Media,https://www.at-media-group.com/,"We specialise in the creation of audio content, in the form of podcasts. A&T Media generates English-language podcasts that are geared towards the Middle East region.",https://supapjpiqdfzuaordcdx.supabase.co/storage/v1/render/image/public/images/1680567067738-What%20I%20Did%20Next.png?width=75&height=75&resize=contain,False,['podcasts'],360,True,,False,1972138,False,,,,#FF1A75,en,360,18,True,e4899028-8275-449c-acb3-d8372128db6d,1678099691,1741680009
Amaeya Media,https://amaeya.media/,"We empower conversations that help humanise our world. Over the last 4 years, over 300,000 people have listened through 13,500 minutes of powerful audio conversations and stories on our Network.",https://supapjpiqdfzuaordcdx.supabase.co/storage/v1/render/image/public/images/1660222037000-Open-quote---orange.png?width=75&height=75&resize=contain,False,['podcasts'],214,True,,False,1187913,False,,,,#4D0E4F,en,214,0,True,3edd15ce-730d-463e-a93d-9181d9b78e48,1660131425,1741671037
Let the Verse Flow,https://www.lettheverseflow.com/,"A mashup of stories + poetry + music that uses creativity as a catalyst for finding more peace, positivity, and personal fulfillment.",https://supapjpiqdfzuaordcdx.supabase.co/storage/v1/render/image/public/images/1692984058278-Untitled-design--10-.png?width=75&height=75&resize=contain,False,['podcasts'],195,True,,False,3080138,False,,,,#662D66,en,195,2,True,bb958d4e-af95-44dd-bbec-513f98bb6f5d,1692984059,1741789040
Business Games,https://www.business-games.ai/,"Understand Humans, Make Better Decisions: Business, Information, Wars",https://supapjpiqdfzuaordcdx.supabase.co/storage/v1/render/image/public/images/1699859829611-Asset-3.png?width=75&height=75&resize=contain,False,['podcasts'],118,True,,False,19812443,False,,,,#00B6ED,en,118,3,True,adb20785-d9c3-4ad1-8a4e-ec0051d57f1f,1670991842,1697337545
There Might Be Cupcakes Podcast,https://www.theremightbecupcakes.com/,"Horror, true crime, paranormal, disability through a literary lens, whimsy, writing in progress. Established 2017.",https://supapjpiqdfzuaordcdx.supabase.co/storage/v1/render/image/public/images/1738868840431-IMG_4049.jpeg?width=75&height=75&resize=contain,False,['podcasts'],97,True,,False,2267757,False,,,,#FF1A75,en,97,0,True,1e1ff314-25c8-4dfd-a156-68c88308604f,1738868841,1737645019
Frank & Sense,https://www.frankandsense.io/,"A weekly podcast and newsletter from Frank Cervarich. It's casual and fun. And maybe a little weird, but in a good way. Independently published, entirely supported by people like you.",https://supapjpiqdfzuaordcdx.supabase.co/storage/v1/render/image/public/images/1710381945330-Frank---Sense-Small.jpg?width=75&height=75&resize=contain,False,['podcasts'],36,True,,False,18475918,False,,,,#2c70ab,en,36,1,True,07e9d223-5ccb-4ea3-9278-330129b80745,1709826437,1723826233
Best of the Worst,https://villains.lol/,The most ridiculous villains in comic book history.,https://supapjpiqdfzuaordcdx.supabase.co/storage/v1/render/image/public/images/1679576839225-botw3-site-favicon.png?width=75&height=75&resize=contain,False,['podcasts'],8,True,0,True,4148086,False,,,,#86413a,en,8,2,True,61a26ea1-5869-4b7f-8c6c-c459adcc8797,1677765034,1682578840
Filter Feeders Podcast,https://filterfeeders.fyi/,Feed your Curiosity! Filter out the Noise! Fuel your mind!,https://supapjpiqdfzuaordcdx.supabase.co/storage/v1/render/image/public/images/1737466804051-96ae7d4e-04eb-408a-892d-2565e92c8560.png?width=75&height=75&resize=contain,False,['podcasts'],7,True,0,True,158263687,False,,,,#B19869,en,7,0,False,6239705a-e55b-40b2-a857-ee0ea58636c7,1720191308,1741860636
Blerdimension Media,https://blerdimension.media/,"Black nerds talking tech, anime, comic books, gaming and trash",https://supapjpiqdfzuaordcdx.supabase.co/storage/v1/render/image/public/images/1739935788355-logo.png?width=75&height=75&resize=contain,False,['podcasts'],6,True,,False,10499993,False,,,,#5599ff,en,6,0,False,ba1b79af-a1fc-41ec-bee4-0f6f73628d99,1739935789,1738864577
EdTalks,https://edtalks.ghost.io/,Opinion and many more things to explore,https://supapjpiqdfzuaordcdx.supabase.co/storage/v1/render/image/public/images/1715928591827-logo-c360.png?width=75&height=75&resize=contain,False,['podcasts'],1,True,,False,10499998,False,,,,#3e011a,en,1,0,True,5347284b-4cbd-46f8-8fa9-83148f5d8df7,1715928593,1715928237
Secular Buddhism Podcast,https://secularbuddhism.com/,Combining Buddhist Philosophy + Psychology + Neuroscience. Learn how to incorporate mindfulness into your everyday life.,https://supapjpiqdfzuaordcdx.supabase.co/storage/v1/render/image/public/images/1691627916820-SB-Simple.png?width=75&height=75&resize=contain,False,['podcasts'],0,False,,False,986464,False,,,,#ff6200,en,0,0,True,1cd14e9c-02a6-4742-a64f-064e022e6f64,1691627917,1741626240
Darwin Gefällt Das,https://darwingefaelltdas.de/,Der History Podcast über die Epic Fails der Menschheitsgeschichte,https://supapjpiqdfzuaordcdx.supabase.co/storage/v1/render/image/public/images/1695131382752-favicon.ico?width=75&height=75&resize=contain,False,['podcasts'],0,False,,False,1083034,False,,,,#85bbc5,de,0,0,True,3ace9699-bd57-47e7-9419-0f3035aa43b4,1695131384,1739750400
Analyse Asia,https://www.analyse.asia/,"The Premiere Podcast dissecting the pulse of Business, Technology & Media in Asia",https://supapjpiqdfzuaordcdx.supabase.co/storage/v1/render/image/public/images/1695637612284-Square-logo.png?width=75&height=75&resize=contain,False,['podcasts'],0,False,,False,2370699,False,,,,#8c1aff,en,0,0,True,1603116d-90b4-4bb9-b2b0-48e27f102792,1671234500,1740955010
The Joe Walker Podcast,https://josephnoelwalker.com/,"Joe Walker hosts refreshingly in-depth conversations with founders, scientists, scholars, economists, and public intellectuals.",https://supapjpiqdfzuaordcdx.supabase.co/storage/v1/render/image/public/images/1705016112098-jsp-favicon.png?width=75&height=75&resize=contain,False,['podcasts'],0,False,,False,2686046,False,,,,#FF452C,en,0,0,True,2c3457b7-604f-4449-88f1-673e62adb77d,1705016113,1704952728
TRXL Podcast,https://www.trxl.co/,"TRXL is a podcast exploring the intersection of the AEC industry with cutting-edge technology, featuring expert insights, trends, and innovation shaping the future of the built environment.",https://supapjpiqdfzuaordcdx.supabase.co/storage/v1/render/image/public/images/1738599558061-Favicon-black-60x60.png?width=75&height=75&resize=contain,False,['podcasts'],0,False,,False,3628506,False,,,,#ff1a75,en,0,0,True,4e885c59-0371-4a9d-88b3-9ab15746b780,1738599558,1738432835
Keith Yap,https://www.ykeith.com/,Insights from Singapore,https://supapjpiqdfzuaordcdx.supabase.co/storage/v1/render/image/public/images/1741358820383-Logo-maker-project-2.png?width=75&height=75&resize=contain,False,['podcasts'],0,False,,False,4413124,False,,,,#cc5500,en,0,0,True,fa3e8de4-0ff4-4034-9aa2-91c6beb9a623,1741358821,1741273265
Non-Monogamy Help,https://www.nonmonogamyhelp.com/,"An advice column and podcast for people in non-monogamous, polyamorous and open relationships.",https://supapjpiqdfzuaordcdx.supabase.co/storage/v1/render/image/public/images/1710343174186-Infinity400x400.png?width=75&height=75&resize=contain,False,['podcasts'],0,False,,False,6217046,False,,,,#42571f,en,0,0,True,2f7dc050-68ba-4eef-8163-9baad6092686,1710343176,1741609854
Founders Room Podcast,https://www.foundersroom.co/,A weekly podcast featuring in-depth discussions with founders and leaders of the world's most innovative companies.,https://supapjpiqdfzuaordcdx.supabase.co/storage/v1/render/image/public/images/1732723342594-foundersroom%20logo.png?width=75&height=75&resize=contain,False,['podcasts'],0,False,,False,10000000,False,,,,#7bc143,en,0,0,True,84ae948b-7ad4-4103-9091-99bf28a65915,1732723344,1699464544
Unstuck,https://unstuckpodcast.ghost.io/,"Welcome to Unstuck, a podcast to help you find your purpose and lead a meaningful life. Hosted by Ethan Grant, Unstuck is your weekly guide to personal growth, self-discovery, and overcoming ruts.",https://supapjpiqdfzuaordcdx.supabase.co/storage/v1/render/image/public/images/1725473752017-Unstuck-Ghost-Website-Banner--13-.jpg?width=75&height=75&resize=contain,False,['podcasts'],0,False,,False,10500000,False,,,,#ab7511,en,0,0,True,be6bd881-a1a4-47b5-b6b5-d7fd0ae37339,1725473753,1725469243
Eco Punks,https://ecopunks.live/,Understanding Ecosystems with Attitude,https://supapjpiqdfzuaordcdx.supabase.co/storage/v1/render/image/public/images/1705625814288-punk_goat.ico?width=75&height=75&resize=contain,False,['podcasts'],0,False,,False,10500000,False,,,,#990000,en,0,0,True,82e65a5e-e646-488f-aa8e-8ad893921792,1705625815,1705595260
Hypergallant,https://hypergallant.com/,Hypergallant Productions currently producing TRASH PLANET the action-comedy podcast that beats ass and eats trash.,https://supapjpiqdfzuaordcdx.supabase.co/storage/v1/render/image/public/images/1734639711809-TPlanet-favicon---green-on-black.PNG?width=75&height=75&resize=contain,False,['podcasts'],0,False,,False,11500000,False,,,,#C6EE00,en,0,0,False,c0cb8df0-bac2-4aaa-b66c-46a74f976404,1734639713,1734467931
The Observing I,https://theobservingi.com/,"Award winning podcast on psychology, philosophy, and the human experience. New episode every Sunday.",https://supapjpiqdfzuaordcdx.supabase.co/storage/v1/render/image/public/images/1730250353924-The%20Observing%20I%20Square%20Logo.jpeg?width=75&height=75&resize=contain,False,['podcasts'],0,False,,False,58496434,False,,,,#BA5E63,en,0,0,True,19bb28c2-b3f9-40ea-b0d5-8a370420e7fa,1730250356,1730249631
Mad Pony Show,https://www.madponyshow.com/,A podcast about nothing and everything.,https://supapjpiqdfzuaordcdx.supabase.co/storage/v1/render/image/public/images/1678145339970-Mad%20Pony%20Show%20-%20Artwork_Cover%20Art.jpg?width=75&height=75&resize=contain,False,['podcasts'],0,False,,False,289081050,False,,,,#fe546f,en,0,0,True,ad4835d3-4ade-4a2d-be78-29066c12411b,1678145341,1677873688
