American Purpose,https://www.americanpurpose.com/,"An online magazine covering politics, culture, the arts, and the state of democracy.",https://supapjpiqdfzuaordcdx.supabase.co/storage/v1/render/image/public/images/americanpurpose.png?t=2022-07-19T12%3A40%3A28.877Z?width=75&height=75&resize=contain,False,['politics'],0,False,,False,1049527,False,,,,,en,0,0,True,80ba3845-4f3e-494c-80bc-ee596c58c7d8,1658238539,1656547200
Wisdom of Crowds,https://wisdomofcrowds.live/,"A discussion rather than a debate. An experiment, with ideas. By Shadi Hamid and Damir Marusic.",https://supapjpiqdfzuaordcdx.supabase.co/storage/v1/render/image/public/images/wisdomofcrowds.png?t=2022-07-19T13%3A16%3A59.372Z?width=75&height=75&resize=contain,False,['politics'],0,False,,False,1948905,False,,,,,en,0,0,True,9b93a6aa-8a49-4d73-94f3-16dece1523af,1658238539,1649289600
The Signal,https://www.thesgnl.com/,Exploring urgent questions in current events from around the world.,https://supapjpiqdfzuaordcdx.supabase.co/storage/v1/render/image/public/images/thesngl.png?t=2022-07-19T13%3A14%3A11.401Z?width=75&height=75&resize=contain,False,['politics'],0,False,,False,2930039,False,,,,,en,0,0,True,6c82067d-8b13-4ef6-b423-58c5bcb1d3c9,1658238539,1641513600
Dissident MD,https://dissidentmd.com/,The intersection of medicine and politics,https://supapjpiqdfzuaordcdx.supabase.co/storage/v1/render/image/public/images/1713980577555-favicon-sq2.png?width=75&height=75&resize=contain,False,['politics'],0,False,,False,5531007,False,,,,#BB1F34,en,0,0,True,e4b6dfdb-20d6-4ba0-843a-72661142feeb,1713980579,1713976152
The Looking Glass,https://the-looking-glass-1.ghost.io/,"From investigative journalist Sarah Posner, making sense of our messianic, messy, manic moment",https://supapjpiqdfzuaordcdx.supabase.co/storage/v1/render/image/public/images/1717956476817-up.jpg?width=75&height=75&resize=contain,False,['politics'],0,False,,False,5531809,False,,,,#822976,en,0,0,True,757eb8e0-6bba-4fce-a631-daf691210712,1717956478,1726855260
Ines Schwerdtner,https://inesschwerdtner.de/,Website of the German Left Party’s Chairwoman.,https://supapjpiqdfzuaordcdx.supabase.co/storage/v1/render/image/public/images/1731941683104-favicon-3.png?width=75&height=75&resize=contain,False,['politics'],0,False,,False,6130835,False,,,,#ff0000,de,0,0,True,40af672e-2bca-4256-acc7-aaa94993bbbb,1731941684,1736525522
databearer,https://blog.databearer.de/,Perspektive durch Daten,https://supapjpiqdfzuaordcdx.supabase.co/storage/v1/render/image/public/images/1730892225316-Screenshot-2024-10-21-152742-modified.png?width=75&height=75&resize=contain,False,['politics'],0,False,,False,10000000,False,,,,#d9c176,de,0,0,True,f5d11d16-f474-4822-bb10-7dcbe6e3068c,1730892226,1731576051
ghostnet,https://ghostnet.space/,"A safe haven for anonymous voices and dissent. Join our community to share your thoughts and opinions freely, without fear of censorship or repercussions.",https://supapjpiqdfzuaordcdx.supabase.co/storage/v1/render/image/public/images/1721621441315-16.png?width=75&height=75&resize=contain,False,['politics'],0,False,,False,10000000,False,,,,#681f60,en,0,0,True,ea24b64a-d929-4c7e-a8f7-dd066f312f26,1721621442,1731354692
YIMBY Deutschland,https://yimby.jetzt/,Für eine liberale Stadtentwicklung,https://supapjpiqdfzuaordcdx.supabase.co/storage/v1/render/image/public/images/1728327421411-DarkIconKran.png?width=75&height=75&resize=contain,False,['politics'],0,False,,False,10000000,False,,,,#f05230,de,0,0,True,e193d86c-2140-46f3-8d7b-6ecf3ffe71c9,1728327423,1734018632
Our Civic Data,https://www.ourcivicdata.com/,A newsletter on American politics to create an informed and engaged electorate.,https://supapjpiqdfzuaordcdx.supabase.co/storage/v1/render/image/public/images/1731890136611-Color-logo-with-background.png?width=75&height=75&resize=contain,False,['politics'],0,False,,False,10000000,False,,,,#df6538,en,0,0,True,9fcd4450-b4f4-456e-a777-10743fd2a3f5,1722994500,1732302857
The Quiet Parts Out Loud,https://the-quiet-parts-out-loud.ghost.io/,"If the voice of the people is the voice of God, then the bleating of sheep is heavenly music.— Eric Hoffer",https://supapjpiqdfzuaordcdx.supabase.co/storage/v1/render/image/public/images/1705703589307-scarlet-red.png?width=75&height=75&resize=contain,False,['politics'],0,False,,False,10000000,False,,,,#f62f04,en,0,0,True,8caa52ca-b68e-40d4-8a93-ab426ba1ab07,1705703590,1705696819
Combat,https://combat.ghost.io/,Resistance Publication,https://supapjpiqdfzuaordcdx.supabase.co/storage/v1/render/image/public/images/1731383063475-Combat-logo-1.png?width=75&height=75&resize=contain,False,['politics'],0,False,,False,10000000,False,,,,#050505,en,0,0,True,85cd978b-b2c4-43b7-9a96-9ed589ece138,1731383064,1732735773
International Union of Scientists,https://www.iuscientists.org/,"Science, science policy, anti-militarism, and peace.",https://supapjpiqdfzuaordcdx.supabase.co/storage/v1/render/image/public/images/1714024599282-Network_new.png?width=75&height=75&resize=contain,False,['politics'],0,False,,False,10352760,False,,,,#9d5600,en,0,0,True,c7d25d86-ff74-4f7b-9933-4e4a8d68cb2f,1714024601,1734429715
Thotharis,https://www.thotharis.com/,"Thotharis offers in-depth analysis on diplomacy, international relations, and AI's role within global dynamics—bringing clarity to the shifts that shape our world.",https://supapjpiqdfzuaordcdx.supabase.co/storage/v1/render/image/public/images/1729258268523-Thotharis-gradient-for-ABOUT-page--.png?width=75&height=75&resize=contain,False,['politics'],0,False,,False,10500000,False,,,,#724432,en,0,0,True,a318f124-3154-4d4f-867b-9d0d100ebafd,1729258270,1734736131
Lepingville,https://www.lepingville.com/,Haunting the Left,https://supapjpiqdfzuaordcdx.supabase.co/storage/v1/render/image/public/images/1736553236010-LEPINGVILLE--5-.png?width=75&height=75&resize=contain,False,['politics'],0,False,,False,10500000,False,,,,#b22222,en,0,0,True,84abb836-a811-4672-b892-50d8c82a3681,1736553237,1736899914
Lê Thanh Trúc,https://www.lethanhtruc.com/,"Subversive, hard-hitting critiques of Western parasitic society. Surprising explorations of revolution. Flavours of computing, game design, unschooling.",https://supapjpiqdfzuaordcdx.supabase.co/storage/v1/render/image/public/images/1705917510833-IMG_3103-1.png?width=75&height=75&resize=contain,False,['politics'],0,False,,False,10500000,False,,,,#9fcd2a,en,0,0,True,768051f5-0987-47f5-8a42-a459b7f50da0,1705917512,1705880856
VorV Media,https://www.vorv.media/,Vicious cycle dependence? Or?! Are we inducing virtual cycles? These two economic-focused questions fuel everything we publish.,https://supapjpiqdfzuaordcdx.supabase.co/storage/v1/render/image/public/images/1730524072868-VorV_orginal_favicon.png?width=75&height=75&resize=contain,False,['politics'],0,False,,False,10500000,False,,,,#0042d3,en,0,0,True,6f655f95-71b0-48f9-8ad4-06619219627f,1730524074,1730484251
Publication for testing,https://publication-for-testing.ghost.io/,This test publication is intended to try out technical things and nothing more.,https://supapjpiqdfzuaordcdx.supabase.co/storage/v1/render/image/public/images/1715106222866-the-lloyds-chronicle-high-resolution-logo-transparent.png?width=75&height=75&resize=contain,False,['politics'],0,False,,False,10500000,False,,,,#1573a2,en,0,0,True,6d33dbee-3db1-44ea-8b51-062268a1a3ad,1715106224,1715104531
The Conscious Citizens,https://www.theconsciouscitizens.org/,A directory and bi-weekly newsletter to help you access the knowledge and resources needed to sustain a lifestyle towards collective liberation.,https://supapjpiqdfzuaordcdx.supabase.co/storage/v1/render/image/public/images/1730077938956-CC-LogoA-2.png?width=75&height=75&resize=contain,False,['politics'],0,False,,False,10500000,False,,,,#a9c01f,en,0,0,True,5739ecce-0406-4c52-9671-217ed8b4b619,1730077940,1730069128
Today News,https://todaynewszw.com/,News from around the world,https://supapjpiqdfzuaordcdx.supabase.co/storage/v1/render/image/public/images/1730227781762-Africa%20Think%20Tank%2020220322_210809.jpg?width=75&height=75&resize=contain,False,['politics'],0,False,,False,10500000,False,,,,#1e1963,en,0,0,True,1fe370a2-4849-4c99-b7da-0327710a8834,1730227784,1730139226
Digital 1776,https://the-bitcoin-primer.ghost.io/,The peaceful plan to take our country back. How you can participate and how you can potentially financially benefit in the process.,https://supapjpiqdfzuaordcdx.supabase.co/storage/v1/render/image/public/images/1708538798543-AdobeStock_flag.jpg?width=75&height=75&resize=contain,False,['politics'],0,False,,False,10500000,False,,,,#c212ff,en,0,0,True,045013c9-00b9-437b-a358-272f4d413605,1708538800,1708522484
Abriss Berlin,https://abrissberlin.de/,gegen Abrisspolitik und für den Mut zur Vielfalt,https://supapjpiqdfzuaordcdx.supabase.co/storage/v1/render/image/public/images/1660544035805-birne.png?width=75&height=75&resize=contain,False,['politics'],0,False,,False,11046983,False,,,,#DE0021,de,0,0,True,a5d03286-2858-4866-ae97-eeed4fdd32dd,1660544037,1709998444
OrangeUtan,https://orangeutan.ghost.io/,"Orange'Utan running for Presidency. Once elected, we will never leave. Check our other socials!",https://supapjpiqdfzuaordcdx.supabase.co/storage/v1/render/image/public/images/1712861943695-theorangeutan.jpg?width=75&height=75&resize=contain,False,['politics'],0,False,,False,11500000,False,,,,#ff8800,en,0,0,True,fb033e77-56b3-494b-86c0-1b6cc05b7164,1712861945,1712859730
The_Mad_End,https://the-mad-end.ghost.io/,Thoughts/Pics/Music,https://supapjpiqdfzuaordcdx.supabase.co/storage/v1/render/image/public/images/1736382895720-IMG_2788.jpg?width=75&height=75&resize=contain,False,['politics'],0,False,,False,11500000,False,,,,#1926ff,en,0,0,True,777dbedc-f955-4454-99d8-1c9d4ea1412a,1736382792,1736380207
La Órbita / Blog de Política Latinoamericana,https://www.laorbita.net/,Este es un blog donde tendrás el mejor análisis crítico sobre la realidad política en América Latina. Cada semana con contenido nuevo sobre los temás más acuciantes de la región.,https://supapjpiqdfzuaordcdx.supabase.co/storage/v1/render/image/public/images/1703167426874-LogoMiniLaOrbita-removebg-preview.png?width=75&height=75&resize=contain,False,['politics'],0,False,,False,11500000,False,,,,#0c660a,es,0,0,True,0f95470f-6e88-4e0f-8816-11228870ee42,1703167427,1703012281
Hensel for Congress,https://henselforcongress.com/,Open & Honest Government,https://supapjpiqdfzuaordcdx.supabase.co/storage/v1/render/image/public/images/1730749663909-apple-touch-icon-1.png?width=75&height=75&resize=contain,False,['politics'],0,False,,False,15674097,False,,,,#3165be,en,0,0,True,a176d990-43b1-43bd-b296-0090c7ff8c79,1730749665,1730737307
AmplifyStroud,https://amplifystroud.com/,"Speaking Truth to Power in Stroud, England. Leftfield writing from one of the most interesting places in the UK - home of XR and Just Stop Oil, rural mill town with 1,000 years of radical history.",https://supapjpiqdfzuaordcdx.supabase.co/storage/v1/render/image/public/images/1711063581091-amplify-1.png?width=75&height=75&resize=contain,False,['politics'],0,False,,False,25218520,False,,,,#FF1A75,en,0,0,False,42a62c9b-3263-474b-b5ac-8e99e1eb22d7,1711063583,1734043030
Confidential Daily,https://www.confidentialdaily.com/,"We cut through the spin and BS to help you defend freedom, build wealth and protect your family.",https://supapjpiqdfzuaordcdx.supabase.co/storage/v1/render/image/public/images/1693384165563-CDailyLogo.png?width=75&height=75&resize=contain,False,['politics'],0,False,,False,30807156,False,,,,#e60909,en,0,0,True,3f95080a-58f9-4a42-b471-a8ec58b5a56d,1658238539,1736948052
Mimo agendu,https://mimo-agendu.ghost.io/,A journalist on sabbatical trying out a paid newsletter.,https://supapjpiqdfzuaordcdx.supabase.co/storage/v1/render/image/public/images/1664718158460-Brown & Beige Aesthetic Minimalist Font Initials Logo.png?width=75&height=75&resize=contain,False,['politics'],0,False,,False,50580682,False,,,,#ffaa00,cs,0,0,True,0c9e6adf-3da7-4b96-9045-56ef718827b8,1664718159,1714971639
Geopolitics Insider,https://www.geopolitics-insider.com/,"Unlock the secrets of global politics. Get in-depth analysis, unbiased insights, and unique perspectives on international relations.",https://supapjpiqdfzuaordcdx.supabase.co/storage/v1/render/image/public/images/1719274622989-209823976_106399888369310_5954582648470547492_n--5-.jpg?width=75&height=75&resize=contain,False,['politics'],0,False,,False,59848298,False,,,,#000000,en,0,0,True,f33b59a6-9aa2-42d0-96e7-dccf82a75e48,1719274625,1736707796
Digital Politics,https://www.digitalpolitics.co/,A weekly insider's look at how the worlds of politics and technology are colliding — and what that means for the world.,https://supapjpiqdfzuaordcdx.supabase.co/storage/v1/render/image/public/images/1736939490600-Ghost.jpg?width=75&height=75&resize=contain,False,['politics'],0,False,,False,79232111,False,,,,#0ab3ed,en,0,0,True,1c13b612-a007-42ca-888a-f35b3f6a1c99,1725803866,1736769636
Palmetto Data Mine,https://blog.shutdown.network/,Delving into the depths of South Carolina's data,https://supapjpiqdfzuaordcdx.supabase.co/storage/v1/render/image/public/images/1681481736999-vector-1-.png?width=75&height=75&resize=contain,False,['politics'],0,False,,False,275071035,False,,,,#9141ac,en,0,0,True,9f44a88a-29c4-4e42-bb45-87a6f71d68b1,1681481738,1682824675
A Dissenting Opinion,https://www.adissentingopinion.com/,"Long reads concerning social issues, technological progress, philosophy and culture.",https://supapjpiqdfzuaordcdx.supabase.co/storage/v1/render/image/public/images/1664194090432-Logo-Final-Square.png?width=75&height=75&resize=contain,False,['politics'],0,False,,False,282784805,False,,,,#102d12,en,0,0,True,7a401b6f-4991-4298-8c47-46fc09445c65,1664194017,1710152468
New Realist,https://www.newrealist.com/,An independent publication promoting scientific mutualism - arguing for a socialist free market economy.,https://supapjpiqdfzuaordcdx.supabase.co/storage/v1/render/image/public/images/1728736632718-New-Realist-Icon-1.png?width=75&height=75&resize=contain,False,['politics'],0,False,,False,289846578,False,,,,#ac0c2d,en,0,0,True,aa4e22b2-3400-458b-b3fb-f8ac867c4fff,1724444817,1719362602
