Blog - GymStreak AI Workout App,https://blog.gymstreak.com/,"Stay consistent and achieve lasting results with GymStreak AI Workout App. Dive into the latest science-backed fitness trends, research, and tips to fuel your perseverance and optimize your workouts.",https://supapjpiqdfzuaordcdx.supabase.co/storage/v1/render/image/public/images/1728476288555-gymstreak_app_icon-1.png?width=75&height=75&resize=contain,False,['sport & fitness'],0,False,,False,4889807,False,,,,#2383f3,en,0,0,False,22a8ea42-fca1-41e9-a8a7-4fe278ff2e1a,1679231736,1728298876
Flex AI,https://flexfitnessapp.com/,"Flex is a free, fun, and simple workout app that does the planning and tracking for you.",https://supapjpiqdfzuaordcdx.supabase.co/storage/v1/render/image/public/images/1736323518689-Flex-AI-Logo.png?width=75&height=75&resize=contain,False,['sport & fitness'],0,False,,False,6015782,False,,,,#FF1A75,en,0,0,False,133ed6bf-1a86-4a11-9d40-15780805357e,1736323519,1736181206
WeGlide Magazine,https://magazine.weglide.org/,"Latest news about Gliding, interesting flight stories and profound interviews with famous pilots.",https://supapjpiqdfzuaordcdx.supabase.co/storage/v1/render/image/public/images/1691701642924-android-icon-512x512-1.png?width=75&height=75&resize=contain,False,['sport & fitness'],0,False,,False,8477319,False,,,,#2d55a6,en,0,0,True,ad84d9b6-b21e-4eab-8375-4a1afe68dd3f,1691701644,1751543689
Goju Karate,https://www.gojukarate.com/,The Elite Karatedo Dojo,https://supapjpiqdfzuaordcdx.supabase.co/storage/v1/render/image/public/images/1705255556317-apple-touch-icon.png?width=75&height=75&resize=contain,False,['sport & fitness'],0,False,,False,9439271,False,,,,#e80000,en,0,0,True,0c8acc16-1e92-4d85-8880-fdabbf336d65,1705255557,1705167041
Only Endurance,https://www.onlyendurance.com/,"Nothing else, Only Endurance",https://supapjpiqdfzuaordcdx.supabase.co/storage/v1/render/image/public/images/1744629723396-OE-Favicon.png?width=75&height=75&resize=contain,False,['sport & fitness'],0,False,,False,9847356,False,,,,#09e309,en,0,0,True,f15ead19-ad92-420f-8654-b2d8008f1b11,1744629693,1752069193
RINGOFHIGHLIGHTS,https://www.ringofhighlights.com/,Step into the ring with us as we bring you the most electrifying boxing highlights from across the globe! 🥊,https://supapjpiqdfzuaordcdx.supabase.co/storage/v1/render/image/public/images/1745203940614-new-ringofhighlights_logo--150---150-px--2.png?width=75&height=75&resize=contain,False,['sport & fitness'],0,False,,False,10000000,False,,,,#000000,en,0,0,True,c2696def-3172-4209-ae8f-6e25925920dc,1671857342,1744543620
SnowRank,https://snowrank.com/,Best Snowboard Review & Price Seeker For You,https://supapjpiqdfzuaordcdx.supabase.co/storage/v1/render/image/public/images/1734334918694-favicon2-Photoroom.png?width=75&height=75&resize=contain,False,['sport & fitness'],0,False,,False,10000000,False,,,,#008cc8,en,0,0,True,97bb9b9a-5db2-473e-82dc-552f39b08fc7,1734334920,1735885877
Eat The Hatchet,https://eatthehatchet.ghost.io/,A blog about the Chicago Blackhawks,https://supapjpiqdfzuaordcdx.supabase.co/storage/v1/render/image/public/images/1710963911756-Untitled-design--3-.png?width=75&height=75&resize=contain,False,['sport & fitness'],0,False,,False,10000000,False,,,,#3f3f3f,en,0,0,True,1cb8d667-de9f-422c-a9e0-686987da2f83,1710963913,1714334764
PadelRacketReviews.co.uk,https://www.padelracketreviews.co.uk/,"Find the perfect padel racket for you with our expert reviews, buying guides and recommendations.",https://supapjpiqdfzuaordcdx.supabase.co/storage/v1/render/image/public/images/1743695737809-padel-racket-reviews-favicon-6.png?width=75&height=75&resize=contain,False,['sport & fitness'],0,False,,False,10500000,False,,,,#5200FF,en,0,0,True,fb822f95-efb5-4533-afba-095c41de5e2a,1743695738,1743693840
Collegiate Flag Football,https://www.collegiateflagfootball.com/,A site dedicated to women's flag football from colleges and universities in the US.,https://supapjpiqdfzuaordcdx.supabase.co/storage/v1/render/image/public/images/1742219762630-CFF---Favicon-Transparent-1.png?width=75&height=75&resize=contain,False,['sport & fitness'],0,False,,False,10500000,False,,,,#FF1A75,en,0,0,True,f3da55e7-35d1-48c8-8e69-ee3b3c72b9b3,1742219763,1741732247
AI Football Writer,https://blog.footballwriter.ai/,Your ultimate destination for in-depth football analysis and insights. Spearheaded by our AI analyst,https://supapjpiqdfzuaordcdx.supabase.co/storage/v1/render/image/public/images/1717060693393-logo-2.png?width=75&height=75&resize=contain,False,['sport & fitness'],0,False,,False,10500000,False,,,,#51a974,en,0,0,True,e3ab2549-a86d-49fa-ab9e-0b7db50fa489,1717060695,1716022719
We Talk Football,https://wetalkfootball.cc/,"Whether you're a casual or a die-hard follower, we have everything you need to stay informed about the NFL, including fantasy football and draft analysis",https://supapjpiqdfzuaordcdx.supabase.co/storage/v1/render/image/public/images/1681922866755-icon.png?width=75&height=75&resize=contain,False,['sport & fitness'],0,False,,False,10500000,False,,,,#0a0a0b,en,0,0,False,ded5f963-e327-4e0b-bc1e-71ae359bfa1a,1681922867,1751975825
Nordic 90,https://www.nordic90.com/,"Tactics, Talent, and Triumphs from the Nordics",https://supapjpiqdfzuaordcdx.supabase.co/storage/v1/render/image/public/images/1736249978788-Nordic-90-Blue.png?width=75&height=75&resize=contain,False,['sport & fitness'],0,False,,False,10500000,False,,,,#3a1c1c,en,0,0,True,d15d1982-c340-495f-b371-dff8abc0d88b,1736249979,1736243227
Gustav Löfqvist,https://blog.guslof.se/,"A Swedish student-athlete navigating life at Wheeling University, USA. Balancing swim training with academics. Follow for challenges, and cultural experiences, in and out of the pool.",https://supapjpiqdfzuaordcdx.supabase.co/storage/v1/render/image/public/images/1730235623505-BlogFavicon.png?width=75&height=75&resize=contain,False,['sport & fitness'],0,False,,False,10500000,False,,,,#371a94,en,0,0,True,c019f230-05b4-4a8e-90f3-48b6a4a8a5d3,1730235625,1730085644
Strong with Dana,https://strong-with-dana.ghost.io/,"Non-diet personal trainer. Body neutrality & inclusive training. Move intuitively, ditch diet culture.",https://supapjpiqdfzuaordcdx.supabase.co/storage/v1/render/image/public/images/1750792355609-Dana%20Pinterest%20PFP.jpg?width=75&height=75&resize=contain,False,['sport & fitness'],0,False,,False,10500000,False,,,,#ffad3a,en,0,0,True,af22b967-be0d-446a-936a-4c3821113a20,1750792356,1750445274
🏀 NBA | Alejandro Gaitan,https://alejandroggo.com/,Baloncesto en formato escrito.,https://supapjpiqdfzuaordcdx.supabase.co/storage/v1/render/image/public/images/1745368187302-Logo_-4.png?width=75&height=75&resize=contain,False,['sport & fitness'],0,False,,False,10500000,False,,,,#0a6107,es,0,0,True,a39268e8-a14e-47a9-8152-a92437633513,1745368188,1745262039
Project 52,https://project-52.ghost.io/,Brand new way of analysing 1000s of sporting events each day. Daily recommendations and transparent investment returns.,https://supapjpiqdfzuaordcdx.supabase.co/storage/v1/render/image/public/images/1720683627048-DALL-E-2024-06-27-12.57.52---Create-a-logo-featuring-a-stylized--older-Sean-Connery-as-a-submariner.-The-logo-should-show-Sean-Connery-wearing-a-submariner-s-cap-with-a-nautical-e-1.webp?width=75&height=75&resize=contain,False,['sport & fitness'],0,False,,False,10500000,False,,,,#824b61,en,0,0,True,8d8da000-0837-4d70-ba29-826ad7b7b5f3,1720683628,1720683510
WeekOneFantasy,https://www.weekonefantasy.com/,"Fantasy Football - Learn, Rankings, Picks, News, & More",https://supapjpiqdfzuaordcdx.supabase.co/storage/v1/render/image/public/images/1722828488413-favicon.png?width=75&height=75&resize=contain,False,['sport & fitness'],0,False,,False,10500000,False,,,,#0064dc,en,0,0,True,7d30f9f9-4346-462b-9c4d-4da9322a2aea,1722828489,1722807212
Sam Fels But Who's Buying,https://sam-fels-but-whos-buying.ghost.io/,"A lot of Hawks, a lot of Chicago sports, and more than a pinch of so much else",https://supapjpiqdfzuaordcdx.supabase.co/storage/v1/render/image/public/images/1747768173620-Hangman%202.jpg?width=75&height=75&resize=contain,False,['sport & fitness'],0,False,,False,10500000,False,,,,#f10707,en,0,0,True,7c0b8a1f-5aca-4d81-a0ef-cb8c94318271,1747768174,1747675831
71 Sports,https://www.71sports.org/,"EPL, NBA, NFL: Opinions and News",https://supapjpiqdfzuaordcdx.supabase.co/storage/v1/render/image/public/images/1742526381165-7__7_-removebg-preview-1.png?width=75&height=75&resize=contain,False,['sport & fitness'],0,False,,False,10500000,False,,,,#007fe6,en,0,0,True,7b161a33-2051-4a45-b1a4-a3315469a0cd,1742526382,1742158006
Orbwin Tips,https://orbwin-tips.ghost.io/,Get the best football recommendations evaluated by probability experts. We analyze over 1000 matches per month in leagues around the world. Try for free now.,https://supapjpiqdfzuaordcdx.supabase.co/storage/v1/render/image/public/images/1750262502032-profile-logo--default.png?width=75&height=75&resize=contain,False,['sport & fitness'],0,False,,False,10500000,False,,,,#442DEE,en,0,0,True,6fb7ee93-6795-4a76-a01c-ea1828245284,1750262503,1750260725
ブログ - GymStreak AI Workout App,https://jp.gymstreak.com/,GymStreakのAIワークアウトアプリで、一貫性を保ち、持続的な成果を達成しましょう。科学的裏付けのある最新のフィットネストレンド、研究、ヒントに飛び込んで、あなたの忍耐力を刺激し、ワークアウトを最適化しましょう。,https://supapjpiqdfzuaordcdx.supabase.co/storage/v1/render/image/public/images/1728476429170-logo.png?width=75&height=75&resize=contain,False,['sport & fitness'],0,False,,False,10500000,False,,,,#1d93ed,ja,0,0,True,5698c8fe-ec7e-476e-8be8-4b03d469c47e,1728476431,1728372922
F1 Newsletter | Daily Briefing,https://f1briefing.com/,"Daily F1 newsletter with deep dives into Formula One’s strategies, stories, and tech.",https://supapjpiqdfzuaordcdx.supabase.co/storage/v1/render/image/public/images/1746323730317-f1b-logo.jpg?width=75&height=75&resize=contain,False,['sport & fitness'],0,False,,False,10500000,False,,,,#000000,en,0,0,True,56529796-1dfb-4b0d-8777-3e820cbaac40,1746323731,1746321588
Blog - GymStreak AI Workout App,https://nl.gymstreak.com/,Blijf consistent en haal blijvende resultaten met de app. Ontdek de nieuwste wetenschappelijk onderbouwde fitnesstrends en tips om je doorzettingsvermogen en workouts te optimaliseren.,https://supapjpiqdfzuaordcdx.supabase.co/storage/v1/render/image/public/images/1728476749149-logo.png?width=75&height=75&resize=contain,False,['sport & fitness'],0,False,,False,10500000,False,,,,#199cff,nl,0,0,True,54d3290c-f8c3-4362-8b3f-7a5d81794207,1728476750,1728373900
James on the Run,https://www.jamesontherun.com/,"Thoughts on running and life from a distance runner living in Toronto, Ontario.",https://supapjpiqdfzuaordcdx.supabase.co/storage/v1/render/image/public/images/1731022761674-SxOC68h5_400x400.jpg?width=75&height=75&resize=contain,False,['sport & fitness'],0,False,,False,10500000,False,,,,#343434,en,0,0,True,528a85f9-416c-41f6-8d86-58797e4cbc73,1731022762,1730942493
Good Areas,https://www.goodareas.co/,The stories and stats from the footmarks of world cricket.,https://supapjpiqdfzuaordcdx.supabase.co/storage/v1/render/image/public/images/1706894409200-android-chrome-512x512.png?width=75&height=75&resize=contain,False,['sport & fitness'],0,False,,False,10500000,False,,,,#c22700,en,0,0,True,3afd7780-991b-41eb-ba6a-d9b1c23d7a36,1706894410,1706793440
Blog - GymStreak AI Workout App,https://fr.gymstreak.com/,Reste constant et obtiens des résultats durables avec GymStreak. Découvre les dernières tendances fitness basées sur la science pour optimiser tes entraînements et améliorer ta persévérance.,https://supapjpiqdfzuaordcdx.supabase.co/storage/v1/render/image/public/images/1728476515089-logo.png?width=75&height=75&resize=contain,False,['sport & fitness'],0,False,,False,10500000,False,,,,#199cff,fr,0,0,True,32b01011-35c0-4bf9-83d2-c0aea4b6b178,1728476517,1727508887
North Wrestle,https://www.northwrestle.com/,"Canadian wrestling news, highlights, and rankings.",https://supapjpiqdfzuaordcdx.supabase.co/storage/v1/render/image/public/images/1728088538297-pfp.jpeg?width=75&height=75&resize=contain,False,['sport & fitness'],0,False,,False,10500000,False,,,,#000000,en,0,0,True,2f52542a-f239-4cc0-8888-05b4c7e509b5,1728088540,1728050446
Jordan Laster,https://www.jordanlaster.com/,Improve your grappling. Transform your health. I help you improve your grappling on and off the mat.,https://supapjpiqdfzuaordcdx.supabase.co/storage/v1/render/image/public/images/1743899111525-favicon-32x32.png?width=75&height=75&resize=contain,False,['sport & fitness'],0,False,,False,10500000,False,,,,#f58233,en,0,0,True,2ba82382-8fb3-4d4a-9d52-7ac4e909a950,1701812361,1749645021
.barrel,https://www.barrelonline.ca/,".barrel is a sports publication dedicated to the soul of the game. From high-stakes championships to overlooked local heroes, we uncover the stories that make sports unforgettable.",https://supapjpiqdfzuaordcdx.supabase.co/storage/v1/render/image/public/images/1750717621696-ChatGPT-Image-Jun-23--2025--04_24_25-PM.png?width=75&height=75&resize=contain,False,['sport & fitness'],0,False,,False,10500000,False,,,,#d30316,en,0,0,True,2681412f-540e-40fe-b562-94d22284065c,1740078601,1752005230
Blog - GymStreak AI Workout App,https://pt.gymstreak.com/,"Mantenha-se consistente e alcance resultados duradouros com o App. Descubra as últimas tendências de fitness baseadas em ciência, pesquisas e dicas para otimizar seus treinos.",https://supapjpiqdfzuaordcdx.supabase.co/storage/v1/render/image/public/images/1728476713117-logo.png?width=75&height=75&resize=contain,False,['sport & fitness'],0,False,,False,10500000,False,,,,#199cff,pt,0,0,True,25393ef6-7e60-458c-b53a-d85c2d861b77,1728476714,1728373595
"Data, AI and Hockey",https://www.datapunkhockey.com/,Data Punk Hockey is for hockey fans who want to learn more about the technical and analytical side of the sport. Sign up for free and premium content. You'll never look at hockey the same again!,https://supapjpiqdfzuaordcdx.supabase.co/storage/v1/render/image/public/images/1735686026752-Both_Ears_Logo-removebg-preview-4.png?width=75&height=75&resize=contain,False,['sport & fitness'],0,False,,False,10500000,False,,,,#1d1c1c,en,0,0,True,1e8b759d-d74f-4bac-8014-407fd1d81229,1735686027,1735684684
Blog - GymStreak AI Workout App,https://de.gymstreak.com/,"Bleib konsequent und erreiche nachhaltige Ergebnisse mit der GymStreak. Entdecke die neuesten wissenschaftlich fundierten Fitnesstrends, um dein Training zu optimieren und deine Ausdauer zu stärken.",https://supapjpiqdfzuaordcdx.supabase.co/storage/v1/render/image/public/images/1728476676133-logo.png?width=75&height=75&resize=contain,False,['sport & fitness'],0,False,,False,10500000,False,,,,#199cff,de,0,0,True,1a85782a-5b53-454c-91b2-45b5226352df,1728476678,1728373462
Soccer Quant,https://www.soccerquant.com/,Soccer Match and Player Analysis,https://supapjpiqdfzuaordcdx.supabase.co/storage/v1/render/image/public/images/1728475640322-eddy_kramer.jpg?width=75&height=75&resize=contain,False,['sport & fitness'],0,False,,False,10500000,False,,,,#000000,en,0,0,True,191a44ee-e92b-4ff5-b268-de4a718ffbbb,1728475642,1728288009
Blog - GymStreak AI Workout App,https://es.gymstreak.com/,"Mantén la constancia y consigue resultados duraderos con GymStreak AI Workout App. Sumérgete en las últimas tendencias de fitness respaldadas por la ciencia, investigaciones y consejos para alimentar",https://supapjpiqdfzuaordcdx.supabase.co/storage/v1/render/image/public/images/1728476478189-logo.png?width=75&height=75&resize=contain,False,['sport & fitness'],0,False,,False,10500000,False,,,,#199cff,es,0,0,True,11c5f2ea-2adb-4f92-98d2-40702cd9a385,1728476479,1728373415
Manolo Manriquez,https://manolo-manriquez.ghost.io/,"Análisis deportivo, pensamientos y apuestas.",https://supapjpiqdfzuaordcdx.supabase.co/storage/v1/render/image/public/images/1742021159266-2-2.png?width=75&height=75&resize=contain,False,['sport & fitness'],0,False,,False,11500000,False,,,,#035915,en,0,0,True,f97dca3d-a66c-42e9-a411-58b78f809c4c,1742021160,1741947924
Back of the Net,https://back-of-the-net.ghost.io/,"Your friend Jessica Morrison is a new soccer fan, and she has lots of questions.",https://supapjpiqdfzuaordcdx.supabase.co/storage/v1/render/image/public/images/1751291399070-Untitled%20design%20(2).png?width=75&height=75&resize=contain,False,['sport & fitness'],0,False,,False,11500000,False,,,,#52c83a,en,0,0,True,9fc74024-a6b9-4a9d-b6de-126fa8e82b70,1751291399,1751234242
Running Mojo,https://www.runningmojo.com/,"Daily motivation, tips, and inspiration to fuel your running journey.",https://supapjpiqdfzuaordcdx.supabase.co/storage/v1/render/image/public/images/1737841283494-IMG_8548-1.png?width=75&height=75&resize=contain,False,['sport & fitness'],0,True,,False,11500000,False,,,,#14020a,en,0,0,True,728c3c42-1bcc-4c34-9db5-fbc0d6221a89,1737841284,1737819620
Financial Fitness,https://financial-fitness.ghost.io/,"Take control of your fitness, finances, and your life.",https://supapjpiqdfzuaordcdx.supabase.co/storage/v1/render/image/public/images/1740789648139-Caleb-Duckwiler-Main-Logo-1.png?width=75&height=75&resize=contain,False,['sport & fitness'],0,False,,False,11500000,False,,,,#000000,en,0,0,True,5b17e911-9014-4ae2-9d96-6f910a023563,1740789649,1740789575
"Nalož.si – pohyb, zážitky, výzvy",https://www.naloz.si/,"Jsem Pepíno – kluk, co miluje pohyb, běh a dobrodružství. Sdílím, jak si nakládám pohyb, zážitky a výzvy. Přidej se a poď si naložit taky!",https://supapjpiqdfzuaordcdx.supabase.co/storage/v1/render/image/public/images/1748894408195-favicon-2.png?width=75&height=75&resize=contain,False,['sport & fitness'],0,False,,False,11500000,False,,,,#A66300,cs,0,0,True,37a06d06-6d13-464a-98ce-dede9ae7a5f1,1748894409,1748524038
The Clubhouse,https://nostringsweekly.ghost.io/,"Thoughts, stories & ideas about padel, brought to you by No Strings.",https://supapjpiqdfzuaordcdx.supabase.co/storage/v1/render/image/public/images/1720699148342-NS-Logomark---green-1.jpg?width=75&height=75&resize=contain,False,['sport & fitness'],0,False,,False,11500000,False,,,,#2c5D29,en,0,0,True,122d1175-7195-4fb4-a858-a0497b925f5b,1720699150,1720075401
NW Baseball History,https://www.nwbaseballhistory.com/,"From the amateurs to the Mariners, stories about baseball history in the Pacific Northwest",https://supapjpiqdfzuaordcdx.supabase.co/storage/v1/render/image/public/images/1738701245504-Copy-of-history-25122bf88a071771.png?width=75&height=75&resize=contain,False,['sport & fitness'],0,False,,False,13212219,False,,,,#df7b83,en,0,0,True,03816dd9-9e36-4d70-b1ef-ff2b716b91bf,1738701245,1751396428
The Racing Line,https://www.theracingline.media/,"Endurance racing news, stories, and analysis",https://supapjpiqdfzuaordcdx.supabase.co/storage/v1/render/image/public/images/1736757489029-Logo-Icon---Black-cropped.png?width=75&height=75&resize=contain,False,['sport & fitness'],0,False,,False,18358110,False,,,,#22bdc3,en,0,0,True,ba83fba6-a76c-49e3-b7a1-f22dfe1b9fda,1736757490,1734025557
Strongman Blog,https://strongman.blog/,Amateur Strongman writing about Everything Strongman.,https://supapjpiqdfzuaordcdx.supabase.co/storage/v1/render/image/public/images/1685967906501-strongman.png?width=75&height=75&resize=contain,False,['sport & fitness'],0,False,,False,23195596,False,,,,#c55a20,en,0,0,False,3c493de1-fb95-4473-82a5-234243cc591e,1683571561,1703767290
Capel Golf Club,https://www.capelgolfclub.org.au/,"18 hole championship golf course and undercover driving range located south of Bunbury, the gateway to the South-West and Ferguson Valley wine region",https://supapjpiqdfzuaordcdx.supabase.co/storage/v1/render/image/public/images/1675950685867-cfav-black.png?width=75&height=75&resize=contain,False,['sport & fitness'],0,False,,False,24666788,False,,,,#967a47,en,0,0,True,44228cdd-d5da-408f-a8da-a6823ef26c6b,1675950687,1714718192
Two Stripes with Colton Denning,https://www.2stripescpd.com/,"College football analysis, highlights, retrospectives and more!",https://supapjpiqdfzuaordcdx.supabase.co/storage/v1/render/image/public/images/1690693048485-Icon-Final-Edited-1.png?width=75&height=75&resize=contain,False,['sport & fitness'],0,False,,False,28680800,False,,,,#f50fcb,en,0,0,True,9e49ddf5-61b7-4235-985a-26686ca77258,1690547949,1751829898
Tennis Library,https://www.tennislibrary.com/,"Tennis - Learn, Rules, Coaching, News, & More",https://supapjpiqdfzuaordcdx.supabase.co/storage/v1/render/image/public/images/1725227957609-favicon.png?width=75&height=75&resize=contain,False,['sport & fitness'],0,False,,False,32981366,False,,,,#6d8eeb,en,0,0,True,11dcd083-4fde-4bd5-a812-8169ba2c8765,1725227958,1725215101
AmmoSquared,https://blog.ammosquared.com/,Updates and thoughts from America's ammunition reserve AmmoSquared.,https://supapjpiqdfzuaordcdx.supabase.co/storage/v1/render/image/public/images/1748468450268-A2-003-LOGO-MARKS-EXPORT-M_A2-LOGO-MARK-CIRCLE-BLACK-M.png?width=75&height=75&resize=contain,False,['sport & fitness'],0,False,,False,44281596,False,,,,#151515,en,0,0,True,cc4ab9ae-71a7-46ee-94fa-4f3d9d81ad2d,1680186239,1751983249
Pitlane News,https://www.pitlane-news.com/,"Pitlane-News is a news and information site for the UK & European Motorsport Industry - we take you behind the scenes with insights into the drivers, teams & suppliers across the world of Motorsport",https://supapjpiqdfzuaordcdx.supabase.co/storage/v1/render/image/public/images/1675923417544-LOGO-CROP-SQUARE.png?width=75&height=75&resize=contain,False,['sport & fitness'],0,False,,False,57074468,False,,,,#15171A,en,0,0,True,7430fe8b-c500-4614-a2a2-8f4fc4863847,1675923418,1751274013
Red & White Pod's Network,https://redwhitenetwork.com/,The #1 Podcast and Newsletter for NC State Wolfpack Sports,https://supapjpiqdfzuaordcdx.supabase.co/storage/v1/render/image/public/images/1689253705407-Squarepng.png?width=75&height=75&resize=contain,False,['sport & fitness'],0,False,,False,68087865,False,,,,#15171A,en,0,0,True,f26f4e03-5ed1-428f-95a4-a15077f5017e,1689253706,1749042268
ActualRatings,https://www.actualratings.com/,We find the best rated products for your needs.,https://supapjpiqdfzuaordcdx.supabase.co/storage/v1/render/image/public/images/1667651773292-New-Logo-Actual-Ratings-2-1.png?width=75&height=75&resize=contain,False,['sport & fitness'],0,False,,False,68334371,False,,,,#508cb9,en,0,0,True,00716052-ef3b-4489-bd3b-90a5848c731b,1667651774,1746460025
House of V,https://houseofv.ghost.io/,The human side of English football experienced by an Aston Villa FC fan.,https://supapjpiqdfzuaordcdx.supabase.co/storage/v1/render/image/public/images/1701599448498-FZPePuqVEAES4aY-1.jpg?width=75&height=75&resize=contain,False,['sport & fitness'],0,False,0,True,81387421,False,,,,#7b003a,en,0,0,True,2f873f3f-8062-42af-83b7-1708b1f27bee,1672874475,1746046069
The Straight,https://thestraight.com.au/,"The Straight is a free, membership-based digital publication featuring in-depth coverage of the thoroughbred racing, wagering and breeding industries.",https://supapjpiqdfzuaordcdx.supabase.co/storage/v1/render/image/public/images/1718751631498-THESTRAIGHT-PROFILE-JPG-1.jpg?width=75&height=75&resize=contain,False,['sport & fitness'],0,False,,False,103670619,False,,,,#f07448,en,0,0,True,851248ce-c7a3-4218-9ebc-13e1f8a20ab1,1718751633,1718686044
Gray Matter Health,https://blog.graymatter.health/,Digestible ideas on cultivating a healthy body and mind,https://supapjpiqdfzuaordcdx.supabase.co/storage/v1/render/image/public/images/1685814744302-InverseLogo_onGreen_500.jpg?width=75&height=75&resize=contain,False,['sport & fitness'],0,False,,False,185713711,False,,,,#3f7782,en,0,0,False,a0834a7f-ac8d-4780-8156-c503a1f3ad88,1685814745,1727949632
"Galorre Stay Fit & Resilient: Navigating Sports, Fitness, and Conquering Back Pain!",https://www.galorre.com/,"Elevate Your Well-Being: Thrive in Fitness, Health, and a Pain-Free Lifestyle!",https://supapjpiqdfzuaordcdx.supabase.co/storage/v1/render/image/public/images/1714381392524-social-logo-60x60.jpg?width=75&height=75&resize=contain,False,['sport & fitness'],0,False,,False,196112136,False,,,,#34383d,en,0,0,True,759ae606-f5a6-4e73-a06f-cadcb72a7bf2,1714381394,1714208400
Rslnt Training,https://rslnt.training/,"On t'aide à atteindre tes objectifs de santé, de fitness, de vie. Une paire d'haltères, 30 min et let's go ! Zero frictions 30 Jours Gratuits",https://supapjpiqdfzuaordcdx.supabase.co/storage/v1/render/image/public/images/1728835693289-pine.png?width=75&height=75&resize=contain,False,['sport & fitness'],0,False,,False,250741158,False,,,,#97cd0d,fr,0,0,True,ffb395d2-6a1e-4636-9461-94f2a53bf514,1728835695,1728752785
VietMarathoners,https://vietmarathoners.com/,"Không chỉ bao gồm những bài viết về kiến thức, chúng tôi chia sẻ với người đọc về cảm hứng tập luyện, phân tích những khía cạnh giản đơn trong suy nghĩ về việc chạy bộ.",https://supapjpiqdfzuaordcdx.supabase.co/storage/v1/render/image/public/images/1668182681481-1668067781887-icon-red.png?width=75&height=75&resize=contain,False,['sport & fitness'],0,False,,False,336550749,False,,,,#D1382B,vi,0,0,True,ee0d88e9-d2df-436e-8e15-cb542f2d5837,1668067786,1749712209
