Title,URL,Description,Publication Icon,Not Safe For Work,Categories,Member Count,Show Member Count,Monthly Recurring Revenue (MRR),Show MRR,Ghost Rank,Featured,Feature Image,Text Color,Background Color,Accent Color,Language,MRR Members Rank,MRR Members Diff Rank,Show Iframe,Object ID,Created At,Updated At
Blueshirt Banter,https://www.blueshirtbanter.com/,"New York Rangers Schedule, Roster, News, and Rumors | Blueshirt Banter",https://supapjpiqdfzuaordcdx.supabase.co/storage/v1/render/image/public/images/1680309273491-bsb_logo-1.png?width=75&height=75&resize=contain,False,['sport & fitness'],2788,True,2K,True,138981,False,,,,#bd1115,en,25794.6,15,True,56c83b6d-08c6-4c0c-b6d2-854187be7242,1680309274,1752066047
TFC REPUBLIC,https://www.tfcrepublic.ca/,"In-depth coverage and analysis of all things Toronto FC, Canada's original Major League Soccer club.",https://supapjpiqdfzuaordcdx.supabase.co/storage/v1/render/image/public/images/1690759306989-mb.jpeg?width=75&height=75&resize=contain,False,['sport & fitness'],1271,True,2K,True,4081807,False,,,,#b00707,en,17382.16128,61,True,0a24fa82-3943-42fb-9322-3122749f8b89,1660077213,1751999016
SixOneFive Soccer,https://www.sixonefivesoccer.com/,Nashville's independent soccer news,https://supapjpiqdfzuaordcdx.supabase.co/storage/v1/render/image/public/images/1738037315477-Speedway-Site.png?width=75&height=75&resize=contain,False,['sport & fitness'],539,True,1K,True,7801717,False,,,,#399cdb,en,15269.9,155,True,4a32ae14-278d-4f00-a74a-a0276aa09425,1738037316,1752067930
SCOUTED,https://scoutedftbl.com/,"The future of football, discovered",https://supapjpiqdfzuaordcdx.supabase.co/storage/v1/render/image/public/images/1741191785360-scouted-black-square-3.png?width=75&height=75&resize=contain,False,['sport & fitness'],13377,True,,False,447724,False,,,,#e762bc,en,13377,0,True,b417999e-e778-444d-85ef-02a5bfc17a3e,1741191786,1741033760
The Ice Garden,https://www.theicegarden.com/,"Women's Hockey News, Rumors and Analysis",https://supapjpiqdfzuaordcdx.supabase.co/storage/v1/render/image/public/images/1677774771162-TIG_LOGO_Rebranded.png?width=75&height=75&resize=contain,False,['sport & fitness'],688,True,1K,True,132878,False,,,,#65c4c8,en,12136.2,41,True,28486514-0717-46c8-b97e-1d3daec70b61,1677726340,1752073213
JiuJitsu Magazine,https://www.jiujitsumag.com/,The online magazine for those who love jiu-jitsu. Now available online and everywhere! Subscribe today! #BJJ #KnowYourRoll #KnowYourRoll.,https://supapjpiqdfzuaordcdx.supabase.co/storage/v1/render/image/public/images/1730410553994-jjmag_app_icon.png?width=75&height=75&resize=contain,False,['sport & fitness'],11031,True,,False,3981001,False,,,,#de0f0f,en,11031,2,True,d098ae51-fb8c-4a68-b630-bce7ae7d72f5,1730329098,1751062229
Maine Basketball Rankings,https://www.mainebasketballrankings.com/,The most comprehensive coverage of Maine High School Basketball anywhere.,https://supapjpiqdfzuaordcdx.supabase.co/storage/v1/render/image/public/images/1669909459484-maine-basketball-rankings-logo-small.png?width=75&height=75&resize=contain,False,['sport & fitness'],1216,True,930,True,174790959,False,,,,#ee6730,en,10516,0,True,3e75d4eb-b76d-4739-a34e-346249b1256c,1667222741,1750930857
Pointless Exercise,https://www.pointlessexercise.com/,The only newsletter you'll ever need...(about the Cubs and the Bears and all kinds of other cool stuff.),https://supapjpiqdfzuaordcdx.supabase.co/storage/v1/render/image/public/images/1739745171680-pointless-500x500.jpg?width=75&height=75&resize=contain,False,['sport & fitness'],709,True,944,True,277160661,False,,,,#197eb4,en,10151.5,0,True,8e22f035-68a8-4a67-be0c-31cd0ff0283f,1739745172,1739730619
Poorly Drawn Arsenal,https://www.poorlydrawnarsenal.com/,I have questionable artistic skills and a love of Arsenal. Here is where I combine the two.,https://supapjpiqdfzuaordcdx.supabase.co/storage/v1/render/image/public/images/1716290770623-xwiKVP2V_400x400.jpg?width=75&height=75&resize=contain,False,['sport & fitness'],9818,True,,False,27828610,False,,,,#f44c4c,en,9818,2,True,70b1081e-2c55-468a-b954-e642b4ebb727,1716290772,1751886010
Big D Soccer,https://www.bigdsoccer.com/,"We provide all the latest FC Dallas news, opinions, and coverage throughout the day.",https://supapjpiqdfzuaordcdx.supabase.co/storage/v1/render/image/public/images/1729772222393-Big_D_Soccer_minimal-2.svg?width=75&height=75&resize=contain,False,['sport & fitness'],964,True,520,True,231160,False,,,,#e01f2e,en,6163.700000000001,104,True,dcc07fcf-aaaa-4f6d-889b-b15f1d60b143,1729772223,1752012993
The Nats Report,https://www.thenatsreport.com/,"Get the latest updates on the Washington Nationals with the Nats Report e-newsletter. Stay informed with breaking news, game recaps, and exclusive insights delivered to your inbox.",https://supapjpiqdfzuaordcdx.supabase.co/storage/v1/render/image/public/images/1721744368377-TNR-logo-take-2-png.png?width=75&height=75&resize=contain,False,['sport & fitness'],1584,True,361,True,512945,False,,,,#162A3E,en,5193.9,0,True,72c3a0ab-81fc-4a4a-ab9e-f228bd198c76,1721744369,1721744195
The Rose Garden Report,https://www.rosegardenreport.com/,Award-winning independent coverage of the Portland Trail Blazers and WNBA expansion team by Sean Highkin.,https://supapjpiqdfzuaordcdx.supabase.co/storage/v1/render/image/public/images/1751425235397-RGR-Podcast-Cover.png?width=75&height=75&resize=contain,False,['sport & fitness'],5042,True,,False,383873,False,,,,#f30404,en,5042,1,True,3cc7fc10-db0b-4e94-bdbc-e12f0e6c5e71,1745294800,1751764215
Trizone,https://www.trizone.com.au/,Where triathletes come to read.,https://supapjpiqdfzuaordcdx.supabase.co/storage/v1/render/image/public/images/1737372061072-Trizone---publication-icon-600-x-600-px-1.png?width=75&height=75&resize=contain,False,['sport & fitness'],5015,True,,False,397973,False,,,,#FF058A,en,5015,0,True,7ed064d4-ce39-499b-9f2b-326b5c54db36,1737372062,1737281268
"Last Night, In Basketball",https://www.lastnightinbasketball.com/,"A thrice-weekly NBA newsletter and website, from the basketball mind of Jared Dubin",https://supapjpiqdfzuaordcdx.supabase.co/storage/v1/render/image/public/images/1743689280643-LNIB.png?width=75&height=75&resize=contain,False,['sport & fitness'],4365,True,,False,2347903,False,,,,#1700ff,en,4365,6,True,024099d9-c3c3-481e-8bbd-34aedba2a2a0,1743689281,1751902142
Prospects Live,https://www.prospectslive.com/,"Your one stop shop for Dynasty Fantasy Baseball, MLB Draft, Baseball Card & MiLB Baseball content. Blending Data & Scouting into our Player Evaluation",https://supapjpiqdfzuaordcdx.supabase.co/storage/v1/render/image/public/images/1740698719267-prospects_live-social_icon.png?width=75&height=75&resize=contain,False,['sport & fitness'],4060,True,,False,2680276,False,,,,#0088ff,en,4060,0,True,897d3106-5954-4571-9614-ddeedfbfd665,1740698720,1740680378
BirthdayShoes,https://birthdayshoes.com/,Improve your world from the ground up,https://supapjpiqdfzuaordcdx.supabase.co/storage/v1/render/image/public/images/1743449787340-bds-logo-transparent.png?width=75&height=75&resize=contain,False,['sport & fitness'],3709,True,,False,924051,False,,,,#fbc308,en,3709,0,True,8a04ebdd-6bf2-4f41-924c-a6be8f819629,1743449788,1743192480
Estski,https://www.estski.ca/,"À travers les branches, la lumière - Guide - Chronique - Articles - Le média du ski Backountry au Québec et dans l'est de l'Amérique du Nord USA et Canada",https://supapjpiqdfzuaordcdx.supabase.co/storage/v1/render/image/public/images/1691306996034-android-chrome-512x512.png?width=75&height=75&resize=contain,False,['sport & fitness'],3395,True,,False,5002973,False,,,,#000000,fr,3395,1,True,c1bb1edd-7c89-4d84-ac66-646a127cd7bc,1691306997,1742994799
Knockout,https://www.knockout.no/,Live stream boxing and combat sports. Hard hitting news about nordic and international boxing. For fight fans only!,https://supapjpiqdfzuaordcdx.supabase.co/storage/v1/render/image/public/images/1716553107889-knockout-logo.png?width=75&height=75&resize=contain,False,['sport & fitness'],2599,True,,False,61441666,False,,,,#ba0d0d,en,2599,1,True,89fe3c42-3288-45f4-8275-98517c047c44,1716553109,1749787561
Forecast F1,https://forecast-f1.com/,A Fantasy game for Formula 1,https://supapjpiqdfzuaordcdx.supabase.co/storage/v1/render/image/public/images/1670299400962-logo-icon-yell-1.jpg?width=75&height=75&resize=contain,False,['sport & fitness'],2489,True,0,True,182833221,False,,,,#f4aa0b,en,2489,2,True,c05b03ef-91d8-4a71-92ae-1bcb941db11c,1660136358,1751415600
FIFTY+,https://www.thefiftyplus.pro/,"Chronicling mountains, ski lines, opinions, gear and business of backcountry skiing. The FIFTY+ from Cody Townsend",https://supapjpiqdfzuaordcdx.supabase.co/storage/v1/render/image/public/images/1731364307887-Fifty--Icon-Gradient-Slate-Blue-RGB-1.png?width=75&height=75&resize=contain,False,['sport & fitness'],1868,True,,False,87310083,False,,,,#6dabd4,en,1868,0,True,ef0d3383-418e-4c14-b93c-762ff8e4fef3,1731364309,1730905259
Sport Psychology Today,https://learn.mindready.co/,At the intersection of sports and mental health 🚀,https://supapjpiqdfzuaordcdx.supabase.co/storage/v1/render/image/public/images/1680664679111-Newsletter-Logos--1--1.png?width=75&height=75&resize=contain,False,['sport & fitness'],1770,True,,False,13091046,False,,,,#008000,en,1770,4,True,1a52b0ce-2ffc-4fbb-acac-65b4bb42f54e,1671831132,1731250826
writebikerepeat,https://writebikerepeat.com/,"Pro Cycling features, content, news and opinion",https://supapjpiqdfzuaordcdx.supabase.co/storage/v1/render/image/public/images/1681647560185-wbr.png?width=75&height=75&resize=contain,False,['sport & fitness'],1103,True,,False,12483202,False,,,,#669c35,en,1103,0,True,6892f0d1-fa03-4361-a655-624cb6a7477d,1681490529,1746634584
Daily Thunder,https://www.dailythunder.com/,Long-running independent fan blog for the Oklahoma City Thunder.,https://supapjpiqdfzuaordcdx.supabase.co/storage/v1/render/image/public/images/1730324120987-Daily-Thunder-Logo-COLOR-1.png?width=75&height=75&resize=contain,False,['sport & fitness'],999,True,,False,242787,False,,,,#ed4f35,en,999,0,True,a7000721-d56c-41e5-917c-5750c356a064,1730324122,1730311381
Get Goalside,https://www.getgoalsideanalytics.com/,Where the future of football is heading,https://supapjpiqdfzuaordcdx.supabase.co/storage/v1/render/image/public/images/1667674651151-Get-Goalside-mini-icon.png?width=75&height=75&resize=contain,False,['sport & fitness'],930,True,,False,30227327,False,,,,#f3ac5a,en,930,0,True,d9467366-41da-4eef-b08f-27983c1b076e,1667674654,1749921141
The Discourse by Hadley Hammer,https://www.hadleyhammer.com/,"A world-wide community built from sharing experiences and thoughts through stories. A campfire in the mountains, brought safely online written and moderated by professional skier Hadley Hammer.",https://supapjpiqdfzuaordcdx.supabase.co/storage/v1/render/image/public/images/1715958428368-Hammer.svg?width=75&height=75&resize=contain,False,['sport & fitness'],869,True,,False,14081276,False,,,,#5d86b7,en,869,1,True,14b623ef-25d7-44b4-8630-2fb094a431bd,1715958214,1739803980
The Online Rule,https://theonlinerule.com/,Analysing how sports teams use digital tools to engage with fans.,https://supapjpiqdfzuaordcdx.supabase.co/storage/v1/render/image/public/images/1747083761023-white_icon_color1_background.png?width=75&height=75&resize=contain,False,['sport & fitness'],678,True,,False,15327429,False,,,,#007041,en,678,3,False,9e7f1a91-e6ee-4689-8bcc-aef8b23aaa70,1677081686,1749562550
Aikido Takemusu,https://www.aikidotakemusu.org/,"Découvrez l’Aikido Takemusu, l'art martial traditionnel d'O Sensei Morihei Ueshiba, d'abord avec la méthode qu'enseigna Morihiro Saito au dojo d'Iwama, puis au-delà de cette méthode",https://supapjpiqdfzuaordcdx.supabase.co/storage/v1/render/image/public/images/1663504883829-tai2_0-4.png?width=75&height=75&resize=contain,False,['sport & fitness'],586,True,0,True,200413,False,,,,#a21637,fr,586,6,True,3c1dc198-eb9f-48ef-83d8-38495db7bd6d,1663504885,1751824706
Grant Giles,https://www.grantgiles.com.au/,"Grant Giles is a high-performance triathlon coach, podcaster and mental skills coach.",https://supapjpiqdfzuaordcdx.supabase.co/storage/v1/render/image/public/images/1668920512986-1662549862559-29F343E8-47D5-42F1-A17B-5D63C57C75B6.jpeg?width=75&height=75&resize=contain,False,['sport & fitness'],579,True,,False,9607285,False,,,,#143AA2,en,579,1,True,76046ff8-eafc-4cf3-a754-2958ea8ca08a,1662549864,1751845027
Tomball Kings,https://tomballkings.org/,"We are a competitive, high school baseball program for Houston-area student-athletes who are homeschooled. We also offer academic advising, sports performance, player development, and youth programs.",https://supapjpiqdfzuaordcdx.supabase.co/storage/v1/render/image/public/images/1697550697287-kings-logo-royal-transp-100x100.jpg?width=75&height=75&resize=contain,False,['sport & fitness'],505,True,0,True,76443416,False,,,,#0432ff,en,505,3,True,bb2de439-14db-4a25-9446-0c17d86827a2,1697550698,1749832597
Calcio Square,https://calciosquare.com/,Experience the stories and rivalries that make Serie A the most compelling league in Europe,https://supapjpiqdfzuaordcdx.supabase.co/storage/v1/render/image/public/images/1738897730175-reverted_to_original_logo.jpg?width=75&height=75&resize=contain,False,['sport & fitness'],251,True,0,True,10499736,False,,,,#CD212A,en,251,0,True,00fb620f-c7aa-47a5-8c57-867a53d84b93,1738897731,1738877943
Out and Out Football,https://www.outandout.football/,A home for LGBTQ+ football fans. A newsletter about queer identity and football. Published occasionally.,https://supapjpiqdfzuaordcdx.supabase.co/storage/v1/render/image/public/images/1705070239169-OOF-logo-high-res.png?width=75&height=75&resize=contain,False,['sport & fitness'],206,True,,False,5927749,False,,,,#ff1a75,en,206,0,True,c6d494e9-c0d9-4cbf-aecf-ef5e4912d9be,1705070240,1705067297
Trigger The Press,https://trigger-the-press.com/,Modern football news for the cultured football fan.,https://supapjpiqdfzuaordcdx.supabase.co/storage/v1/render/image/public/images/1710324422119-Trigger-The-Press-ICON-Logo.webp?width=75&height=75&resize=contain,False,['sport & fitness'],172,True,,False,8499334,False,,,,#202020,en,172,9,True,21b41240-49fa-4ee5-bedd-e189ac8c3532,1708286424,1740479040
raceweek,https://raceweek.com.au/,Motorsport news from Australia and around the world.,https://supapjpiqdfzuaordcdx.supabase.co/storage/v1/render/image/public/images/1742730487973-square.png?width=75&height=75&resize=contain,False,['sport & fitness'],99,True,,False,495684,False,,,,#000000,en,99,8,True,dae1e12c-e1bd-4ee0-a212-a9502d9ef72c,1741786976,1751254560
Hybrid Athlete Pro,https://www.hybridathletepro.com/,"Exploring hybrid athlete sports and fitness, with articles by experts, athlete interviews, and tips on training, nutrition, and competition.",https://supapjpiqdfzuaordcdx.supabase.co/storage/v1/render/image/public/images/1677534810566-Blog%20Medium.png?width=75&height=75&resize=contain,False,['sport & fitness'],90,True,0,True,5915991,False,,,,#DA78FF,en,90,6,True,5a431865-532e-41cd-9f4c-5047c2f4e6d3,1677534811,1691665145
Grit Run Club,https://www.gritrunclub.com/,Get weekly actionable tips on how to stay healthy and run faster.,https://supapjpiqdfzuaordcdx.supabase.co/storage/v1/render/image/public/images/1690692761591-Logo--2--2.png?width=75&height=75&resize=contain,False,['sport & fitness'],83,True,,False,176048825,False,,,,#00a3e0,en,83,4,True,9ccceac2-b53a-4009-8e97-d9e7467b088e,1690692762,1732126762
CAN - Calistenia Avanzada y Nutrición,https://www.canworkout.pro/,Tu newsletter para mejorar en calistenia y lograr tu mejor forma física con contenido valioso y motivador.,https://supapjpiqdfzuaordcdx.supabase.co/storage/v1/render/image/public/images/1704201765061-CANlogo%20BUENO.png?width=75&height=75&resize=contain,False,['sport & fitness'],70,True,0,True,10499926,False,,,,#0040ff,es,70,0,True,ba6facc3-9f4e-4356-9fa4-1084993f6043,1704201766,1703840403
DC ANALYTICS KENYA,https://dc-analytics-kenya.ghost.io/,Data-driven newsletter for Kenyan Football. 📈 Player and Team Recruitment Consultants,https://supapjpiqdfzuaordcdx.supabase.co/storage/v1/render/image/public/images/1736532257164-SAVE_20250110_054015.jpg?width=75&height=75&resize=contain,False,['sport & fitness'],68,True,,False,10999932,False,,,,#FF1A75,en,68,13,True,5fb7ee6e-af24-4fb6-9f15-48331c8a5d1d,1736532252,1736512486
Volt Fitness,https://volt.fit/,"Programmation et coaching personnel, coaching entreprise, et coaching de groupe dans un centre privé à villeurbanne ! Atteins tes objectifs de santé !",https://supapjpiqdfzuaordcdx.supabase.co/storage/v1/render/image/public/images/1744874450652-voltmonogramme.png?width=75&height=75&resize=contain,False,['sport & fitness'],67,True,,False,10499929,False,,,,#000000,fr,67,0,True,bfe4e6a6-897b-4606-9e10-4f19747fa560,1744874452,1744833563
New Gen Nats,https://newgennats.ghost.io/,"Analysis, Discussion, and Enthusiasm for Nationals Baseball",https://supapjpiqdfzuaordcdx.supabase.co/storage/v1/render/image/public/images/1750102644217-New-Gen-Nats-3-1.png?width=75&height=75&resize=contain,False,['sport & fitness'],0,False,5,True,10499994,False,,,,#AB0003,en,50,0,True,c47f152f-4f6a-44df-b347-f304bbeda379,1750102644,1748554220
BallerzBantz,https://www.ballerzbantz.com/,"Football archive: strategy, scouting, and mechanics",https://supapjpiqdfzuaordcdx.supabase.co/storage/v1/render/image/public/images/1717319086382-Untitled-54.png?width=75&height=75&resize=contain,False,['sport & fitness'],50,True,0,True,20272534,False,,,,#82c430,en,50,0,True,c132a7c0-cbdb-4247-85ca-2bfaee21c461,1717319087,1717257998
The Sidelines,https://thesidelines.lk/,"The Sports Blog that brings you Facts, Stats and Stories!",https://supapjpiqdfzuaordcdx.supabase.co/storage/v1/render/image/public/images/1750413253302-365618516_308407381554287_3034132020297780285_n-6.jpg?width=75&height=75&resize=contain,False,['sport & fitness'],38,True,,False,10499960,False,,,,#808080,en,38,0,True,dc9f5ef6-a2f3-4b11-96e0-75530bdc9178,1750413254,1750255360
Runde Ecke,https://runde-ecke.ghost.io/,Die boxenden Päpste - KickTipp,https://supapjpiqdfzuaordcdx.supabase.co/storage/v1/render/image/public/images/1673018411453-DAC14577-1A9C-49EE-A945-9BB2202AEC74-1.jpeg?width=75&height=75&resize=contain,False,['sport & fitness'],25,True,,False,9999975,False,,,,#35682D,de,25,0,True,b9fb43e3-7f6a-440d-a456-c9eee55972d8,1673018412,1747580201
The Duo Chronicles,https://www.theduochronicles.com/,"This blog contains articles related to Football and Formula 1, sharing with you everything from historical facts and passioned stories to news and personal experiences.",https://supapjpiqdfzuaordcdx.supabase.co/storage/v1/render/image/public/images/1684346290017-The-Duo-Chronicles-Logo-.png?width=75&height=75&resize=contain,False,['sport & fitness'],16,True,,False,684694,False,,,,#05352C,en,16,1,True,268033f3-4d25-4bc3-92fd-c5b72d0ebba4,1684346291,1751038579
News ClimbPhotos,https://news.climbphotos.com/,Climbing Photography News,https://supapjpiqdfzuaordcdx.supabase.co/storage/v1/render/image/public/images/1743462546881-IMG_2787.png?width=75&height=75&resize=contain,False,['sport & fitness'],15,True,,False,10499984,False,,,,#000000,en,15,2,True,e9631859-9c01-4a79-80ab-e2e76e27890d,1742415110,1751662971
Root4Soccer,https://www.root4soccer.com/,Discover the world of soccer and soccer culture on our website! Start exploring today!,https://supapjpiqdfzuaordcdx.supabase.co/storage/v1/render/image/public/images/1679925044403-root-13--600---600-px---16.667---16.667-in---2-.png?width=75&height=75&resize=contain,False,['sport & fitness'],12,True,0,True,9245356,False,,,,#05acee,en,12,1,True,4221836a-2602-427a-88e7-ae4a58f112ed,1679925045,1720791087
War on Ice,https://war-on-ice.ghost.io/,Virtual ice rink for veterans.,https://supapjpiqdfzuaordcdx.supabase.co/storage/v1/render/image/public/images/1749529967513-Untitled-design--95--4.png?width=75&height=75&resize=contain,False,['sport & fitness'],9,True,,False,10499990,False,,,,#000000,en,9,0,True,55deb280-6087-48ea-a59f-521d3daf38cb,1749529968,1749491335
The Grande Report,https://the-grande-report.ghost.io/,"A concise weekly review of the NFL season with box scores and detailed stats. If you are a casual fan or a fanatic, each issue has something for everyone.",https://supapjpiqdfzuaordcdx.supabase.co/storage/v1/render/image/public/images/1749342561640-GrandeIcon-2.gif?width=75&height=75&resize=contain,False,['sport & fitness'],7,True,,False,10499992,False,,,,#ff041b,en,7,0,True,d12cd14f-fd1e-45b3-aa1e-e26c23f18359,1749342563,1749215706
WildlySmitten,https://wildlysmitten.com/,La newsletter des sports d'endurance,https://supapjpiqdfzuaordcdx.supabase.co/storage/v1/render/image/public/images/1726077530456-Wildlysmitten-1.ico?width=75&height=75&resize=contain,False,['sport & fitness'],5,True,,False,8193594,False,,,,#0000FF,fr,5,0,False,6e340222-00a2-4ad9-a980-177b8a9b07eb,1671302396,1739527143
Overtime Orbit,https://overtimeorbit.com/,Your sports universe,https://supapjpiqdfzuaordcdx.supabase.co/storage/v1/render/image/public/images/1721940636434-oto.jpg?width=75&height=75&resize=contain,False,['sport & fitness'],3,True,0,True,10499996,False,,,,#007dcc,en,3,0,False,bf110d6a-0672-4226-8c85-6ed43a888720,1721940638,1721932953
Positive Ice,https://www.positiveice.com/,"Tips and tools to build your curling community, from starting a club to constructing dedicated ice. A complete club building resource with curling podcasts, newsletters and more.",https://supapjpiqdfzuaordcdx.supabase.co/storage/v1/render/image/public/images/1715101310327-POSITIVE_ICE_011224_art-1.png?width=75&height=75&resize=contain,False,['sport & fitness'],3,True,0,True,143564382,False,,,,#ff0e35,en,3,0,True,d241b393-88d2-4cea-838a-4b9a9405329e,1715101311,1715096228
Padelcal,https://padelcal.com/,Scheduling Software for Padel Coaches and Clubs.,https://supapjpiqdfzuaordcdx.supabase.co/storage/v1/render/image/public/images/1734953756588-Logo-padelcal-1.png?width=75&height=75&resize=contain,False,['sport & fitness'],2,True,,False,10499997,False,,,,#000000,en,2,0,True,7f38ed43-883e-40b5-bf54-ecd026064f39,1734953759,1734952495
SweatLogic,https://sweatlogic.ghost.io/,All about Fitness,https://supapjpiqdfzuaordcdx.supabase.co/storage/v1/render/image/public/images/1746022328036-IMG_0454.JPG?width=75&height=75&resize=contain,False,['sport & fitness'],2,True,0,True,11499997,False,,,,#FF1A75,en,2,0,True,22d4d553-f2c7-40a0-8cb3-4069151fbad6,1746022329,1745333090
Aikido Takemusu,https://www.aikidotakemusu.net/,"Discover Takemusu Aikido, the traditional martial art of O Sensei Morihei Ueshiba, first with the method taught by Morihiro Saito at the Iwama dojo, then beyond this method.",https://supapjpiqdfzuaordcdx.supabase.co/storage/v1/render/image/public/images/1716108030433-tai2_0-4.png?width=75&height=75&resize=contain,False,['sport & fitness'],1,True,0,True,10499998,False,,,,#a21637,en,1,0,True,06ac45df-3463-437c-968a-8f9c1306ad46,1716108031,1716047070
PushUpNation,https://pushupnation.ghost.io/,"Transform your life, one push-up at a time. Trade bad habits for strength and discipline. If I can do it, so can you. Join the Push-Up Nation for free today!",https://supapjpiqdfzuaordcdx.supabase.co/storage/v1/render/image/public/images/1737796745598-Push-up_nation.png?width=75&height=75&resize=contain,False,['sport & fitness'],1,True,0,True,11499998,False,,,,#FF1A75,en,1,0,True,d619e636-e7ba-457a-91bb-dd0fcd05f4ae,1737796746,1737796619
Cricket Fan,https://cricketfan.cloud:8080/,Welcome to Cricket FAN – The Ultimate Destination for Cricket Lovers!,https://supapjpiqdfzuaordcdx.supabase.co/storage/v1/render/image/public/images/1731290709392-logo.png?width=75&height=75&resize=contain,False,['sport & fitness'],1,True,0,True,11499998,False,,,,#FF1A75,en,1,0,False,017d439d-4fb6-46b9-9897-2c622ff99bda,1731290711,1731289884
Run. Bike. Code,https://www.runbikeco.de/,Living the active life while preserving some nerdiness.,https://supapjpiqdfzuaordcdx.supabase.co/storage/v1/render/image/public/images/1705263513979-favicon.png?width=75&height=75&resize=contain,False,['sport & fitness'],1,True,,False,12022437,False,,,,#163c77,en,1,0,True,93b38032-bf10-4281-b6b7-4fe64199f9c6,1705263515,1705181283
SwimCare Blog,https://blog.swimcare.be/,Tips & Advies voor zwemmers,https://supapjpiqdfzuaordcdx.supabase.co/storage/v1/render/image/public/images/1726516558663-Facebook-profielfoto.jpg?width=75&height=75&resize=contain,False,['sport & fitness'],1,True,0,True,239135846,False,,,,#3171B8,en,1,0,True,c56272aa-511e-4748-9b87-a5748959e9c8,1726516560,1726516324
Escape Collective,https://escapecollective.com/,"Your number one source of all things cycling. News, reviews, stories, games and Classifieds. Riding is Life.",https://supapjpiqdfzuaordcdx.supabase.co/storage/v1/render/image/public/images/1741909265641-apple-touch-icon.png?width=75&height=75&resize=contain,False,['sport & fitness'],0,False,,False,49384,False,,,,#FF6F42,en,0,0,False,e563023e-bb6b-4c79-9e5a-64c70a03c451,1741908152,1752033134
BasketEurope.com,https://www.basketeurope.com/,"Basket Europe met en lumière tous les championnats français et européens, leurs équipes, leurs stars, leur actualité, leurs histoires et leur Histoire.",https://supapjpiqdfzuaordcdx.supabase.co/storage/v1/render/image/public/images/1710011852848-icon-basketeurope.png?width=75&height=75&resize=contain,False,['sport & fitness'],0,False,,False,1487114,False,,,,#30a7d1,fr,0,0,True,cfcb189e-8bd9-4e7b-9638-fa3bb9ef9f91,1710011854,1710003342
